2020-03-20,#TN_Together_AgainstCorona and No #Local Governance. Appreciate the efforts of TN govt towards COVID-19 outbreak. Yes  indeed inspiring http://efforts.In recent press coverage @Vijayabaskarofl expressed his concern over people gathering in groups and being causal as usual.,Chennai,anger
2020-03-20,@ProfBhargava hi sir ... can we import IgM tests for COVID... why can’t we screen passengers in airports   stations   buses etc ... use this a screener test ?,Chennai,neutral
2020-03-20,#StayAtHome and let's break the chain #COVID2019india #Covid_19 #CoronaStopKaroNa #caronacrisis #IndiaFightsCorona #JanataCurfewMarch22 #CoronavirusOutbreakindia,Chennai,anger
2020-03-20,Let's be Responsible and together #fightagainstcorona #covid_19 #covid #corona #virus #modi #quarantine #wfh #march22 #mannkibaat #janatacurfew #coronavirus #kingmakersiasacademy,Chennai,disgust
2020-03-20,Yes. India is in Crucial 2 weeks of #Covid-19 stage. We need to contain this to avoid community spreading. Folks. #StayHome &amp; Be Safe. Follow The Guidelines. Or less things will get get worsen after March 31st. #IndiaFightsCorona,Chennai,neutral
2020-03-20,#Corona originated in Wuhan Nov 17th. Announced on 31 Dec. In this period 5 Million Chinese traveled globally impacting nations. Compare to Nipah virus announced immediately by India on discovery in 2018. #COVID-19 #Fact &amp; #Impact of #CoronavirusOutbreak,Chennai,neutral
2020-03-20,COVID-19 doing a good job exposing our selfishness. Half of these cases could have been avoided if educated folks just followed the damn rules. And a few more could have been avoided if people took this seriously and stayed at home.,Chennai,sadness
2020-03-20,Stay Home #Corona #CoronavirusPandemic #CoronaStopKaroNa #coronavirusinindia #CoronaCrisis #lockdown #covidindia #COVID #Covid_19 #lettering #procreate #illustration #digitalart,Chennai,sadness
2020-03-20,Please Stay Safe. Support Our Community and Our Nation. #hittheart #officialhittheart #hittheartchennai #chennai #nanganallur #india #covid_19 #corona #awareness #coronavirus #istayedatworkforyouyoustayathomeforus… https://www.instagram.com/p/B99RMbhD9SY/?igshid=17rsvz73z6ppc,Chennai,anger
2020-03-20,@Ethirajans does the number of cases for COVID-19 in TN is correct? Also awareness among people is very less here in TN. Government should not have started working proactively  like other states.,Chennai,sadness
2020-03-20,With this Corona Stress  let us remember our loved ones  beautiful Memories shared with them and Smile... *Stay Happy &amp; Healthy* #corona #coronavirus #covid_19 #happiness #internationaldayofhappiness… https://www.instagram.com/p/B99QZZMj7In/?igshid=13ifvylmeglax,Chennai,joy
2020-03-20,Hey everyone At this time of crisis of covid-19 we are staying at home &amp; cooking our food. Sometimes we get bored &amp; we crave for certain street side food. Do try this quick &amp; easy chaat recipe. You gonna love… https://www.instagram.com/p/B99MDW3lglq/?igshid=1ww132uws5sig,Chennai,joy
2020-03-20,@NinaKraviz Mother Earth has foisted COVID-19 upon us so can see from our windows in self isolation how quickly she gets healthy once we stop abusing her for commercial purposes Ex: The lagoons of Venice now have dolphins and swans inside them again I rest my case ,Chennai,neutral
2020-03-20,@emmaseppala Some good l read: Mother Earth has foisted COVID-19 upon us so can see from our windows in self isolation how quickly she gets healthy once we stop abusing her for commercial purposes Ex: The lagoons of Venice now have dolphins and swans inside them again – at Madras Club,Chennai,neutral
2020-03-20,Mother Earth has foisted COVID-19 upon us so can see from our windows in self isolation how quickly she gets healthy once we stop abusing her for commercial purposes Ex: The lagoons of Venice now have dolphins and swans inside them again I rest my case – at Madras Club,Chennai,neutral
2020-03-20,Go corona go • Fight against Covid - 19 Do : Wash your hands regularly for 20 seconds  with soap and water or alcohol-based hand rub Cover your nose and mouth with a disposable tissue or flexed elbow… https://www.instagram.com/p/B989p6tBkAz/?igshid=1wx92f8f76zil,Chennai,disgust
2020-03-20,Good awareness video by @gvprakash #CoronavirusOutbreak #coronavirus #CoronavirusOutbreakindia #Covid_19,Chennai,joy
2020-03-20,Our government website to give us actual condition in our country. Pure facts and figures. Panic attack is even more deadly than corona #coronavirus #covid-19 #staysafe #letsfighttogether #jsltoothcare #dentist #Awareness #india http://www.mohfw.gov.in,Chennai,sadness
2020-03-20,*...COVID-19...* Never change and nothing change in this society. But  we can change our self  be positive ptotect you  your family members and those around us. *CVaBaB*,Chennai,sadness
2020-03-20,Vital Source has joined leading publishers to offer free access to an expansive catalog of etexts to students at semester-calendar institutions who have been impacted by recent campus closures as a result of the COVID-19 pandemic. Great job! ,Chennai,sadness
2020-03-20,@AskAmex hey Amex! I’ve been on hold for 3 hrs trying to change my flights! What’s up with that? I need to to travel back to the US  how are you going to make this happen? #amextravel #amexplatinum #Covid_19,Chennai,joy
2020-03-20,#Stayhomesunday As Per Prime Minister Request I Accept To Stay At Home on Sunday. i Also Request others to Stay At Home from 7am to 9pm. to Prevent Corona. kindly forward this message as more as possible. -Studio L1 Team #covid #Saveindia,Chennai,neutral
2020-03-20,Dear @PMOIndia @narendramodi sir  at this critical time this customised easy to do economic face shields will protect every health professional! CEAT-Cons &amp; Endo Assoc. of Tamilnadu - COVID 19 Protective Face Shield f... http://youtu.be/kZlQzTDDv3g via @YouTube,Chennai,anger
2020-03-20,Dear @Vijayabaskarofl sir  at this critical time  the customised easy to do economic face shields will protect every health professional! CEAT-Cons &amp; Endo Assoc. of Tamilnadu - COVID 19 Protective Face Shield f... https://youtu.be/kZlQzTDDv3g via @YouTube,Chennai,anger
2020-03-20,Coronavirus in India: Maharashtra tally at 52  confirmed Covid-19 cases cross 200 https://www.indiatoday.in/india/story/coronavirus-india-confirmed-covid-19-cases-report-news-update-latest-positive-1657695-2020-03-20?utm_source=it_sticky_footer via @indiatoday,Chennai,disgust
2020-03-20,What role do ACE-inhibitors and ARB drugs commonly used to treat hypertension play in #Covid_19? Some international position statements after Italy  China experience. #CoronavirusOutbreakindia,Chennai,neutral
2020-03-20,Vazhthukkal sir..we will kick out #Covid together ..u r doing great!! ,Chennai,anger
2020-03-20,Official details and Stats about COVID-19 outbreak in India #CoronavirusOutbreakindia #CoronaVirusUpdate #COVID19 #StaySafeStayHome #WashYourHands #chennai https://covidout.in/,Chennai,disgust
2020-03-20,lots of people quarantined. But TN govt seems to say only 3 covid.. Tough to believe when neighbouring states like Karnataka  telengana  Andhra Kerala all have many cases. In TN they've done v. less testing. So we feel tn data not correct.,Chennai,sadness
2020-03-20,COVID-19: Now  people can access information  self-report online in Tamil Nadu: @serenasundar @THChennai @the_hindu,Chennai,anger
2020-03-20,Lets do it ... It works! . . #socialdistancing #covid_19 #covid #corona #janatacurfew #janatacurfewindia @Chennai https://www.instagram.com/p/B98Nt0eHd8I/?igshid=5odughu6bo9s,Chennai,neutral
2020-03-20,You  in your haste to criticize  even mildly  for a change  overlooked  perhaps deliberately.The P. M. said that the covid -19 economic matters will be announced shortly by a committee  headed by the F. M.,Chennai,neutral
2020-03-20,Stay Home #Corona #CoronavirusPandemic #CoronaStopKaroNa #coronavirusinindia #CoronaCrisis #lockdown #covidindia #COVID #Covid_19 #lettering #procreate #illustration #digitalart,Chennai,sadness
2020-03-20,#Argentina announces a complete lock-down from today till March 31st.. No-one will be allowed to leave home.. #CoronaVirusUpdate,Chennai,surprise
2020-03-20,I learnt the following after being in a lock down since last week: 1. Why the bathrooms and toilets were *outside* our houses and not *inside*. https://m.facebook.com/story.php?story_fbid=3037462919620782&amp;id=100000713126467?sfnsn=wiwspmo&amp;extid=DzNbKtC9X1rNsTsZ,Chennai,neutral
2020-03-20,#JanataCurfew Adding strength to the fight against coronavirus PMModi urged the state governments  organisations like the NCC &amp; NSS which are led by youth  civil society and other organisations to actively encourage citizens to follow ‘Janata Curfew’ and stay inside their homes.,Kolkata,neutral
2020-03-20,#JanataCurfew PM Modi urged everyone to call and inform at least 10 other people every day about the importance of ‘Janata Curfew’ and ways to fight coronavirus. via NaMo App,Kolkata,neutral
2020-03-20,Here are some of India’s efforts towards combatting the menace of COVID-19 Novel Coronavirus. https://twitter.com/narendramodi/status/1239226090129776641 via NaMo App,Kolkata,disgust
2020-03-20,Some ideas on how SAARC nations can work together to tackle the COVID-19 Novel Coronavirus. https://twitter.com/narendramodi/status/1239226175508983810 via NaMo App,Kolkata,neutral
2020-03-20,‘Be alert  attentive and aware’ - Virat Kohli  coach Ravi Shastri & other Indian cricketers laud PM Modi’s speech on coronavirus https://www.hindustantimes.com/cricket/be-alert-attentive-and-aware-virat-kohli-coach-ravi-shastri-other-indian-cricketers-laud-pm-modi-s-speech-on-coronavirus/story-KxRReIa82PRksgTC79i5IL.html via NaMo App,Kolkata,neutral
2020-03-20,Janta Curfew: Akshay Kumar  Ajay Devgn  other celebs applaud PM Modi's initiative to combat coronavirus outbreak https://www.dnaindia.com/bollywood/report-janta-curfew-akshay-kumar-ajay-devgn-other-celebs-applaud-pm-modi-s-initiative-to-combat-coronavirus-outbreak-2817847 via NaMo App,Kolkata,neutral
2020-03-20,Coronavirus Outbreak: In address to the nation  PM Modi gives 9 call to actions this Navratri https://www.dnaindia.com/india/report-coronavirus-outbreak-in-address-to-the-nation-pm-modi-gives-9-call-to-actions-this-navratri-2817821 via NaMo App,Kolkata,neutral
2020-03-20,@flyspicejet your rep says corona virus will be over by 2nd April when I called to cancel my ticket. If your rep is true india will bless. Recording attached. #SpiceJet #CoronavirusOutbreakindia @ndtv @ZeeNewsHindi @YouTube @aajtak,Kolkata,disgust
2020-03-20,To join the fight against coronavirus  I have taken the Janta Curfew Pledge and committed myself towards keeping the country safe. You can also take the pledge at https://pledge.mygov.in/janatacurfew/ https://pledgeapi.mygov.in/api/v2/janatacurfew/share/individual/9544359834 via @mygovindia,Kolkata,neutral
2020-03-20,@PMOIndia @narendramodi @drharshvardhan Complete lockdown is essential to save the country. Saving India from Corona Virus community transmission is the biggest challenge for next some weeks. People need to follow the discipline and behave sensibly. ,Kolkata,surprise
2020-03-20,When I wrote this in Jan it was after almost 20 days of reading on it  it's March now  a quarter of an important year gone. Now  I won't be posting much on Coronavirus because it has come to India  you can do post mortem's only till its not a loved ones body. Peace &amp; Prayers ,Kolkata,joy
2020-03-20,Actually congress MLAs are much more scary n worried about an Italian Corona virus ,Kolkata,fear
2020-03-20,How many of you have survived #CoronaVirus? Now be the online peer to peer volunteer to guide other step by step process. Help them to restore calm. @Facebook please create a survivor mark so people can connect with survivor to ask basics. @Google #coronasurvivor #survivor @WHO,Kolkata,neutral
2020-03-20,@narendramodi RESPECTED SIR KINDLY MY REQUEST TO YOU IS JUST SHUT DOWN ALL PUB &amp; BAR BECAUSE MANY ILLITERATE PEOPLE STILL ARE PLAYING WITH THEIR &amp; OTHERS LIFE #CoronaVirus,Kolkata,anger
2020-03-20,#जनता_कर्फ्यू StayHome StaySafe! Beat #Coronavirus @navneetgiria @GiriaRahul @vineet_hirawat @SanyamHirawat @HirawatSanj @payalbothra1982 @SunandaBaid @amitjain_1 @MangalNahata @deepak1908 @Vijaymittal8 @kamal56 @rajeshsurana440 @paritosh2608 @JasBJP @Bunibroto @dharmvirjangra9,Kolkata,neutral
2020-03-20,Anti Corona virus song from film Saqi. Released in 1952.. ,Kolkata,disgust
2020-03-20,If its true  then nothing like it: Coronavirus: রাজ্যের প্রথম করোনা আক্রান্ত তরুণের বাবার সদস্যপদ খারিজ করল IMA - father of 1st corona infected patient of bengal faces suspension of membership from ima | Eisamay - http://eisamay.com/kfUl_Z/lmz https://go.onelink.me/kN2v/44345e76,Kolkata,sadness
2020-03-20,All the news channels are finally getting to play movie songs  show photoshoots  dancing videos etc in the pretext of reporting Kanika Kapoor's Coronavirus stuff.,Kolkata,joy
2020-03-20, SAVE TREE SAVED EARTH BEWARE FAKE NEWS OF CORONA VIRUS ⚘Freands pichle 3din se aap 1516 jan hume FOLLOW kiya hai par me chate huye v FOLLOW back nahi kar pa rha hu mera TWITTER pe Following stop ho gaya hai..i am so SORRY EVERY FOLLOWERS ⚘ ,Kolkata,neutral
2020-03-20,So our immunity does nothing to fight Coronavirus is it?,Kolkata,anger
2020-03-20,Hydroxychloroquine or a more toxic Chloroquine Phosphate are given in autoimmune disorders such as Lupus  Rheumatoid Arthritis in which the immunity attacks body's cells and it regulates/suppresses the immunity. How can it possibly fight a Viral Infection? #Coronavirus,Kolkata,sadness
2020-03-20,Corona virus is truly dangerous but it seems we are unnecessarily pressing the buttons of over pessimism. We must be rational &amp; we must not inject hopelessness into the minds of people unnecessarily ,Kolkata,fear
2020-03-20,Banks & Stock Market offices to remain open even as privates offices asked to remain shut due to Novel Coronavirus outbreak. Banks &amp; Stock Market workers: ,Kolkata,surprise
2020-03-20,Image get down from the frame due to fear of Corona Virus ,Kolkata,fear
2020-03-20,BBC News - Coronavirus: When will the outbreak end and life get back to normal? https://www.bbc.co.uk/news/health-51963486 Follow @BBCWorld so as to get more updates.,Kolkata,neutral
2020-03-20,Travellers working people & students returning from European and Middle East countries to their respective countries for safety & protection are already infected with CORONAVIRUS are major cause of concern &amp; threat. It is very infectious disease &amp; started spreading from China.,Kolkata,fear
2020-03-20,Nopes ..If that would have been the case ...we would have seen huge reporting by Govt and Private hospitals regarding respiratory related illnesses and deaths ...and considering the widespread awareness about Corona Virus   it would have exploded on social media platforms,Kolkata,disgust
2020-03-20,CRUX OF THE MATTER is how early your will come up with Antidotes of CORONAVIRUS? Short live life is very important for all of us in today's context to combat fatal CORONAVIRUS....,Kolkata,neutral
2020-03-20,It’s sad and scary that a lot of people are still not understanding the scale and magnitude of Corona Virus  and treating it like they would a common cold or flu  please educate yourself and behave responsibly  you are playing with your life and your loved ones.Stay quarantined ,Kolkata,sadness
2020-03-20,@narendramodi @PMOIndia Honourable Sir  need to look the private offices also as per my opinion the private offices should be off till 2nd April if we want to stop the spread of Corona Virus.,Kolkata,disgust
2020-03-20,Why CORONAVIRUS is so cruel to senior citizens of above 60 yrs? Now we understood &amp; joined the forces to combat you corona by distancing you from us through home isolation .,Kolkata,fear
2020-03-20,Yuval Noah Harari looks into the future into the world after coronavirus ,Kolkata,neutral
2020-03-20,So  the #Bengal is getting the #coronavirus from #London #UK ? What a shitty thing,Kolkata,anger
2020-03-20,Cricket unlikely to start before Sept./Oct. IMO. 'Coronavirus: What's at stake for cricket in 2020?' https://es.pn/2J1xwCT http://es.pn/ciapp,Kolkata,neutral
2020-03-20,@MamataOfficial Mam need to look the private offices also as per my opinion the private offices should be off till 2nd April if we want to stop the spread of Corona Virus.,Kolkata,disgust
2020-03-20,Two Corona virus cases diagnosed in Kolkata are from London. What a similarity!,Kolkata,surprise
2020-03-20,West Bengal Governmet bulletin on #coronavirus situation in the state as on March 20 2020. Two persons have tested positive for #coronavirus infection in the state so far. @DeccanHerald #CoronavirusOutbreakindia #Covid_19,Kolkata,joy
2020-03-20,Any connection of #CoronaVirus with #Bitcoin? Economy Down  Banking failure  Digital Circulation  Disinvestment  RBI Dollar Swap  Surprising Nifty Sharp recovery after collapse  New World Order  World Government  New financial order??? #stockmarket #conspiracytheory,Kolkata,surprise
2020-03-20,Reduce your risk of Corona virus infection. #CoronaStopKaroNa,Kolkata,disgust
2020-03-20,Lok sabha MP Dushyant Raje n his mother Vasundhara Raje attend a party in Lucknow which was also attended by Kanika Kapoor. Kanika turns out to be Corona+. Meanwhile  Dushyant goes to parliament. Others at the party attend UP Govt meeting. #Corona #Coronavirus #COVID2019 #COVID19,Kolkata,neutral
2020-03-20,But by changing plates we will overcome. Heard about clanging loudly to scare away wild elephants in Bengal and Kerala forests. Is Corona virus a wild elephant ? I think do6 according to our Supreme leader. And media bgwigs climax at the stupidity ,Kolkata,surprise
2020-03-20,Interesting read from expert on virus regarding Corona Virus. https://www.telegraphindia.com/health/coronavirus-sars-cov2-like-the-influenza-virus-will-likely-be-with-us-for-a-long-long-time/cid/1755788 Jai Hind,Kolkata,disgust
2020-03-20,Coronavirus Outbreak: In address to the nation  PM Modi gives 9 call to actions this Navratri https://www.dnaindia.com/india/report-coronavirus-outbreak-in-address-to-the-nation-pm-modi-gives-9-call-to-actions-this-navratri-2817821 via NaMo App,Kolkata,neutral
2020-03-20,How to protect yourself from Coronavirus ? Video uploaded to Channel. Lets watch : https://bit.ly/2Us82Uu #corona #protectyourself #koronavirüsü #howtoprotect #coronavirus #artmakersindia @West Bengal https://www.instagram.com/p/B980_NvJ91p/?igshid=lukyn6cbd68,Kolkata,surprise
2020-03-20,Using #data from Johns Hopkins University  Reddit user Edward-EFHIII created a #heatmap that tracks the spread of #COVID19 across the world since late January. It demonstrates the speed at which the #Coronavirus outbreak is spreading throughout the world. ,Kolkata,neutral
2020-03-20,Ajay Devgn  Shabana Azmi  Mahesh Bhatt and other Bollywood celebs praise PM Narendra Modi's address to the nation on Coronavirus outbreak. Really Indian football legend P K Banerjee has died  says family source.,Kolkata,sadness
2020-03-20,#IBM's #Summitsupercomputer identified 77 drug compounds that could stop the #coronavirus spike from infecting host cells. This could help scientists create the most effective vaccine. ,Kolkata,sadness
2020-03-20,The PM said it is very important for every Indian to remain aware and alert. Follow the advice of Our Prime Minister Keep Social Distancing & Tomorrow will be Public Curfew to defeat Corona Virus. Please come forward and don't VIRUL the Virus Corona ,Kolkata,neutral
2020-03-20, Cold weather &amp; snow CANNOT kill the coronavirus. The coronavirus CAN be transmitted in areas with hot &amp; humid climates There is NO evidence that pets such as dogs or cats can transmit the coronavirus. Taking a hot bath DOES NOT prevent the coronavirus,Kolkata,neutral
2020-03-20,Meanwhile corona virus to India : ,Kolkata,neutral
2020-03-20,Coronavirus: US records 4 000 new cases in one day Stay safe and take care of yourself. #Coronavirus ,Kolkata,neutral
2020-03-20,Bharatiyas stranded in South Asian Countries wanting to come home must be allowed. Screening for #coronavirus should be conducted  but entry must be allowed. @narendramodi @AmitShah @JPNadda,Kolkata,anger
2020-03-20,The total number of coronavirus cases in Maharashtra rose to 4.#CoronaVirusUpdate #coronavirusinindia #Corona #Coronafighters,Kolkata,sadness
2020-03-20,Thank you Amitji for sharing an excellent informative video.. The whole world today is a big family.. .. Together we can break #CoronavirusOutbreak #coronavirus #Covid19,Kolkata,joy
2020-03-20,Social distancing will win hands down if not coronavirus. ,Kolkata,joy
2020-03-20,Let's Beat Corona Virus Together | Stay Away | Stay Safe SHARE AS MUCH AS YOU CAN https://youtu.be/6EvwzpN7Vvc #CoronavirusOutbreakindia #JanataCurfew #Covid19India #CoronaVirusUpdate #CoronaVirusPakistan #,Kolkata,neutral
2020-03-20,N95 masks are for those treating covid -19 patients  Patients with corona virus  family members of the positive patients. Do not waste it by using unnecessarily &amp; thus creating shortage for the actually needful. Be educated enough before jumping into anything. #IndiaFightsCorona,Kolkata,disgust
2020-03-20,‘Be alert  attentive and aware’ - Virat Kohli  coach Ravi Shastri & other Indian cricketers laud PM Modi’s speech on coronavirus https://www.hindustantimes.com/cricket/be-alert-attentive-and-aware-virat-kohli-coach-ravi-shastri-other-indian-cricketers-laud-pm-modi-s-speech-on-coronavirus/story-KxRReIa82PRksgTC79i5IL.html via NaMo App,Kolkata,neutral
2020-03-20,Devotion !...Corona virus is really active on Sunday from 7 am to 9pm....our Modiji did beat corona in its own game..... No infections from 9 pm onwards what a relief..,Kolkata,neutral
2020-03-20,Janta Curfew: Akshay Kumar  Ajay Devgn  other celebs applaud PM Modi's initiative to combat coronavirus outbreak https://www.dnaindia.com/bollywood/report-janta-curfew-akshay-kumar-ajay-devgn-other-celebs-applaud-pm-modi-s-initiative-to-combat-coronavirus-outbreak-2817847 via NaMo App,Kolkata,neutral
2020-03-20,Janta curfew this Sunday  don’t step out  PM Modi urges people in address on coronavirus https://www.hindustantimes.com/india-news/janta-curfew-this-sunday-don-t-step-out-pm-modi-urges-people-in-address-on-coronavirus/story-o18qkCoSdQl9I1sbXv3qhO.html via NaMo App,Kolkata,neutral
2020-03-20,"Trump to the Reporter about Coronavirus briefing: ""You're actually sitting too close."" Trump said at one pt. ""Really we should get rid of about 75 -80 percent of you. I'll have just two or three of you that I like this room. I think thats a great way of doing it.""",Kolkata,disgust
2020-03-20,@goibibo pnr XENYGH Have complainant repeated times. Till date no response. Trying to reschedule due to corona virus  from past 2 weeks. Kindly contact. Check DM  email  @goibibo @goairlinesindia . Ticket attached.,Kolkata,neutral
2020-03-20,In the midst of #CoronaVirus out break we Indian(s) have forgotten that today is an important day. 4 convicted in #NirbhayaCase has been hanged in d morning setting an example 2 all other tat India is not going 2 stop 4m giving punishment during this emergency. #IndiaFightsCorona,Kolkata,anger
2020-03-20,"Photo of Trump's notes shows ""Chinese virus"" written over ""Coronavirus"".",Kolkata,neutral
2020-03-20,"The First Lady releases coronavirus PSA: "" This is not how we'll live forever.""",Kolkata,neutral
2020-03-20,Second case of #Coronavirus reported from posh locality in Ballygunge from #Kolkata. The affected returned from the UK via Delhi. Infected has been isolated at Beleghata ID hospital. #CoronavirusOutbreakindia #Coronaindia #Covid19India,Kolkata,sadness
2020-03-20,President Trump and @VP Mike Pence interact with the State Leaders about the U.S. Coronavirus response.,Kolkata,disgust
2020-03-20,Observe Janta Curfew on 22/03/2020 to fight against Corona Virus and our prime support to our PRIME MINISTER SHREE NARENDRA MODIJI ,Kolkata,anger
2020-03-20,The whole world is engulfed with Corona virus but India will celebrate today. India got justice after 7 long years. Hope Indian judicial will serve justice to the other rape victims of India like Nirbhaya. Hope India will learn something from this. #NirbhayaCase,Kolkata,joy
2020-03-20,How Brazilians bang pots and pans from their balconies to protest Jair Bolsanaro’s handling of the coronavirus pandemic . We can learn this new form of protest at the time of disaster! #janta_curfew #CoronavirusOutbreakindia,Kolkata,surprise
2020-03-20,There is JANTA CURFEW to fight coronavirus . I support and we should all take part and keep fighting this Covid19 #janta_curfew #CoronavirusOutbreakindia,Kolkata,surprise
2020-03-20,EU Admits They Underestimate the Coronavirus Threat https://www.jerusalemonline.com/eu-admits-they-underestimate-the-coronavirus-threat/ via @JOL,Kolkata,sadness
2020-03-20,Regional passport office  Kolkata and all passport Seva Kendras and post office passport Seva Kendras were shut down for an indefinite period  in the wake of novel corona virus (Covid-19) pandemic,Kolkata,anger
2020-03-20,22-year-old man  who returned from England recently  tests positive for #coronavirus in Kolkata; second case in West Bengal,Kolkata,joy
2020-03-20,Corona virus sent me friend request on Facebook. ,Kolkata,disgust
2020-03-20,#IndiaFightsCorona Let’s break the #COVID19 MYTHS How deadly is coronavirus ONLY 2 % MORTALITY Can an infected person recover completely OF COURSE Why can only designated labs test infected people IT IS HIGHLY INFECTIOUS Why is there panic RUMOUR MONGERING ,Kolkata,neutral
