2020-03-17,Why fighting the coronavirus depends on you https://youtu.be/dSQztKXR6k0 via @voxdotcom,Pune,neutral
2020-03-17,Our poor Afghan children how you can deal with this coronavirus  we should desert hospital on Iran and Afghanistan boarder  ,Pune,sadness
2020-03-17,Now u can use this .....for safety of your gf.. #coronavirus @imVkohli #CoronavirusOutbreak @AnushkaSharma – at Balaji Institute Of International Business,Pune,anger
2020-03-17,We are fighting for #coronavirus and here I Found very Clean place in the world @PMCPune How people can be so careless very ridiculous,Pune,neutral
2020-03-17,Why fighting the coronavirus depends on you https://youtu.be/dSQztKXR6k0 via @YouTube,Pune,neutral
2020-03-17,GOI must declare medical emergency and each and every private hospital of India with more than 100 beds should be forced to test 100 tests for Corona Virus free of Cost.,Pune,surprise
2020-03-17, PRAY FOR WORLD PEACE #corona #coronavirus #Covid-19 @Pune  Maharashtra https://www.instagram.com/p/B91xkjmFtxD/?igshid=1g45uyz4z9cyy,Pune,anger
2020-03-17,Myth #5: Coronavirus lives in the throat. So drink lots of water so the virus is pushed into the stomach where the acid will kill it. Virus may gain entry via throat but it penetrates into the host cells. You can’t wash it away. Excessive water will make you run to the toilet. ,Pune,disgust
2020-03-17,Is rise in Temperature good sign or bad sign to enhance or decrease the spread of the #coronavirus ?? ,Pune,joy
2020-03-17,So I’m hearing many myths about #COVID-19 and would like to quickly clear the record. Coronavirus will go away in Sumer months. Wrong. Previous pandemics didn’t follow weather patterns plus as we enter summer  there will be winter in the Southern Hemisphere. Virus is global. ,Pune,neutral
2020-03-17,I liked the initiative by @zeemarathi - Running a timer in-between daily soaps  for 20 secs  telling viewers that 'zee marathi' will wait for us while we go &amp; wash our hands  &amp; hammering about such hygiene habits. #coronavirus #CoronavirusOutbreak #COVID2019 #covidindia,Pune,neutral
2020-03-17,#WFH is basically me working throughout 24hr cycle as and when possible  as much as possible This is a good opportunity to get rid of those tasks rotting in my office work #ToDo list #work #life #coronavirus ,Pune,joy
2020-03-17,.@iamsrk @amirkingkhan @FarOutAkhtar @Javedakhtarjadu Help @ArvindKejriwal  MHA &amp; #India to remove protesters at #ShaheenaBagh. Life time chance to become Real Hero from Reel. Action.. #coronavirus #CoronavirusOutbreak @SrBachchan @Suhelseth #COVID2019 @AnupamPKher @PMOIndia,Pune,anger
2020-03-17,Any ideas over advertising on corona virus live update sites? Sorry if that's mean but you've got to advertise. ,Pune,sadness
2020-03-17,Work is like herding cats. Coronavirus got everybody crazy. Not 100% sure of what's going to happen when we travel back. But smiling anyway  cause God is in control! To all of you… https://www.instagram.com/p/B91rSGQJ1tIIlHce2Oit_t28nA0nOrUl0zE7Mk0/?igshid=188dys1qex4c0,Pune,joy
2020-03-17,I’ve successfully blocked words #coronavirus and #COVID2019. Life’s good now. ,Pune,joy
2020-03-17,By placing #faith above #reason  Iran’s theocrats not only endangered the population but risked a kind of self-decapitation. #science #epidemiology #epidemic #coronavirus #CoronavirusOutbreak #religion #politics,Pune,neutral
2020-03-17,Eating (sneaking) out in times of #coronavirus. Hand-sanitizer compulsory. #biryani @Aab-O-Daana https://www.instagram.com/p/B91pWevHh9f/?igshid=dwzxtv4vavun,Pune,anger
2020-03-17,Protect Yourself and Others Corona Virus in Pune #staysafe #corona #pune #puneblogger #punekar #punediaries #puneinsta #protect #staystrong #stayhealthy #staysafe #covıd19 #india #maharashtra #washyourhands #waremask #usesanitizer #takecare #punecity #puneindia #indian #care,Pune,anger
2020-03-17,@mygovindia kindly collaborate with @oyorooms for the quarantine facility for the #Coronavirus affected people's isolation as they have large access and facilities at every city of the country. @PMOIndia @narendramodi @CMOMaharashtra @rajeshtope11 #IndiaFightsCorona #covidindia – at Pune | पुणे,Pune,anger
2020-03-17,Must watch video reflecting that we are cautious about #coronavirus #COVID2019,Pune,joy
2020-03-17,If every conceivable precaution is taken at first  one is often too discouraged to proceed at all. #prevention #precautions #healthyliving #corona #coronavirusitalianews #coronaextra #coronavirus @Pune  Maharashtra https://www.instagram.com/p/B91dKUXJNom/?igshid=1b0qkc4u2xj7b,Pune,sadness
2020-03-17,COVID-19 will kill 250 000 in UK if theres no draconian measures. #Sakal #SakalNews #viral #ViralNews #SakalTimes #news #Corona #CoronavirusOutbreak #CoronaAlert #COVID #coronavirus ,Pune,anger
2020-03-17,Do you think countries #lockdown is correct decision to stop #spreading of #coronavirus #travellockdown #travelmemories #vacaymemories #Asia #relaxing #wanderlust #bali #india #europe #italy #indiangovernment #airasia #scoot #malindo #singapore #dubai #unitedstates,Pune,fear
2020-03-17,#corona virus Good initiative by Pune Vyapari Sangh 3 day Market close #Laxmi Road #Tulshi bag all closed,Pune,neutral
2020-03-17,Corona virus create serious problems at Mumbai  pune  nagpur other cities in Maharashtra for safety purpose lock down Mumbai for 1 week  stop all public transport  local  train  buses in mumbai to control spread carona virus  support all public to govt to control situations,Pune,anger
2020-03-17,#Maharashtra To be extra careful ! Stay Home ! Life will be back to normal soon ! #COVID2019 #CoronavirusOutbreak #coronavirus #covidindia #stayhomechallenge,Pune,sadness
2020-03-17,.@PuneCityPolice Even u ppl hv sense but politicians r moving with posse of 10 - 15 assistants. Morons! @PMOIndia @OfficeofUT @Dev_Fadnavis @rajeshtope11 #CoronavirusOutbreak #coronavirus ,Pune,anger
2020-03-17,Guys Tea Time Wash your Hands Have a ginger tea/green tea Wash Hands then Get back to couch and get the issue fixed ! @drharshvardhan @narendramodi @PMOIndia @sandeep_chavda @PiyushGoyal @GoI_MeitY #WorkFromHome #FightagainstCoronavirus #coronavirus #Coronafighters,Pune,sadness
2020-03-17,Today I visit bank but feel like I'm in hospital...what the f**k is corona. #COVID2019 #coronafightindia #coronavirus #CoronavirusPandemic #BhulaDungaFirstLook #CautionYesPanicNo #takecaresaveother #bankvshospital #,Pune,joy
2020-03-17,Guys everyone Take Care #coronavirus is spreading rapidly... Share #SelfieWithMask to care &amp; aware others to use it... @AUThackeray @MarathiBrain,Pune,joy
2020-03-17,Was being told that coronavirus is God's wrath upon for all the sins. For the lust and greed and the lack of community and how we're all stuck to our phones. They also learnt at that moment  after three years of knowing me  that I'm an atheist. Fun conversation.,Pune,surprise
2020-03-17,@PMOIndia many work places are not allowed to work from home. @MoHFW_INDIA places like banks  hotels are highly exposed #coronavirus #covidindia #COVID2019,Pune,joy
2020-03-17,@PMOIndia Please focus on Corona virus issue than politics in the country as this is more important than anything else..,Pune,neutral
2020-03-17,Section 144 has being imposed in Pune . Do not think about your Bills and EMI's as of now  help each other with Food  Groceries and etc... . This shall pass be positive and always live to inspire. #spreadtheword #coronavirus #letshelpeachother #CoronavirusOutbreak – at keshav nagar,Pune,neutral
2020-03-17,Govt is asking to work from home due to coronavirus outbreak. And honestly saying this @VodafoneIN is not able to improve their network. How am I suppose to WFH with such shitty internet connection. #coronavirus @CMOMaharashtra,Pune,sadness
2020-03-17,#COVID2019 #CoronavirusOutbreak Tukde tukde gang and liberals can easily stop the corona virus spread  cause they are best at dividing the people and help them in social distancing.,Pune,disgust
2020-03-17,A very effective way twrds corona virus ctrl is to educate your maid   security gaurd and others..The below poverty line guys needs max attention. I m doing my part by spreading awareness &amp; every 1 shld Dear @narendramodi @drharshvardhan Bpl   poor people are at utmost risk,Pune,sadness
2020-03-17,Tukde tukde gang and liberals can easily stop the corona virus spread  cause they are best at dividing the people and help them in social distancing.,Pune,disgust
2020-03-17,@flyspicejet I'm looking to cancel my flight booking  but not allowed to. Knowing that coronavirus is around the corner  how can one plan a travel in this situation. This is terrible from airlines  bot allowing cancellations. #corona #virus #coronavirus #airlines #SpiceJet,Pune,disgust
2020-03-17,@Olacabs @Uber_India as per RBI governor #coronavirus can spread through the notes as well. Can you please ask Cabs and Auto to accept rather than cash if possible. Recently I tried but they are not accepting. I registered complaint for the same. @narendramodi #coronavirusindia,Pune,neutral
2020-03-17,Simple remedy for #coronavirus Each time you come home from outside prepare a glass of hot salt water Deeply inhale the hot steam a few times Drink few sips of the hot water This will destroy all bacteria/virus that might have entered your nose &amp; mouth while you were outside.,Pune,neutral
2020-03-17,"The entire world is putting all efforts in fighting the deadly #CoronaVirus. Hopefully we will be able to ""defeat"" it soon. Once we are done with it  we will get back at its ""creator""  CHINA. Chinese virus #CoronavirusOutbreak",Pune,neutral
2020-03-17,@mygovindia Simple home remedy against #coronavirus: Each time you come home from outside prepare half a glass of hot salt water Deeply inhale the steam a few times Drink few sips of the hot water This will destroy all bacteria &amp; virus that might have entered your nose &amp; mouth,Pune,surprise
2020-03-17,While the world is dealing with Coronavirus  this gentleman is labelling it as Wuhan disease/Chinese virus. The message is loud &amp; clear. ,Pune,anger
2020-03-17,Coronavirus: First human trial for vaccine underway in the US #Coronavirus ,Pune,neutral
2020-03-17,Don't spread Rumours about #CoronaVirus. Yesterday  one from #AndhraPradesh &amp; second from U.P. went to JAIL. Spread #health  not #misinformation. Great act by #Pune #Cyber #Police. #CoronavirusOutbreak #Corona #CoronaVirusUpdates,Pune,anger
2020-03-17,‘Game of Thrones’ star #KristoferHivju tests positive for #coronavirus. http://www.sakaltimes.com #Sakal #SakalNews #viral #ViralNews #SakalTimes #news #Corona #CoronavirusOutbreak #COVID2019 #Coronafighters #QuarantineLife,Pune,joy
2020-03-17,@narendramodi @coronavirus_in_ @coronavirus_in_ #MannKiBaat Use termeric powder &amp; lemon for hand wash. Use Neem leafs for bath water everyday,Pune,disgust
2020-03-17,@PCcityPolice @PuneCityPolice It looks like fake news peddled by mainstream news channel.. Can you please authenticate and ask them to delete this? Pune: Section 144 imposed in Pimpri-Chinchwad as coronavirus cases rise | via @IndiaTVNews,Pune,sadness
2020-03-17,"Now this time only test of suspected persons n take precautions how to safe us from virus Our prime responsibility to support Indian government  state  local government ""Coronavirus: First human trial for vaccine underway in the US"" #Coronavirus https://twitter.com/i/events/1219057585707315201",Pune,anger
2020-03-17,Float therapy reduces stress-With all the daily headlines sowing doom and gloom about the novel coronavirus  it’s easy to stress over it. Some are so panicked that they’ve begun stockpiling basic goods and food. It’s… https://www.instagram.com/p/B90bb5eHCzv/?igshid=9ht617gdwlt3,Pune,sadness
2020-03-17,@narendramodi #MannKiBaat @mygovindia @coronavirus_in_ @V2019N Everyone should carry eucalyptus oil.uses intermittently so that it will boost immunity to fight viral infections,Pune,sadness
2020-03-17,How high temperatures and high humidity affects the growth of Coronavirus.. Good paper to read.. https://papers.ssrn.com/sol3/papers.cfm?abstract_id=3551767,Pune,sadness
2020-03-17,@RailMinIndia Cancellation of Reserved Train Tickets- Full refund. Due to Declaration as Pandemic the Spread of Corona Virus Covid-19   and subsequent Travel advice by our Government state/centre  Most of the train Reserved tickets are being,Pune,disgust
2020-03-17,@RailMinIndia Chandrasekaran AR posted a Resource Cancellation of Reserved Train Tickets- Full refund. Due to Declaration as Pandemic the Spread of Corona Virus Covid-19   and subsequent Travel advice by our Government state/centre  Most of the train Reserved tickets are,Pune,sadness
2020-03-17,In the wake of the COVID-19 where everyone is asked to practice social distancing  a lot my friends are IT employees who haven't been given Work from Home and this is inducing fear . @OfficeofUT we ask you to intervene and give strict guidelines  so that Pune can be made safer.,Pune,fear
2020-03-17,Stay safe stay healthy and fight for the covid-19... ,Pune,neutral
2020-03-17,I am humbled by the efforts of doctors and the healthcare staff have put in order to treat/test/manage the COVID-19 situation. I already see doctors with immense respect  but their tireless and timely help is worth its weight in gold in such tough times. #COVID2019 #coronavirus,Pune,anger
2020-03-17, PRAY FOR WORLD PEACE #corona #coronavirus #Covid-19 @Pune  Maharashtra https://www.instagram.com/p/B91xkjmFtxD/?igshid=1g45uyz4z9cyy,Pune,anger
2020-03-17,Myth #10: COVID-19 was deliberately spread by (depending upon your politics) the American or Chinese military. Really??? ,Pune,neutral
2020-03-17,So I’m hearing many myths about #COVID-19 and would like to quickly clear the record. Coronavirus will go away in Sumer months. Wrong. Previous pandemics didn’t follow weather patterns plus as we enter summer  there will be winter in the Southern Hemisphere. Virus is global. ,Pune,neutral
2020-03-17,COVID-19 will kill 250 000 in UK if theres no draconian measures. #Sakal #SakalNews #viral #ViralNews #SakalTimes #news #Corona #CoronavirusOutbreak #CoronaAlert #COVID #coronavirus,Pune,anger
2020-03-17,The tweet shows how much morally downtrodden you are. Simply sick. You don't know what the virus does? I just read a morally corrupt human. COVID is deadly- what if a family of yours is affected? You will be the same still?,Pune,disgust
2020-03-17,Any idea who was pronounced the first person to get covid 19 in China,Pune,neutral
2020-03-17,Why is it racism?? It originated from Wuhan  China  so it must be called China Covid-19. Period.,Pune,neutral
2020-03-17,Sincere request to concerned authorities for closing of salons and parlours in India for the time being considering the gravity of #COVID19 virus. #COVID2019 #covidindia #Corona #IndiaVsCorona @rajeshtope11 @MoHFW_INDIA @CMOMaharashtra @PMCPune @SakalMediaNews @Covid_19newsIND,Pune,disgust
2020-03-17,Maybe some disgruntled daughters in law have coerced their husbands to sort out the liability to look after her in laws!. Taking sas bahu animosity to morbid leves! Otherwise I see no logic in exposing them to Covid. @ATHREYAG @optimistsurgeon @Ginger_in64 @AMAHEN @Tivary,Pune,sadness
2020-03-17,No stone being left unturned to ensure people are healthy: Modi on Covid-19 https://www.business-standard.com/article/pti-stories/no-stone-being-left-unturned-to-ensure-people-are-healthy-pm-on-coronavirus-fight-120031600553_1.html,Pune,neutral
2020-03-17,Is India really well prepared to cover out from covid-19???? China now recovering well... ,Pune,neutral
2020-03-17,After watching the teaser I m very much excited to see it on big screen but. That's unfortunate that due to the covid -19 it's being delayed. Appreciate the safety major that has taken due to the virus status. Hope that wait is worth of. ,Pune,sadness
2020-03-17,There are young victims of Covid-19 too. ,Pune,joy
2020-03-17,@RailMinIndia Cancellation of Reserved Train Tickets- Full refund. Due to Declaration as Pandemic the Spread of Corona Virus Covid-19   and subsequent Travel advice by our Government state/centre  Most of the train Reserved tickets are being,Pune,disgust
2020-03-17,@RailMinIndia Chandrasekaran AR posted a Resource Cancellation of Reserved Train Tickets- Full refund. Due to Declaration as Pandemic the Spread of Corona Virus Covid-19   and subsequent Travel advice by our Government state/centre  Most of the train Reserved tickets are,Pune,sadness
2020-03-17,Looking at the timeline and place of occurrence  there should be a complete lockdown on all airports in India  to stop any further spread of the disease. #COVID2019 #covidindia @OfficeofUT @ThePuneMirror,Pune,neutral
2020-03-17,Sir first has your daughter contacted @IndiaInScotland embassy ? Dont panic.. Aaj her to visit the embassy   scotland is not in lock down,Pune,anger
2020-03-17,Mam with the lockdown in Malaysia it seems impossible that your parents visa will be extended before the expiry ... Your parents 22nd flight will most probably get cancelled or already is..Best is to keep constant watch on MEA handle and await next flight declaration,Pune,joy
2020-03-17,15th March 2020 7PM IST Spanish Prime Minister Pedro Sánchez announces national lock down. State of emergency declared. The highest cases recorded after Italy. Read here - https://shifaalishah.wordpress.com/2020/03/17/love-in-times-of-coronavirus/,Pune,sadness
2020-03-17,The world is under a lockdown .... #MadeInChina #COVID19 .. certainly a global disaster,Pune,neutral
2020-03-17,Things to do during lockdown; get away from it all  beside a beautiful river  fishing till the sun sets down then fishing some more... watching that beautiful river and its surroundings and enjoying every breath of fresh air you take...,Pune,joy
2020-03-17,Do you think countries #lockdown is correct decision to stop #spreading of #coronavirus #travellockdown #travelmemories #vacaymemories #Asia #relaxing #wanderlust #bali #india #europe #italy #indiangovernment #airasia #scoot #malindo #singapore #dubai #unitedstates,Pune,fear
2020-03-17,Gov will be responsible for any outbreak if proper closure and lockdown not done @myogiadityanath As all school in KANPUR still calling teacher after the DM order @DMKanpur What is the gov waiting for? Take strict action to lock down as it's for the safety of people @narendramodi,Pune,anger
2020-03-17,Corona virus create serious problems at Mumbai  pune  nagpur other cities in Maharashtra for safety purpose lock down Mumbai for 1 week  stop all public transport  local  train  buses in mumbai to control spread carona virus  support all public to govt to control situations,Pune,anger
2020-03-17,Lockdown ok  if Chabi kho jaye,Pune,neutral
2020-03-17,Malaysia issued a lockdown until 31st hence a hoards of indians were expected to arrive in india increasing risk .. people will prefer to stay inside US instead of travelling back to india,Pune,neutral
2020-03-17,@OfficeofUT ji plz Lock down pune and mumbai for 2 weeks else it will be difficult to control.,Pune,neutral
2020-03-17,125 Confirmed cases in #India. #Coronavirus #guidelines #besafe #CoronavirusOutbreak,Tirupati,disgust
2020-03-17,Government has to take steps to prevent COVID -19. Government take necessary steps to inculcate about coronvirus to people. Nitizens should not post unnecessary posts in social media  which inturns effects on people badly. #IndiaFightsCorona #IndiaVsCorona #Coronafighters,Tirupati,anger
2020-03-17,Today as per the instructions of our Honourable Minister sir for Agriculture and the Director Madam Protective measures against coronavirus has been taken in A.M.C Kesamudram by giving disposal mask to farmers and market users and checking temperature with digital thermo meter ,Telangana,neutral
2020-03-17,Another good initiative during Corona outbreak. #CoronaVirus #COVID2019,Telangana,joy
2020-03-17,Bengaluru's K R Market will be shut down for a week   how about #Hyderabad . #COVID19 Till we close all shopping points we are not sure of quarantining ourselves. #Covid_19 #Coronaindia #Bengaluru,Telangana,anger
2020-03-17,@kcrunofficial @JaiKCR29 @KTRTRS Sir  we are thankful that you have declared 15 days of holidays due to COVID-19 but inorder to prevent COVID-19 from spreading more 15 days are neccessary because on the first 15 days it can exist on a surface later it can show it's effect,Telangana,sadness
2020-03-17,Hyderabad D-Marts and several other grocery shops are under attack from probable lockdown in case... #covidindia #COVID2019 #Corona #COVID2019 #Telangana,Telangana,sadness
2020-03-17,Remedies to prevent Corona virus is to Sanitize regularly with sanitizer(external remedy)and with Khukri Coronation Rum (internal remedy). Enjoy responsibly  be safe and be healthy. @Mumbai  Maharashtra https://www.instagram.com/p/B92oUIJha2K/?igshid=1n3fhip4jak04,Mumbai,joy
2020-03-17,"UP DATE ON #COVID2019 #coronavirus WORLD WIDE NEWS ""Coronavirus: Australia enters level 4 travel ban for first time in history  PM says"" #Coronavirus ",Mumbai,neutral
2020-03-17,How to dispose off the #Mask after use.? Must Read. #COVID2019 #coronavirus ,Mumbai,sadness
2020-03-17,My friend suddenly starts coughing violently. #Coronavirus Me: ,Mumbai,sadness
2020-03-17,While all are going for #QuarantineLife  I am ready to go back to work! #workingfromhome always and hence no #coronavirus holiday for me! #lifeofacontentwriter #contentwriter,Mumbai,neutral
2020-03-17,Best way 2 utilize ur time while caught up at home due 2 pandemic coronavirus  “IS TO READ good books”!! Gain more knowledge  gain more wisdom &amp; at d same time stay safe!! #SamairaSandhu #reading #safetyfromcorona #coronavirus #bookslover #goodhabbits #actress #beforesleep,Mumbai,sadness
2020-03-17,VIVA LOS MEDICOS Spain Spain - another epicentre of the #Coronavirus pandemic stood up and praised its medical community - nurses  doctors all. Fascinating  how a nation is battling #COVID2019 together! @seriousfunnyguy @mishra_shani,Mumbai,sadness
2020-03-17,ABSOLUTELY NO CHECKING AT DOMESTIC AIRPORTS??? Hyd to #Mumbai HOW &amp; WHY?? Does this Virus only spread from those who come from abroad?? Quite irresponsible #coronavirus #Coronafighters #CoronavirusOutbreak @BJP4India @bjp4mumbai @AUThackeray @ShivSena @PMOIndia @HMOIndia,Mumbai,joy
2020-03-17,#Repost @forbes_india. . #Coronavirus A map of the confirmed #COVID-19 cases in India as of March 17th ⁣ ⁣ #CoronavirusOutbreak⁣ #CoronavirusPandemic⁣ #CoronavirusIndia… https://www.instagram.com/p/B92NqrlB7FmJfr7Hf3b4wCNQ9NTvvTZLztbZVU0/?igshid=k66q1btr9ppi,Mumbai,disgust
2020-03-17,A famous German Biopharma Company #CureVac is also developing Vaccine for #coronavirus They are in near success. It's create diplomatic war/Drama against USA &amp; Germany. CureVac Owner is SAP's co-founder and CureVac has received funding from the Bill &amp; Melinda Gates Foundation.,Mumbai,neutral
2020-03-17,Coronavirus ain’t shit My relatives are more toxic,Mumbai,anger
2020-03-17,In #india but wondering if i should just go back to the UK for now til this whole virus thing is over.... Flights are still super expensive... What are other travel community people doing?? #coronavirus #QuarantineLife,Mumbai,surprise
2020-03-17,Time to stock up for this isolation phase - let’s flatten that virus curve! #coronavirus #covid_19 #stockup @Mumbai - Bombay   India https://www.instagram.com/p/B92LK0IpqaX/?igshid=1un372t0tugpt,Mumbai,joy
2020-03-17,Peope who say COVID-19 instead of #coronavirus ,Mumbai,neutral
2020-03-17,@niravnaik1991 casually spamming the shit outta people! But hey he's got a point! #coronavirus #covidindia #mumbai #COVID19Mumbai #mumbailocals #MumbaiMetro,Mumbai,anger
2020-03-17,As a content studio  we do want to go viral but NOT like that! We hope that you're building your immunity and taking all precautions necessary to prevent exposure to COVID-19. Stay well-informed  be safe and keep healthy! #theceecompany #pandemic #fightingcorona #coronavirus ,Mumbai,neutral
2020-03-17,Wtf is wrong with these humans. As if nature's wrath everyone already facing isn't enough for them Those who are behind these acts must be deliberately injected with corona virus,Mumbai,anger
2020-03-17,Chicken right now :- #coronavirus ,Mumbai,neutral
2020-03-17,Coronavirus: Dear Muslims  there is nothing called ‘Halal hand sanitizer’ - opinion - Hindustan Times ,Mumbai,disgust
2020-03-17,It's not about Corona virus  nobody could predict unless it was constructed in lab. But charts do give an indication of major upheaval in market up or down,Mumbai,neutral
2020-03-17,Sure sirji we are trying our best to stop this Corona virus we are taking all precautions to be safe from this virus ,Mumbai,neutral
2020-03-17,Person under coronavirus lockdown in Spain tries to leave house dressed as T-rex. #CoronavirusPandemic #Spain,Mumbai,neutral
2020-03-17,Sure sir we all are taking care of cleanness as well as preventing Corona virus by taking all precautions to it ,Mumbai,anger
2020-03-17,T-Rex wandering the streets of #Spain during #coronavirus curfew. ,Mumbai,neutral
2020-03-17,1062 deaths in last 3 days in Italy and people are still considering Coronavirus as a social media hype #covidindia #coronavirus #PrayForItaly,Mumbai,joy
2020-03-17,#coronavirus #COVID2019 #ChineseVirus #CoronavirusOutbreak PAKISTAN invented Corona vaccine. They go 2 Corona vaccine n r giving to all patients n citizen of PAKISTAN. Name of vaccine is Corona Kashmiritis370 n Corona ke naam pe de de ,Mumbai,anger
2020-03-17,"Bombay HC imposes Rs 15k costs on litigant for insisting on ""thoroughly irresponsible"" listing of non-urgent matter #Coronavirus https://www.barandbench.com/news/litigation/coronavirus-bombay-hc-imposes-rs-15k-costs-on-litigant-for-insisting-on-thoroughly-irresponsible-listing-of-non-urgent-matter #costs #Bombay High Court #Justice GS Patel #Coronavirus #Corona Virus",Mumbai,neutral
