2020-03-09,@BeCureFit Considering #CoronaVirus scare  how about extending complimentary 'Pause Pack' option  thereby altering the existing 'Pause Pack' usage terms for all the members  till 31st March? @ankitnagori27 @8priteshj,Bangalore,fear
2020-03-09,Why are so many folks pissed about Coronavirus guideline being played as a caller tune? It's an ingenious way of spreading the message without spending a single extra penny.,Bangalore,neutral
2020-03-09,JDS MLA in Vidhan soudha : All MLAs have to be screened for Coronavirus before entering Vidhan soudha. Hundreds enter the assembly and Secretariat  all should be screened including MLAs.,Bangalore,neutral
2020-03-09,Coronavirus  live updates | In Karnataka  patient leaves hospital against medical advice; police step in: ,Bangalore,anger
2020-03-09,Day 1 of getting out f the house aftr corona virus scare - Mask  nt touching face  continuous washing of hands Day 2- Nothing will happen. No mask  used sanitizer twice bt touching face every 1 min  not at all bothered anymore. That's the thing about India. Can't scare ppl 4 long,Bangalore,fear
2020-03-09,Corona Virus after seeing how screwed our folks are. ,Bangalore,anger
2020-03-09,@AddlCPTraffic @CPBlr @DCPTrEastBCP can you pls clarify your policy now on breath analyzers? It isn't worth &amp; alternate methodology shd be used. It's unsafe now even for @blrcitytraffic policemen @hsrltrafficps pls be safe! #coronavirus @ArvindLBJP @DHFWKA @BBMPSWMSplComm,Bangalore,anger
2020-03-09,Never seen such BLUE in #Kasavanahalli #Haralur #GearSchoolRoad &amp; #SarjapurRoad. Ofcourse NOT becas we got RMP15 ROAD or shelved PhaseIII #METRO to Carmelaram #CoronaVirus is doing what Gok GoI couldnt for decade.Perhaps learning is #WorkfromHome shd be policy due to failed infra – at Kaikondra Halli,Bangalore,surprise
2020-03-09,If I die of Corona Virus then my Twitter account should go to @besanladdoo Quote this tweet and let the world know who will handle your Twitter if you die of Corona Virus ,Bangalore,anger
2020-03-09,.. @gaalipata2 shooting pushed ahead by #2months Dir @yogarajofficial &amp; team were planning to head to #Georgia by #March end  have decided to postpone shoot due to coronavirus outbreak #RameshReddy @Official_Ganesh #PawanKumar @diganthmanchale https://www.cinemaexpress.com/stories/news/2020/mar/09/gaalipata-2-shooting-pushed-ahead-by-2-months-due-to-corona-virus-17420.html @NamCinema,Bangalore,anger
2020-03-09,Never mind China  look to the US for the next big coronavirus crisis https://www.scmp.com/news/hong-kong/health-environment/article/3074087/never-mind-china-look-us-next-big-coronavirus via @scmpnews,Bangalore,neutral
2020-03-09,Excellent infographics on coronavirus in Singapore @STcom @sundar__raghav,Bangalore,joy
2020-03-09,Arun is not infected with Corona Virus. But still  Arun wears mask while going to crowded places. Because  Arun knows that prevention is better than cure. Be like Arun. ,Bangalore,joy
2020-03-09,No...It is not due to Corona Virus. It is due to price war between Saudi &amp; Russia to grab market share. Earlier Russia had signed a treaty with Saudi to reduce production. Where Saudi lost market share. So now Saudi broke the treaty....decided to increase production. ,Bangalore,sadness
2020-03-09,China’s coronavirus response slowed by bureaucracy  unstable funding ,Bangalore,neutral
2020-03-09,As a precautionary measure to prevent coronavirus  state government has declared holiday from today to all pre primary sections in all schools. Hence  school will remain closed from today until further oreders. #coronavirusindia #COVIDー19 #Corinnavirus,Bangalore,anger
2020-03-09,Loads of random SMSes from the @PMOIndia and other govt. departments throughout the year. Here’s hoping they put that infrastructure to good use in highlighting the risks of #CoronaVirus and assuring us of the safeguards the @MoHFW_INDIA has been taking. Instill faith in people.,Bangalore,disgust
2020-03-09,Showing IIRESPONSIBLE towards the safety for customer where other airlines making most efforts eg Indigo refund cancellation due to outbreak of CORONA Virus. NOT SATISFIED BY SPICEJET RESPONSE #COVID19india @flyspicejet @SpiceJetRBLX,Bangalore,disgust
2020-03-09,Really? Haven’t got any message so far from school. Coronavirus: Holiday for pre-primary schools in B'luru https://www.deccanherald.com/city/top-bengaluru-stories/coronavirus-holiday-for-all-lkg-ukg-pre-primary-schools-in-bengaluru-due-to-covid-19-811899.html @deccanherald,Bangalore,sadness
2020-03-09,2nd & 3rd order effects of #coronavirus can be handful on the healthcare system ,Bangalore,neutral
2020-03-09,@UN U GUYS CAN DO ANYTHING TO STOP SPREADING OF THE COVID19 VIRUS  U GUYS ARE GETTING TO SAFETY WHAT ABOUT PEOPLE ALL OVER THE WORLD . YOU GUYS ARE WORST    U GOT A JOB TO DO AS RESPONSIBILITY DO IT OR WORLD WILL BE AT THE #WORLDWAR3 ONLY SPEECHES WONT WORK HELP PEOPLE,Bangalore,anger
2020-03-09,#COVID19 Update #PANDAMIC ,Bangalore,surprise
2020-03-09,#Bengaluru 1st case of #COVID19 #CoronavirusOutbreak #coronavirusinindia need to be alert ,Bangalore,neutral
2020-03-09,Pray for the #World #CoronavirusOutbreak #COVID19 ,Bangalore,neutral
2020-03-09,CID Dasan admitted to hospital as he has been tested positive for #COVID19 while CID Vijayan is safe and sound. Be like Vijayan. Practice Safe Hygeine . Via #WA,Bangalore,neutral
2020-03-09,"If you're a RCB fan and come across this tweet then drop a reply with "" "" Let me check How many hearts for the team @RCBTweets #டீம்RCB #PlayBold #IPLT20 #KurkureWithSidharth #KurkureWithShehnaaz #coronavirus #BlackWidow #COVID2019 #COVID19 #Congress #coronavirus",Bangalore,joy
2020-03-09,But I do think @BBMPCOMM @BBMPSWMSplComm @chairmanbwssb are all visionaries. We never understood them. They know COVID19 would come and hence created so many layers of thick dust in our locality that COVID 19 stands no chance ! Let’s appreciate when it’s due,Bangalore,anger
2020-03-09,Aniyathi and aliyan was supposed to come this week to India. They cancelled their tickets. In NY reported #COVID19 cases exceed 100 now ,Bangalore,sadness
2020-03-09,“We’ll learn to live as minimalists” I feel that’s the most positive outcome from this pandemic of #COVID19. It’s possible to avoid unwanted travel  gatherings  wasteful expenses  shopping splurges  pub/mall hops...,Bangalore,joy
2020-03-09,The world's airlines are using some of the most powerful chemicals to clean their aircraft to protect against #Corona #COVID19. https://time.com/5791414/airlines-disinfectant-coronavirus/. Many times after each flight. There is no information from the Indian airlines or the ministry on the disinfection,Bangalore,anger
2020-03-09,Hi good folks of twitter ! Can anyone let me know where in Bangalore do they screen for #COVID19 . ?? Pls RT,Bangalore,neutral
2020-03-09,Let us understand why such HYPE over COVID19 ????? ,Bangalore,neutral
2020-03-09,https://youtu.be/zKLQ1xS_LHw good one don’t miss if you want to know more about COVID19,Bangalore,sadness
2020-03-09,For everyone in India to have a close like at the statistics of UK & Italy on #COVID19 Better safe than sorry.. ,Bangalore,sadness
2020-03-09,Qatar has closed its borders for certain nationalities  including India. Step taken to curb the spread of #COVID19. All stopovers at Doha remain suspended. Statement by Qatar Airways: ,Bangalore,surprise
2020-03-09,Noticed a few cautious folks on two wheelers during my morning commute.. And also realised few weren't wearing Helmets. #slowclaps #SMH #COVID19 #CoronavirusOutbreak,Bangalore,neutral
2020-03-09,#COVID19india #COVID19 “We need to focus on what went wrong rather than who did a wrong thing” #Panic #myths #Stigma seem to be potentiating this #pandemic I am certain @MoHFW_INDIA is working overtime to ensure this.,Bangalore,disgust
2020-03-09,#COVID19 #stigma #coronovirusindia Need of the hour is to #destigmatise suspected cases #kerala folks perhaps wanted to escape the infamy. Are our quarantine facilities and treatment centres upto the mark? Will I get good medical care there? These fears need to be allayed.,Bangalore,anger
2020-03-09,Leading with courage. I trust in #KeralaModel against #COVID19. Everyone please follow the Government instructions. ,Bangalore,sadness
2020-03-09,people are stupid. they fear death in Corona virus because of its visiblity but dont fear death in accident ,Ahmedabad,fear
2020-03-09,#Coronavirus is second dangerous virus in India. TikTok virus is still on the number one.,Ahmedabad,disgust
2020-03-09,@airtelindia I have known enough of corona virus since this morning. I will wash hands  use sanitizer and not touch my or anyone’s face. Promise!Please stop the irritating pre call!! #stopcoronaviruspanic #stopcoronavirusprecall,Ahmedabad,disgust
2020-03-09,Tracking coronavirus: Map  data and timeline - ,Ahmedabad,neutral
2020-03-09,#coronavirus to bahana he... Support na milne k dar se postpone kiya ,Ahmedabad,anger
2020-03-09,Heat generated from #HolikaDahan will kill #CoronaVirus in India. Come and let's #heatup #COVID2019,Ahmedabad,anger
2020-03-09,To avoid that cringeworthy #CoronaVirus caller tune on every outgoing call  just press any number key from your mobile... You can say thanks to @MalharTanna ,Ahmedabad,sadness
2020-03-09,I hope government realise that new compulsory advertisement of corona virus on each call is cringe.,Ahmedabad,fear
2020-03-09,According to Bhakts Not Modi Government  but Coronavirus is Responsible for Sensex Crash and Low Performer Indian Rupee. #Rupee #Sensex,Ahmedabad,surprise
2020-03-09,#Coronavirus  live updates | In #Karnataka  patient leaves hospital against medical advice; police step in - The Hindu,Ahmedabad,anger
2020-03-09,Dear Readers  Happy Holi!!! As we know the whole world is scared of Novel Corona Virus supported disease. Coronaviruses are a large family of viruses which may cause respiratory infections ranging from the common… https://www.instagram.com/p/B9f73hkF0u-/?igshid=cmkx9gximsam,Ahmedabad,fear
2020-03-09,Saare #t1d’s Yeh dekho - Some useful tips about #COVID19 and #T1D @PoojBhave @IThampy @NupurLalvani @SanjayKalraDr1 @banshisaboo @ApoorvaGomber @BakshiPragya @Being_type1 @DevAnjali06 @DIYAbetesINDIA @bluecirclediab @MridulaKapil @DFighters1,Ahmedabad,neutral
2020-03-09,Strange coincidence that all worst affected #Covid19 cases are along the same Latitude 40ํ : From left: France Italy Iran Wuhan S.Korea Japan Seattle Washington NewYork ,Ahmedabad,sadness
