2020-06-21,Inter post lockdown seem really really good. I am seeing a title challenge.,Pune,joy
2020-06-21,Always heard of @kaykaymenon02’s acting and today I saw #SpecialOPS! Finally I something made my lockdown stress free! Too Good Acting mannn!!! Hats Off! Saashtaang Pranaam!!,Pune,joy
2020-06-21,PM-JAY saw 57% fall in surgeries  46% in medical care during lockdown ,Pune,sadness
2020-06-21,fastag order no. 10523467787 placed since 11-mar-2020. countrywide lockdown has now opened and e-commerce has started since May end. but still this fastag coudnt be even shipped by @Paytm @Paytmcare . Great work people,Pune,joy
2020-06-21,🄰🄺🄰🅂🄷.🅂🄰🄱🄻🄴94 Follow our page @akashsable510 who #Lockdown #covid19 #coronavirus #coronavirusbreakout #buddhist #buddha #buddhism #jaibhim #ambedkar #ambedkarite #humanity #india #religion #bhimrao… https://www.instagram.com/p/CBtYEz7lphJ/?igshid=1fd6mw985ijm4,Pune,anger
2020-06-21,🄰🄺🄰🅂🄷.🅂🄰🄱🄻🄴94 Follow our page @akashsable510 who #Lockdown #covid19 #coronavirus #coronavirusbreakout #buddhist #buddha #buddhism #jaibhim #ambedkar #ambedkarite #humanity #india #religion #bhimrao… https://www.instagram.com/p/CBtXPwplz_9/?igshid=1ag3sx44aq1d5,Pune,anger
2020-06-21,Sorry to disappoint you. But if it wasn’t Modi and anyone else at the Center: that entertained a foreign dignitary  toppled a state government  implemented an unscientific lockdown  ignored migrant woes  I would’ve still blamed the PMO. Most people just blindly support him. Sad.,Pune,sadness
2020-06-21,अंत तक देखना . Video edited by @RV_NAIR🄰🄺🄰🅂🄷.🅂🄰🄱🄻🄴94 Follow our page @akashsable510 who #Lockdown #covid19 #coronavirus #coronavirusbreakout #buddhist #buddha #buddhism #jaibhim #ambedkar #ambedkarite… https://www.instagram.com/p/CBtSXoDFl4N/?igshid=4e79s4ineduz,Pune,neutral
2020-06-21,Hair and beards coming out of lockdown  jota  firmino  gomes absolutely didn't seem to care What's up with Mike Dean's beard?,Pune,neutral
2020-06-21,@CMOMaharashtra @PMOIndia Can we do one process to control on corona patients and keep fiance cycle in working .. SPEED BREAKER PROCESS 10 DAYS WORKING 5 TOTAL DAYS LOCKDOWN AGAIN 10 DAYS WORKING 5 DAYS LOCKDOWN May it help us to all.,Pune,joy
2020-06-21,@MSEDCL @MAHADISCOM @cbawankule Sir  ever since the lockdown was imposed we paid average bills as attached here  still the June bill is almost 5 times the average bill! The entire bill of 3 months is not considered  unexplainable  happening for large number of customers! ,Pune,surprise
2020-06-21,One of the best Macaroni i have ever made! Yumm #Macaroni #Dinner #Lockdown #Cooking #RuhBhav #StayHome #RuhBhav and #PeachGinger #Mead freshly brewed by @effingut,Pune,joy
2020-06-21,600 cases a day is a huge figure. One more lockdown like Chennai Required very urgently.,Pune,neutral
2020-06-21,Bhau  pls restart lockdown for 21 days with three-five days advance notice,Pune,joy
2020-06-21,lockdown does nothing but delay the inevitable. people need to learn how to live with the virus by masks  social distancing etc. micro containment is good enough to convince people into doing the right thing,Pune,anger
2020-06-21,Strict lockdown is what needed for Pune  else situation can be out of control.,Pune,neutral
2020-06-21,Very True. I think at least 10-14 days strict lockdown should be placed.,Pune,neutral
2020-06-21,If ppl are not using Masks  Sanitizer and Social distancing then Pune will be forced into new lockdown.... Need aggressive awareness campaign on Mask  Sanitizer and Social distancing...!,Pune,anger
2020-06-21,Bhivandi is also in intesnse lockdown till 3rd July,Pune,sadness
2020-06-21,Parts of Tamil Nadu have already gone into the next lockdown. Is that something we need to look at for #Pune city (or parts of the city?),Pune,joy
2020-06-21,Must be pretty much entire Pune now considering the last week numbers . Another week of strict lockdown needed to bring these numbers down ?,Pune,sadness
2020-06-21,At this rate  we need to go back into lockdown. #Pune #lockdown #corona #masks #Socialdistancing,Pune,neutral
2020-06-21,"Excellent gift from my little princess on Father's day.she is the winner in kids category lockdown dance competition organised by Swarang TV. Love u ""putu"". ",Pune,joy
2020-06-21,Thank you for entertaining us during this lockdown .. we really enjoyed your post,Pune,joy
2020-06-21,Lockdown extend valla cases perugutunnai brother,Pune,neutral
2020-06-21,Is ICMR really working?? All it's Statistics & calculations related #COVID has failed miserably.. When it should be open it was #lockdown when #lockdown is needed its open.. #LockdownFailed miserably..,Pune,anger
2020-06-21,After paying bill in lockdown time  than also again same bill dispatch. Really very poor working  not proper response by MSEDCL office empoly . Even they not ready to listen anything.,Pune,neutral
2020-06-21,Texting south indians: lockdown is so annoying no Texting non south indians: lockdown is so annoying na,Pune,anger
2020-06-21,Shared time with my dad learning cooking As mom was stuck in other location dad was incharge of cooking We spent time Every day cooking new dishes during the lockdown ,Pune,joy
2020-06-21,@Cleartrip I had made a booking during lockdown which got cancelled later. I had email to SpiceJet for refund and also they made refund for the same on 21st May 2020  However I emailed to your department thrice for refund me back but I didn't get any response from them.,Pune,neutral
2020-06-21,If you are one of those who are worked about missing out on gym amod the lockdown  @yogrishiramdev is here to showcase how you can get gym benefits with yoga asanas. #योगमय_देवभूमि #योगमय_हरियाणा #IYD_पतंजलि,Pune,sadness
2020-06-21,A group of students from IITs  IIMs and other reputed institutions on Sunday launched a pilot project and a #helpline number to help workers  who lost their #jobs during the #coronavirus-necessitated #lockdown  find #work.,Pune,sadness
2020-06-21,@CPVIndia Hi Team  can you please help me to re send request for police verification for my son passport  as i was not able present at police station earlier due to lockdown. File No:PN1064749958820,Pune,anger
2020-06-21,322 days of Lockdown. 322 days of Detention. 322 days of NO 4G. 322 days of NO Business. 322 days of NO JOBS. 322 days of NO PEACE. 322 days of KASHMIR. ,Pune,joy
2020-06-21,India needs another complete lockdown which @PMOIndia Announced 1st time .. Corona increased don't ignore this we are in toughest situation right now. Its not good sign! We want to stop it earlier. Otherwise there is no mean of first lockdown @AUThackeray @CMOMaharashtra @nar,Pune,neutral
2020-06-21,This lockdown!,Pune,neutral
2020-06-21,@PuneCityPolice Hi. Could you please share the sop for entry into Pune by air? My mother has been stranded in Goa in the Lockdown  we are planning to fly her down to Pune in the first week of July. Many thanks!,Pune,joy
2020-06-21,"@HardeepSPuri Is it crime to have air ticket bookings of lockdown period? Really very frustrating Indian airlines services. @goairlinesindia not able to respond customers over mail/call then why showing message ""contact call centre as PNR protected"". COVID-19 shouldn't be excuse. https://twitter.com/jhasonu671/status/1274252066316148737",Pune,anger
2020-06-21,Hi @bookmyshow   What happens to gift vouchers nearing expiry as we go along while the entertainment options are still shit  or expired during the lockdown period due to inability to use them.?,Pune,surprise
2020-06-21,And I am thankful to all the local shops  digital payment apps and @WhatsApp as they were my superpowers for survival during #COVID19India #lockdown.,Pune,neutral
2020-06-21,People's are suffering from a lot of mental diseases due to this lockdown. We can cure them by practicing yoga on this #करो_योग_रहो_निरोग_बापूजी #अन्तर्राष्ट्रीय_योग_दिवस #InternationalYogaDay,Pune,sadness
2020-06-21,**Ban crackers this Diwali***   Otherwise the Filtered air during lockdown will be re-polluted if not banned.,Pune,anger
2020-06-21,Today during lockdown we have placed multiple orders but it's very very difficult to track which is delivered and which is not. Just but adding a tag as delivered in front of that particular order will make life simple,Pune,joy
2020-06-21,https://www.ndtv.com/india-news/93-year-old-woman-panchubai-reunites-with-maharashtra-family-after-40-years-amid-lockdown-2249764?pfrom=home-topstories 93-Year-Old Woman Reunites With Family After 40 Years Amid Lockdown @IndiaGkTime @thebetterindia,Pune,sadness
2020-06-21,During lockdown when cafes  tea stalls  restaurants and gardens were closed  katta groups managed to meet via online platforms (reports Prachi Bari) ,Pune,sadness
2020-06-21,Madaari : A Family Drama based in lockdown. Listen to our family with your family! Written &amp; Directed by- Rachit Daruka and Vedashree Adige. https://youtu.be/d8J9jWV39gk,Pune,joy
2020-06-21,@SidShirole Sir  after witnessing your dedication and hardwork for we Punekars  during the lockdown period  my faith in our leaders/representatives admist the currently detoriating political scenario  had been restored. Truely said- Respect is commanded not to be demanded. ,Pune,neutral
2020-06-21,@HYDTP Sir  My dl was kept during lockdown and I was being told I will get a call once lockdown opens. But as of now i didn't got any call. I am worried of my driving license . Pls let me know where should I visit for this.,Pune,sadness
2020-06-21,#YourHonor must watch TV series in lockdown situation.I bet you this tv series is going to beat all the other Bollywood series. @jimmysheirgill superbb acting. Writer hats off to you. @richapallod nice way to start after a long break. @varunbadola7 @SonyLIV thanks.,Pune,joy
2020-06-21,"A COVID-19 ""exit"" strategy to end lockdown and reopen the economy | Uri Alon ",Pune,neutral
2020-06-21,@PMOIndia @CMOMaharashtra lockdown unlocked Or Corona Unlocked !! Heavy rising in patient and no observance of social distancing. Need to revised instructions on unlock and some part need to 100% lockdown ,Pune,neutral
2020-06-21,#StrengthOfPositive. #InternationalDayofYoga #ContestAlert #HappyFathersDay Today on Father's day we celebrated Yoga day by performing Yoga to remove the negativity of the lockdown period and comeup with a fresh positive mind with a upset of new future ,Pune,joy
2020-06-21,Its a lot hard when you slept at 5 and had to wake up at 8 just so you can eat something before the food lockdown ,Pune,joy
2020-06-21,Yes..so many same complaints still they dont care..people dont have money due to lockdown..they r giving bills with triple amount..big shame to Msedcl.u guys are looting common people..,Pune,anger
2020-06-21,There has been a significant amount of Heat & Mass transfer between me and my bed during this #lockdown!,Pune,joy
2020-06-21,Here is our First Podcast Trailer with someone really special from #SouthKorea - In a conversation with Jyoti Bharwaney and Lal Bharwaney about life after the #Lockdown #HealthCare #IndiaFightsCorona #COVID19 #NthSense #Mentalhealth #PatientEngagement #PatientCare #NthSensePods,Pune,joy
2020-06-21,#Papa This is my papa he is in rajasthan narlai at my villege in this lockdown he stay there from 5 month alone. He is a very big icon for me .his age ne 65 now but he travelled one village to nera village on cycle what a energy in this age i have not energy like him big salute ,Pune,neutral
2020-06-21,#COVID19India #Lockdown5 @PMOIndia @OfficeofUT lockdown extending was the worst decision if 17march &gt;27 march 100% shutdown culd hav done  then everything would hav been undr control  lot of loss to life n economy culd hav bin prevented ,Pune,anger
2020-06-21,Sarkar may karnar  Everyone is out on streets as if nothing has happened  they have forgotten why lockdown was implemented. Everyone knows there is no vaccine available  only way is stay safe at home and when its unavoidable to go out take percautions,Pune,joy
2020-06-21,Telly actors  who turned dads during the lockdown  speak to us about fatherhood and more. #FathersDay @ruslaanmumtaz @vyas_sumeet,Pune,surprise
2020-06-21,This is what #Lockdown has done ,Pune,anger
2020-06-21,Solar Eclipse source: surajm8640 🄰🄺🄰🅂🄷.🅂🄰🄱🄻🄴94 Follow our page @akashsable510 who #Lockdown #covid19 #coronavirus #coronavirusbreakout #buddhist #buddha #buddhism #jaibhim #ambedkar #ambedkarite #humanity… https://www.instagram.com/p/CBsMQQTlQEP/?igshid=182pu0d41by0d,Pune,neutral
2020-06-21,Lockdown.... Got its nature at his best... @Pirangut  Maharashtra  India https://www.instagram.com/p/CBsLjQwAV-38eZuGfrzck17M7G_43Cpmy3EfRs0/?igshid=1n0lwafvpt2g4,Pune,joy
2020-06-21,What a failed lockdown. Instead of tackling &amp; fighting the corona  every department is running away from it by postponing things eg HRD dep. Government should be creating teams &amp; assigned it to every school/colleges  offices but idk what they are doing. @BJP4India @INCIndia @IYC,Pune,anger
2020-06-21,People are more scared of going out during the eclipse than during Lockdown.,Pune,fear
2020-06-21,https://youtu.be/6lrPggGiGaw @ArvindKejriwal @PMOIndia @drharshvardhan @narendramodi Is this the situation around. If this is i think should lockdown the entire nation again. @AUThackeray @CMOMaharashtra @uddhavthackeray #postponemhtcet,Pune,sadness
2020-06-21,But people are not getting good food or enough sunlight due to cultural reasons  lockdown  and the monsoon season  I hypothesise. Covid should be beaten by the power of compound interest. Everyday take one new action. Make it part of lifestyle. Reduce infectivity  r0 and cfr.,Pune,joy
2020-06-21,Unfortunately we didn't utilise lockdown,Pune,sadness
2020-06-21,People say EAT TO LIVE We say LIVE TO EAT!! WTF Burger  at The Burger Barn Cafe  Shivajinagar  Pune Making a list of places to visit after the Lockdown gets over? Well so are we Time to start clearing our… https://www.instagram.com/p/CBsE_azHOZO/?igshid=1u9tfbqdie8fg,Pune,joy
2020-06-21,#internationalyogaday #yoga #health #fitness #stayfit positive side of #lockdown for me @narendramodi @moayush #MyLifeMyYoga,Pune,neutral
2020-06-21,Sonu Sood deserves the real credit for helping people during lockdown #bollywoodnepotism #bollywoodexposed,Pune,anger
2020-06-21,Complete lockdown required! ,Pune,neutral
2020-06-21,*Lockdown phone call with mom* Mom: What did you cook for dinner? Anything special on a weekend night? Me: Nope. Made a very lowkey sabzi today. Nothing special. Mom: Good one.,Pune,joy
2020-06-21,It is often believed that a gym access is required to make progress. And lot of people are not working out properly during this lockdown giving this http://excuse.Here’s a study which says you can make same progress with free weights (dumbbells &amp; barbell) or machines.,Pune,sadness
2020-06-21,@PMAYUrban @MoHUA_India Lockdown is over. Kindly  fast track the CLSS approval process.,Pune,neutral
2020-06-21,thats a lockdown effect,Pune,sadness
2020-06-21,@PCcityPolice Hi This is to inform you that from From Last 4 months I haven't received My Police Clearance certificate due to lockdown now I am waiting but no response from local police station Talegaon Dabhade as well as Pimpri chinchwad commissioner office .@PCcityPolice,Pune,anger
2020-06-21,Here's Wishing Happy Father's Day to The Coolest Day @iamsrk . . . #dad #FathersDay #HappyFathersday #fathersday2020 #SundayFunday #SundayMorning #ShahRukhKhan #SRK #Bollywood #Dads #Coronapalooza #coronavirus #Covid2019 #Lockdown #Pune #Maharashtra #Mumbai #Delhi #Nagpur,Pune,joy
2020-06-21,All of my friends look either homeless or mad sexy this lockdown  there's no in between,Pune,surprise
2020-06-21,Lockdown insight: Uninterrupted material progress is a chimera,Pune,surprise
2020-06-21,@UIDAI Aadhar centre in my place is closed due to lockdown. I have got a coupon for April but the centre was closed that time. I need to create UIDAI for my son. Please let me know which centres are open near Wagholi  Pune 412207,Pune,sadness
2020-06-21,Noticed something unusual on a patch on Mumbai-Bengaluru national highway- near Balewadi Sports stadium... almost every lamppost has an active nest on it with crows swooping in and out. Is this common for crows to make a nest in open or it's the lockdown effect? @ParveenKaswan,Pune,neutral
2020-06-21,Let this #lockdown be a time to know and cherish them better. Dhariwal &amp; Chhoriya Realty wishes you and your fathers a very #HappyFathersDay2020 #ChhoriyaRealty #FathersDay #Father #Dad #Son #Daughter #Family #Guidance #Love #HappyFathersDay #FatherAndSon #FatherAndDaughter,Pune,sadness
2020-06-21,Today is Day 101 of being in lockdown for me and I want to say that I might not be running or thin  but my patience is.,Pune,neutral
2020-06-21,Not surprising  since this has been more or less the trend the world over. In fact  the PM had I think mentioned this in his 3rd lockdown address. Unfortunately  people don't want to stay safe. Only strict adherence to social distancing  protecting face can bring it down.,Pune,neutral
2020-06-21,Best investment during lockdown. #aatmanirbhar,Pune,joy
2020-06-21,@ACTFibernet I was using prepaid connection but still got a bill of 4800/- though I wasn't at home to use this because of the lockdown. I got almost 20 calls from @ACTFibernet but no one resolved it yet  also sent 3 emails but no response yet. Account: 102335717628 Plx Help!,Pune,disgust
2020-06-21,I know exactly who all I need to be with in the next lockdown! This list has you too #justsaying ,Pune,surprise
2020-06-21,The Lockdown gave me the chance to spend more quality time with my dad We did gardening &amp; grew lots of plants in our garden we cooked new dishes &amp; we created our own music. We also exercised together Tag @joosequ @Joe8ss @nirmalazC @Frafz1 @yayam02,Pune,joy
2020-06-21,Nehru is responsible for increasing fuel prices even when people are struggling financially post lockdown &amp; Rahul Gandhi must resign as PM.,Pune,sadness
2020-06-21,India  take care. Monsoon  associated humidity and added movement my people by getting tired of long lockdown is going to accelerate #COVID19 cases sharply. Please avoid crowded places and mask up!,Pune,anger
2020-06-21,I have Kindle. It helped me during flights and lockdown. But over the time I have realised  it kindle &amp; paper &gt; kindle or paper :) Kindle - utility Paper - feels Hope this helps in your research :),Pune,sadness
2020-06-21,Did early lockdown in India help to prepare for the worst? Now people dying due to care not available ? It’s murder and still no accountability  do we deserve this ? No democracy but only rulers  earlier kings then British and now politicians. We can only be ruled Jai Hind,Pune,anger
2020-06-21,Happy Father's Day! #dentist #Fathersday #strongteeth #dentalcare #dentalhealth #dentalfacts #dentalclinic #lockdown #smiletime.in #dentalawareness #dentalinindia #familydentist #bestdentist #cleanteeth #mother #day #smiletime #smiletimekharadi #Kharadi #pune #Smiletime,Pune,joy
2020-06-21,Another way of lockdown #SolarEclipse2020,Pune,neutral
2020-06-21,Covid-19 throws a spanner in the works for Thermax and Cummins ,Pune,neutral
2020-06-21,Avoid picnic spots to curb Covid-19 spread: Cops ,Pune,neutral
2020-06-21,For #patients with mild or no #Covid_19-symptoms  @PMCPune allows #home #Quarantine https://indianexpress.com/article/cities/pune/pmc-home-quarantine-patients-with-mild-covid-symptoms-6469858/ via @IndianExpress,Pune,neutral
2020-06-21,India is the only nation in the world to have rise in growth rate of cases during nationwide lockdown!! Either MODI didn't consult experts on drafting guidelines for #COVID__19 war or he intentionally surrendered to help his friends' PHARMA COMPANIES make profit! #SurenderModi,Pune,joy
2020-06-21,#COVID__19 destroyed face detection technology single handedly which was apparently used/considered by majority governments as a convenient tool of oppression in the garb of surveillance!! #coronavirus #TrumpMeltdown,Pune,anger
2020-06-21,Huge respect for @ArvindKejriwal sir you successfully managed to get 2nd pos in covid19 figures in india. This is a great success even after being such a small state you managed to get on top . You’re also the 2nd bsst CM,Pune,anger
2020-06-21,🄰🄺🄰🅂🄷.🅂🄰🄱🄻🄴94 Follow our page @akashsable510 who #Lockdown #covid19 #coronavirus #coronavirusbreakout #buddhist #buddha #buddhism #jaibhim #ambedkar #ambedkarite #humanity #india #religion #bhimrao… https://www.instagram.com/p/CBteiCyF5rI/?igshid=9p7gp71eax4x,Pune,neutral
2020-06-21,🄰🄺🄰🅂🄷.🅂🄰🄱🄻🄴94 Follow our page @akashsable510 who #Lockdown #covid19 #coronavirus #coronavirusbreakout #buddhist #buddha #buddhism #jaibhim #ambedkar #ambedkarite #humanity #india #religion #bhimrao… https://www.instagram.com/p/CBtdzTtFbbi/?igshid=1xuv7p0r6xd2a,Pune,anger
2020-06-21,It is real but not sale for over the counters but this is one of the medicine shown great result on COVID 19 trail now has been approved,Pune,neutral
2020-06-21,Ok. What's her present domain of expertise? Sino-India relationship or Covid 19?,Pune,anger
2020-06-21,#Industrial #Robots Market: How will the Disruptions Created by #Covid19 Affect the market? Download Sample PDF #MarketResearch Report: https://bit.ly/30ZMCmJ #industrialautomation #industry40 #robotics #automation #industry #manufacturers #materialhandling @MitsubishiElect,Pune,joy
2020-06-21,🄰🄺🄰🅂🄷.🅂🄰🄱🄻🄴94 Follow our page @akashsable510 who #Lockdown #covid19 #coronavirus #coronavirusbreakout #buddhist #buddha #buddhism #jaibhim #ambedkar #ambedkarite #humanity #india #religion #bhimrao… https://www.instagram.com/p/CBtYEz7lphJ/?igshid=1fd6mw985ijm4,Pune,anger
2020-06-21,Express Medicare  a division of Express Clinics Pvt Ltd  fighting against COVID19 by supplying EXPRESS T-SENSE RANGE to Individuals  Offices  SMB  Retgailer &amp; Companies. Contact 18002679191 or 9191@expressclinics.in Visit https://bit.ly/2ACkM4B #Covid19 #TemperatureScreeningKit,Pune,neutral
2020-06-21,Amit Shah helms meeting over Covid-19 crisis in Delhi  suggests scaling up contact tracing #Delhi,Pune,neutral
2020-06-21,Glenmark’s Covid-19 drug to nod to Hetero and Cipla for remdesivir ,Pune,neutral
2020-06-21,After #FabiFlu  Hetero’s antiviral drug #Covifor gets DCGI approval to treat Covid-19 patients ,Pune,neutral
2020-06-21,🄰🄺🄰🅂🄷.🅂🄰🄱🄻🄴94 Follow our page @akashsable510 who #Lockdown #covid19 #coronavirus #coronavirusbreakout #buddhist #buddha #buddhism #jaibhim #ambedkar #ambedkarite #humanity #india #religion #bhimrao… https://www.instagram.com/p/CBtXPwplz_9/?igshid=1ag3sx44aq1d5,Pune,anger
2020-06-21,After Mashrafe Mortaza and Nafees Iqbal  Nazmul Islam also tests positive for Covid-19 ,Pune,neutral
2020-06-21,Stark difference in testing statistics of 2 of the Silicon Valleys of India @TelanganaCMO @KTRTRS @BJP4Karnataka #Hyderabad has some of the best hospitals in #india surely the #covid19 could have been managed better ,Pune,neutral
2020-06-21,#Glenmark Covid 19 Drug -#Fabiflu | GLENMARK PHARMA SHARE #FAVIPRAVIR NEWS | Best #Pharma Stocks 2020:,Pune,joy
2020-06-21,अंत तक देखना . Video edited by @RV_NAIR🄰🄺🄰🅂🄷.🅂🄰🄱🄻🄴94 Follow our page @akashsable510 who #Lockdown #covid19 #coronavirus #coronavirusbreakout #buddhist #buddha #buddhism #jaibhim #ambedkar #ambedkarite… https://www.instagram.com/p/CBtSXoDFl4N/?igshid=4e79s4ineduz,Pune,neutral
2020-06-21,National-level swimmer Ashutosh dies due to Covid-19  family alleges negligence by Delhi hospital ,Pune,sadness
2020-06-21,En famille Father’s Day got XXtra special with all of us together again at last...never mind the #covid19 scare  getting stranded  the repatriation  quarantines and hazaar video calls! #togetheragain… https://www.instagram.com/p/CBtPn0Lpkmh/?igshid=theg6aqj6hvv,Pune,fear
2020-06-21,To all the dignitaries and responsible authorities  it is totally unsafe to conduct exams in this extremely dangerous stage of covid19. Please care about us and our families. #postponemhtcet #postponemhtcet2020 @CMOMaharashtra @AUThackeray @samant_uday #stayhomestaysafe,Pune,sadness
2020-06-21,guess upto 10 days from today  slots r open for registration... if u travelling by flight  u can do couple of days before ur travel.. it will ask for couple of documents along with flight ticket,Pune,joy
2020-06-21,Covid-19 pandemic: Depression and anxiety rise among new moms ,Pune,joy
2020-06-21,Pune adds 620 new Covid-19 cases  tally reaches 12 474 ,Pune,neutral
2020-06-21,620 positive patients were found during the day. The total number of positive patients in the city was 12 474. Death 6 Positive- Sassoon 21  Naidu 441  Private 158 Critically ill 290 60 on the ventilator Number of active patients in the city #Pune #PuneFightsCorona #Covid_19,Pune,joy
2020-06-21,Researchers @CSIR_IND @AcSIR_India are giving their contribution on this #pandemic #COVID__19 situation and more in future. @AcsirS deserve #NIRFRankings2020 @shekhar_mande @HRDMinistry,Pune,disgust
2020-06-21,Bloody hell why this Rapist & Murderer is still alive & happy... Is this right Justice? Hope #COVID19 can give justice by making positive.. #justiceforrape #PMModi #LawEnforcement,Pune,joy
2020-06-21,620 new #covid19 cases recorded in #Pune today. Highest in a day so far. Also 6 deaths reported today. Total cases now stands at 12 474 out of which 4 529 are active cases; 7 435 recovered and 510 deaths. #stayhome #coronavirus,Pune,sadness
