2020-03-20,Online is OK. But every thing requires time and attention. All attention is focused on Corona virus and arranging for essentials during lockdown. Looking to activities of children and elders in house etc. if IT Depart gives extension  it will provide for more time to essentials,Delhi,sadness
2020-03-20,How article 144 will stop corona from spreading when article 144 does not allow to be more than 4 people at one place but corona can spread by two persons only So complete lock down is necessary not to impossible article 144.,Delhi,anger
2020-03-20,Sir on 21st inform forces & court pass adhayadesh on corona deadliest virus as u need to be strict as all celebrations& Parties to be stopped as celebrities to be given isolation 22nd to24th complete lock down of country with tel &amp; online work to continue,Delhi,surprise
2020-03-20,#lockdowndelhi #PMO my dear modi ji please lock down india for save our nation we know we are capable for fight against #Covid19India if we lockdown our nation then its more chances to fight against #Covid_19 bcos जान है तूह जहन है,Delhi,neutral
2020-03-20,@ArvindKejriwal @cmohry @mlkhattar cm sir plz lockdown whole city 31 March 2020 . close all office transport metro shop to Stop the spread #CornavirusOutbreak,Delhi,neutral
2020-03-20,Dear @narendramodi Sir Please lock down hole India for 15 days otherwise ham sab log mare jayege time nahi h ab please do fast @PMOIndia @HMOIndia @amitmalviya @AmitShah,Delhi,sadness
2020-03-20,Sir Pl do complete lock down from Sunday up to 3 days as to stop new cases growth as if any state doesn't follow your order as to get protection from Supreme court as no one can do resent for cause of Humanity as prepare army &amp; Police with special clothes,Delhi,anger
2020-03-20,@WHO sir  whether your officer designated in India has given any information relating to GOVT of India that the country should be lockdown from April. I have audio clip. Plz verify,Delhi,anger
2020-03-20,Sir You are doing excellent works but please do lock down your state as to protect from some wrong people Ask Media to demand to close down &amp; anyone who speaks against this as to be warned as all States including Goa UP  Uttrakhand Harayana MP,Delhi,anger
2020-03-20,@narendramodi sir  I have received this audio clip  which is very alarming over COVID-19 situation (wherein it was reported that India will lockdown from April). I humbly request to your good office to verify the genuineness of the claim made in audio clip so as to bring truth.,Delhi,fear
2020-03-20,Hmm.. Panic buying is going on. I repeat  even if there is a lockdown essential commodities will be available,Delhi,surprise
2020-03-20,So  no trains on 22nd March across India... So  it's a pan #India #lockdown on #JanataCurfewMarch22 ... I guess its a necessity now so that #India doesn't face a situation like #Italy amid #CoronavirusOutbreakindia,Delhi,anger
2020-03-20,Sir You are Great as this time whole IB is to check this virus attack along with complete lockdown including Yogi Function Media please you may be loyal to opposition but don't think that this can spread to anyone..,Delhi,sadness
2020-03-20,The market is in full flow. There can be seen people with bags and collecting groceries for the unsaid rumored lockdown. #AamAadmiParty #COVID2019india #unawareaboutcorona @ArvindKejriwal @AamAadmiParty @PMOIndia,Delhi,surprise
2020-03-20,This is what we are heading to.... #JantaCurfew to be cool to lockdown ourselves. We’ll do support as it save you and millions. ,Delhi,joy
2020-03-20,@narendramodi @AmitShah why don’t u put Nation First &amp; lock down the Nation by force. You are counting far too much on your own Political Class to do anything voluntary. Please deal with this emergency with an iron hand.,Delhi,sadness
2020-03-20,Agreed but don't you think lockdown for few days or atleast 1week help more than mere 24 hours lockdown,Delhi,joy
2020-03-20,Sir Excellent Intiative but try to invite all parties as to complete do lock down country for two days from Sunday &amp; then check persons who came in touch with positive &amp; NRI &amp; visitors to Foreign countries &amp; other celebrities,Delhi,neutral
2020-03-20,#fightwithcorona #corona #jantacarfu #Modi #IndiaFightsCorona I am requesting Modi ji to stop everything for 15 days to prevent the corona virus  before closing lock down for 15 days they can arrange Rashan ka saman to all the poor people for 15 days.,Delhi,sadness
2020-03-20,Sir All international travellers to be scanned thru IB & RAW as their activities & their meeting in last one month. Be tough to handle defaulters as to do complete lock down enforced as health emergency as this is in favour of humanity ,Delhi,sadness
2020-03-20,Total lockdown in India for 7days..is the need of today. INDIA is not that much competent to face stage 3.....plz forward this msg..to Govt nd concern authority.. Its reguest....lockdown....plz @ndtv @ArvindKejriwal @PMOIndia @BDUTT @RahulGandhi @msisodia @narendramodi,Delhi,neutral
2020-03-20,Lockdown is the only solution for Coronavirus please implement it @narendramodi @PMOIndia @myogiadityanath @CMOfficeUP,Delhi,joy
2020-03-20,Look at Italy ! India can’t afford to go that far in this #pandemic “Each city is a ghost city”: Life in Italy under full coronavirus lockdown https://www.vox.com/2020/3/18/21180483/italy-coronavirus-lockdown-quarantine-lombardy?utm_campaign=vox&amp;utm_content=entry&amp;utm_medium=social&amp;utm_source=twitter via @voxdotcom,Delhi,joy
2020-03-20,Is mumbai lock down?,Delhi,anger
2020-03-20,Spicejet not refunding 100% for April 2 to Bagdogra is criminal when: 1. PM advises no avoidable travel. 2. NE in lockdown.3 Spice advise to reschedule till 30/4 I'll advised. Why?@republic @ANI @timesofindia @dgca@pmo,Delhi,neutral
2020-03-20,@PMOIndia @narendramodi @drharshvardhan compulsory lockdown is required now the situation is worst,Delhi,disgust
2020-03-20,Delhi Govt.'s 'voluntary lockdown' of homeless for a month @DTMedicalTimes http://www.drugtodayonline.com/medical-news/nation/10749-delhi-govt-s-voluntary-lockdown-of-homeless-for-a-month.html @drharshvardhan @NULM_MoHUA @DUSIB_Shelters @LtGovDelhi @ArvindKejriwal @SatyendarJain @CHDIndia @WHO @HomelessDay #NFHHR #CHDIndia #covid19 #chdindia #corona_actionplan,Delhi,surprise
2020-03-20,#fightagainstcorona lockdown clamped by Authorities in Italy. Watch video till end. ,Delhi,joy
2020-03-20,COMPLETE LOCKDOWN is the only Solution for India! Bcz we have Morons in Abundance be it #KanikaKapoor #ShivrajSinghChouhan Stubborn Hindu/Muslim Devotees or Protesters. But PM Saaheb PR STUNTS Ka Mauka Kaise Jaane Dein!! #janta_curfew #ShaheenBagh #CoronavirusOutbreakindia,Delhi,neutral
2020-03-20,No sir full lock down by force is what will work. @narendramodi has become soft.,Delhi,surprise
2020-03-20,A weeklong lockdown beckons. ,Delhi,anger
2020-03-20,@narendramodi how many @TheKanikakapoor s will u tolerate &amp; create dangerous Corona clusters of the high &amp; mighty??? Pl lock down now.,Delhi,anger
2020-03-20,@narendramodi ji Please announce lockdown for all the states markets and everywhere. As people are not at all taking it seriously and I am scared if it will be community virus then more then half of us would be gone please sahib ji announce a complete lockdown. Jai shree Ram,Delhi,fear
2020-03-20,Thanks Chandana..and in this lock down  we need this cheer  with stocks of beer..so cheers ,Delhi,joy
2020-03-20,Dear World  How is the Lockdown? Kashmir..... ,Delhi,neutral
2020-03-20,A lot of Moori for munching Yes squash.. I miss that one veggie a lot. We people have a good experience of Lock down and curfew management. This curfew is for our own good still people doesn't understand. Sad..,Delhi,sadness
2020-03-20,I agree with Nikhil Bhai It's high time to take actions coz slowly things are going out of control. Watch News  even so called Celebs & Intellects are not listening to Govts requests   so it's time to lock down for 10-15 days,Delhi,joy
2020-03-20,MANDATORY LOCKDOWN MANDATORY LOCKDOWN MANDATORY LOCKDOWN MANDATORY LOCKDOWN MANDATORY LOCKDOWN MANDATORY LOCKDOWN MANDATORY LOCKDOWN MANDATORY LOCKDOWN MANDATORY LOCKDOWN MANDATORY LOCKDOWN MANDATORY LOCKDOWN MANDATORY LOCKDOWN,Delhi,neutral
2020-03-20,Lockdown in Maharashtra  what about other parts of the country?,Delhi,sadness
2020-03-20,NE is under lockdown. PM advised against travel. Virus is uncertain fr months. U cant force reschedule and 30 April. It's a fraud to India. @smitaprakash @DGCAIndia @PMOIndia @HardeepSPuri . Refund our advance.,Delhi,disgust
2020-03-20,We can't stop crona until people of world are lockdown Can we cheat death ?? Because this is called pure pandemic to our world even until we can not beat this disease until every human is cured of it and its particles should be erased from everywhere #COVID2019 #coronavirus,Delhi,anger
2020-03-20,@MoHFW_INDIA @drharshvardhan @narendramodi @AmitShah this is the right time to lock down please dont wait for sunday  still people roaming and MNC and other companies are not listening,Delhi,anger
2020-03-20,Are u scared of total lockdown or just being critical. Extraordinary critical situations require desperate measures. Let's b supportive of Govt measures and defeat the evil COVID 19.,Delhi,fear
2020-03-20,Lockdown In Khurram Nagar   LUCKNOW – Where 3 Persons And Singer Kanika Kapoor Tested Corona Positive Today #CoronavirusOutbreakindia,Delhi,joy
2020-03-20,Sir what about other businesses in DELHI  pls think about ordering complete lockdown,Delhi,anger
2020-03-20,@ArvindKejriwal sir if Mumbai can afford a complete lockdown  what is Delhi waiting for  pls order the same for Delhi otherwise ppl will not stop moving out..,Delhi,anger
2020-03-20,#Socialdistancing is the need of the hour. Irresponsible behaviour to organise such large gatherings during these times when our leaders are expected to set an example for our citizens. Major cities world wide are entering into full lockdown mode because of #COVID19.,Delhi,neutral
2020-03-20,Bro this isn't enough you go and check the pattern in which corona virus is spreading.. Only Complete Lockdown is the solution for our country &amp; If the govt. doesn't take aggressive steps now we will not be able to control the situation as China did which is 15 trillion economy,Delhi,neutral
2020-03-20,Let's learn from the #lockdown in #spain and #italy before it's too late. Let's stop #covid_19 from wrecking our lives any further. Let's show some #commonsense . Let's make #socialdistancing a #wayoflife for the… https://www.instagram.com/p/B9836Q0lopv/?igshid=m57o47t8ajb2,Delhi,joy
2020-03-20,Toh fir go for a “lockdown” the govt should go for a “lockdown”. Why this fake attempts with “Junta Curfew”.,Delhi,neutral
2020-03-20,@narendramodi Sir Hard decision has to be taken. A 7days lock down will identify affected people and they will also be not able to spread the covid19. Let be a hard decision again. This will be appreciated by all even opposition too.,Delhi,sadness
2020-03-20,Maharashtra CM Uddhav Thackeray announces lockdown in Mumbai  Pune  Nagpur #girlsinstem #stemforgirls #CoronaVirusUpdate #CoronavirusPandemic #corona #coronavirus #f1inschools #STEMeducation #TeamBlaze,Delhi,disgust
2020-03-20,Sensex did improved by 2000 points in the after noon but started to slide down on the of Mumbai lock down.,Delhi,neutral
2020-03-20,No I Am Not Ok With @narendramodi Statement. Be Clear  Order A Proper Lockdown. Impose A Proper Curfew For At Least Two Weeks. This Is Not A Time For Stupid Trials. We Are Not Taking Situation Seriously. We Are Doing What Italy And Other Foreign Countries Did 'Laparwahi'.,Delhi,anger
2020-03-20,India is about to put the country on a lockdown  Thailand is closing it's borders on Sunday. I need to go back home as soon as possible.,Delhi,neutral
2020-03-20,Complete lockdown in mumbai  Pune and Nagpur. Stay at home  stay safe !! @coronaviruscare,Delhi,neutral
2020-03-20,@MichaelKugelman lockdown has to be pre-planned  in India long term lockdown could lead to starvation deaths and complete breakdown of social order. #JantaCurfew,Delhi,anger
2020-03-20,Many days lockdown in India could also mean starvation death for many  लोग भुखमरी से भी मरते रहे हैं  सनद रहे #COVID19 Hope we won't need long #janta_curfew #CoronavirusOutbreakindia,Delhi,joy
2020-03-20,Dear @BJP4India  Now U cn declare complete Lockdown to avoid #CoronavirusOutbreakindia U again prove that politics &amp; सत्ता is more important for u ppl then welfare of citizens. #KamalnathResign #BJPKidnapsMLAs #bjpswarondemocracy,Delhi,neutral
2020-03-20,WFH  Day 12. Hello darkness my old friend. #lockdown #socialdistancing #corona #pandemic #workfromhome #staysafe #hygiene #washyourhands @Logix Blossom County Sector 137 Noida https://www.instagram.com/p/B98kLsDBZUt/?igshid=15mub4nrtna16,Delhi,joy
2020-03-20,Without forming government? Lockdown? ,Delhi,anger
2020-03-20,15 april to 15 may #india lock down. Government will announce soon. Mark the date . Be prepared! ,Delhi,anger
2020-03-20,#Lockdown should be the main #prayer of any religion in world in this crisis of #CoronaVirusUpdate,Delhi,anger
2020-03-20,@PMOIndia @narendramodi Dear sir  request your to lockdown India for a week at least for longer prosperity bcz for Desi CompaniesHuman Resource is only Resource not Humans. Only our families gonna miss us company will fine the replacement very next day.,Delhi,sadness
2020-03-20,This Janata Curfew is a great move but the flip side is house helpers in my locality have lost their part time jobs from boutiques etc saying there’s a lockdown in India. Most of them are in tears. The owners don’t realise it’s for a day and the country is not in lockdown mode.,Delhi,neutral
2020-03-20,For sustainability of environmental gains from #lockdown  World need fragility of red-tape &amp; profiteering. Lets hope #CoronavirusOutbreak shall also bring suitable change to the concept of office streets  markets &amp; school which becomes outdated with Fourth Industrial Revolution.,Delhi,neutral
2020-03-20,#CoronavirusOutbreakindia #CoronaKoDhona #coronavirusinindia #Coronaindia please stay inside your homes and don’t go out unnecessarily! Observe it as voluntary lock down ! The coming two weeks are crucial ! @BJP4India @BJP4Gujarat @BJYM @PIB_India @PIBHindi @rashtrapatibhvn,Delhi,sadness
2020-03-20,People never knew that lines of Bashir Badr will one day describe the corona virus scenario of lockdown n Social Distancing.,Delhi,sadness
2020-03-20,Searching for a virus without a test is like looking for a needle in a haystack blindfolded... Also lock down. The ebola lessons. ,Delhi,neutral
2020-03-20,Before the stage 3 hits  and lockdown is enforced  this is a dey run to test the preparedness of the civic authorities  and maybe get an inkling into the challenges that may arise.,Delhi,neutral
2020-03-20,Perhaps the first lockdown in India to contain the spread of Coronavirus ,Delhi,neutral
2020-03-20,#ArvindKejriwal #CoronaVirusUpdate Dear CM When delhi malls are close we also people &amp; meet lots of foreigners &amp; customers per day we need to work at home all NCR malls are lockdown ,Delhi,neutral
2020-03-20,This #Friday we #ClimateStrikers are supporting senior citizens &amp; the daily wage earners who may be in difficulty due to lockdown; it could be a phone call  sharing a joke  fetching grocery/medication or sharing some of our excess rations with our needy friends! #DigitalStrike,Delhi,joy
2020-03-20,The #COVID19ON lockdown shall surely tell people how Kashmir survived so many lockdowns in the past years. ,Delhi,neutral
2020-03-20,I guess Govt. is also preparing to meet the supply chain demands of such a lock down before it's kicked in..people will need extensive essential supplies stocked up to wade through such a lock down.. ,Delhi,anger
2020-03-20,Appreciable initiative should have touched how Govt. is ready & partial lockdown was expected &amp; is the need of the situation. Adherence to Janta Curfew expected 99%. ,Delhi,surprise
2020-03-20,Secretly most of us were not expecting anything positive from last night's 8pm address. And many including me  heaved a sigh of relief that no moronic lockdown measures were taken. We're officially stateless &amp; will manage on our own  thanks.,Delhi,surprise
2020-03-20,I feel a lockdown will be announced after the M.P floor test.,Delhi,joy
2020-03-20,Do you think Janta Curfew is a brilliant drill idea to prepare a nation of 130 crore for maybe an actual lockdown in future if circumstances arise? War like strategy/preparation. Our country is in safe hands. We can sleep in peace. He is there looking out for us :),Delhi,fear
2020-03-20,#GurdwaraBanglaSahib from Prakash vella today 20th March 2020 with senior citizens doing Sewa. While the entire world is in a lockdown  why is sewa still on at ‘Joda Ghar’ @DSGMCDelhi @DSGMCofficial @mssirsa Kindly take immediate action!,Delhi,anger
2020-03-20,I am talking generally. Lockdown or no lockdown. Drink and Drive is unfortunately too common in this part of the world./.,Delhi,neutral
2020-03-20,Sir can we bl the figures released by Chinese authority. Though lockdown may have saved many lives in Italy unconfirmed reports puts chienese figures to be much higher,Delhi,sadness
2020-03-20,Population of China:138.6 Crore / 1.38 Billion Covid deaths in China: 3242 Population of Italy: 6 Crore / 60 million Covid deaths in Italy: 3405 and rising The virtues of a fast and effective lock down. India still sleeping. (via @AKhatchaturian ),Delhi,sadness
2020-03-20,A lockdown will be another blunder like demonetization.,Delhi,neutral
2020-03-20,#coronavirusindia #Corona #Covid_19 Watch full video in youtube link is https://youtu.be/sfw-U-Ry5NM Subscribe the BM Traveller chennal in youtube. please share this video ur friends,Pondicherry,joy
2020-03-20,Wow! This looks like a strategically thought after caretaking effort by a government entity for its people when we get affected by pandemic #COVID #india #Kerala,Pondicherry,surprise
2020-03-20,I don't know what to say regarding my vacation  Even though it could been wasted by COVID-19 outbreak. However my strong hope and prayers for only back to normal life #Vacation #CoronaVirus #CoronaVirusOutbreak #COVID19 #DistanceFriend #RussianFriend #Pondicherry #SCTresult,Pondicherry,joy
2020-03-20,@sooriofficial anna the legend! @Siva_Kartikeyan anna! @ponramVVS sir! #staysafe#Preventionisbetterthancure #CoronavirusOutbreakindia #Coronaindia #CoronaVirusUpdate #coronaupdate #கொரோனாவைரஸ் #கொரோனா #COVID19ON #ChineseWuhanVirus #Covid_19 #fun #meme by @RamRockingRam ,Pondicherry,joy
2020-03-20,Online meeting between Pondicherry India - China Friendship Association and LinkExpo http://corp.ltd. Followed by MOU signing between the 2 parties . ****PICFA is working from home and attending online meetings  ( together we fight against COVID 19 ) ,Pondicherry,neutral
2020-03-20,India fighting against COVID 19   we salute to all the healthcare professional workers around the World ,Pondicherry,anger
2020-03-20,These Are Millitary trucks carrying Dead bodies of Those Died due to #Covid_19 in #Italy Please Everyone Stay At Home  Avoid Socializing  do What gov. Is telling and Take the Situation Seriously #SocialDistanacing #COVID #CoronaCrisis #ItalyCoronavirus,Jaipur,sadness
2020-03-20,India too.... maximum number of cases reported today ... #Testing/Isolation #COVID,Jaipur,sadness
2020-03-20,I would urge all the retired medics of India to return to work  till we are in safe side. @PIB_India @PIBHindi @sudhirchaudhary @MoHFW_INDIA @drharshvardhan #CoronaStopKaroNa #Coronaindia #CoronavirusOutbreakindia #COVID19 #COVID #KanikaKapoor #WarAgainstVirus #CoronaCrisis,Jaipur,anger
2020-03-20,Be safe stay at your home for few days and use senitization to finish #Covid_19,Jaipur,neutral
2020-03-20,Animals can't transmit COVID-19  stop creating panic  says Maneka Gandhi https://mumbaimirror.indiatimes.com/animals-cant-transmit-covid-19-stop-creating-panic-says-maneka-gandhi/articleshow/74608017.cms via @mumbaimirror,Jaipur,anger
2020-03-20,#JanataCurfewMarch22 PM Modi  we stand solidly with you in our joint battle against COVID 19. If sacrifices are required they will be made  no questions when the Nation and humanity are involved. Come on India LET'S FIGHT.,Jaipur,neutral
2020-03-20,Quarantine with Coffee #GoCoronaGo . Nothing new for me these days. . Ps: home made coffee with full precautions  gloves pehan kar banayi hai. . . . ... #Coffee #Isolation #covid_19 @Jaipur  Rajasthan https://www.instagram.com/p/B99YCtNgsqw/?igshid=186q326yxryx,Jaipur,joy
2020-03-20,It's raining in #Jaipur #Rajasthan . This is first time in our life when we praying for hot sunny summers #CoronaStopKaroNa #Covid_19 #COVID #IndiaFightsCorona,Jaipur,joy
2020-03-20,#Merciful_LordKabir The constitution of God says that one should do true devotion  leaving condemnation and backbiting. Lord kabir is only god which can erase all of our sins  for the we should follow the way of worship provided by Saint Rampal ji maharaj. #Covid_19 – at Reliance Market,Jaipur,surprise
2020-03-20,OCD cases and flare rates may increase #Covid19India #COVID,Jaipur,neutral
2020-03-20,This is serious... #COVID #CoronavirusOutbreakindia,Jaipur,anger
2020-03-20,FYI  the facts you are hearing about COVID 19 at each stage are actually coming through vigorous researches. Lot of researchers (PhDs) working day &amp; night to understand the behaviour of this virus  which inturns help the treatment. #India #Covid19India #science,Jaipur,sadness
2020-03-20,Please be at home everyone. I hope you all got to know about Bollywood Singer who tested positive in Covid-19. And she went to a party with around 100people in there. #BeSafeEveryone #Takethisseriously,Jaipur,joy
2020-03-20,Iran: One person is dying from covid-19 every minute. California imposes a lockdown affecting 40M people Deaths in Italy surpass those in China. UK: we can flatten the virus curve in the next 12 weeks. Wash your hands. Wash your hands. Wash your hands. #StaySafeStayHome,Jaipur,sadness
2020-03-20,The face of leadership looks something like this! #Corona #Covid_19 #Kerala,Jaipur,neutral
2020-03-20,He clearly said....windows   doors and balconies....tere jaise dalle log...sirf balcony pakad ke...chalu Kar dete hai... Vishal dallaani (Baal kami) #CoronaStopKaroNa #CoronavirusOutbreakindia #COVID #CoronaCrisis #COVID #Covid_19,Jaipur,anger
2020-03-20,#COVID2019india #very #save in your life and save your country And save own World #FightCoronaVirusIndia #stop Anytime alert to seriously metter of this #COVID #virus,Jaipur,surprise
2020-03-20,Fight against with covid-19 We are togetther ,Jaipur,anger
2020-03-20,It's time to take this virus seriously.#covid_19 @Tattoo Factory https://www.instagram.com/p/B98jbClhT-Y/?igshid=1oxru4owbimnr,Jaipur,anger
2020-03-20,Fellow Indians  Namaskar A short while ago  Our PM Saab  Modiji  requested all of us to show resolve &amp; restraint in the face of COVID-19. Please also adhere to the Janta Curfew on 22nd March by staying home. Stay Safe stay healthy.. be careful ,Jaipur,neutral
2020-03-20,How COVID-19 Has Impacted Google Ads Results Affecting Small Businesses &amp; Marketers Read More https://www.futureindicate.com/how-covid-19-has-impacted-google-ads/ #digitalmarketing #onpageseo #seospecialist #ppc #internship #socialmediamarketing #influencermarketing #marketing #marketers #COVID19 #coronavirus,Jaipur,neutral
2020-03-20,First stop the newspaper home to home delivery bcz if one distributers effected from covid 19 whole city will in danger @raghav_chadha @PMOIndia @ArvindKejriwal @AshokGahlotINC,Jaipur,sadness
2020-03-20,#INDIA NEEDS IMMEDIATE LOCK DOWN...,Jaipur,anger
2020-03-20,Rajasthan c.m sir se hath jodkar request hai ki huamre rajasthan ko 31 march tak lock down kr diya jaye   hamare rajasthan gav k log itna jagrut hokar bhi inhe serious nhi lete plz request hai – at Vaishali Nagar,Jaipur,anger
2020-03-20,#CoronavirusOutbreakindia Why Indian government is not serious after situation of Italy and other advance countries?? There should be immediate LOCKDOWN  government should make possible arrangements to provide essential services and food products during LOCKDOWN @PMOIndia,Jaipur,sadness
2020-03-20,An excellent meeting with updated information on @RajGovOfficial efforts to lock down affected areas and increased testing  both of are responsible for control other than IEC on maintaining safe distance and soap handwashing. @CUTSCART @cutschd,Jaipur,surprise
2020-03-20,Iran: One person is dying from covid-19 every minute. California imposes a lockdown affecting 40M people Deaths in Italy surpass those in China. UK: we can flatten the virus curve in the next 12 weeks. Wash your hands. Wash your hands. Wash your hands. #StaySafeStayHome,Jaipur,sadness
2020-03-20,Israel passes emergency law to use mobile data for COVID-19 contact tracing http://dlvr.it/RSGkjS,Chennai,anger
2020-03-20,#TN_Together_AgainstCorona and No #Local Governance. Appreciate the efforts of TN govt towards COVID-19 outbreak. Yes  indeed inspiring http://efforts.In recent press coverage @Vijayabaskarofl expressed his concern over people gathering in groups and being causal as usual.,Chennai,anger
2020-03-20,@ProfBhargava hi sir ... can we import IgM tests for COVID... why can’t we screen passengers in airports   stations   buses etc ... use this a screener test ?,Chennai,neutral
2020-03-20,#StayAtHome and let's break the chain #COVID2019india #Covid_19 #CoronaStopKaroNa #caronacrisis #IndiaFightsCorona #JanataCurfewMarch22 #CoronavirusOutbreakindia,Chennai,anger
