2020-03-20,Good decision #DOB Sir Wishing you #NoCoronaVirus But I must say #DushyantSingh &amp; his mother has done irresponsible thing. #DerekOBrien #SelfIsolation #COVID19 #CoronavirusOutbreakindia #IndiaFightsCorona #CoronaVirusUpdate,Kolkata,anger
2020-03-20,Good decision #DOB Sir Wishing you #NoCoronaVirus But I must say #DushyantSingh &amp; his mother has done irresponsible thing. #DerekOBrien #SelfIsolation #COVID19,Kolkata,anger
2020-03-20,#COVID19 positive cases in Bengal had got infected abroad and carried the viral infection  the Govt of West Bengal appeals to all persons who have returned from abroad in the recent past  necessarily confine themselves in home quarantine for a period of 14 days,Kolkata,sadness
2020-03-20,Khans r under pressuer? Y do they shut their mouths when entire nation has been fighting deadly COVID19? ,Kolkata,anger
2020-03-20,Lok sabha MP Dushyant Raje n his mother Vasundhara Raje attend a party in Lucknow which was also attended by Kanika Kapoor. Kanika turns out to be Corona+. Meanwhile  Dushyant goes to parliament. Others at the party attend UP Govt meeting. #Corona #Coronavirus #COVID2019 #COVID19,Kolkata,neutral
2020-03-20,When everyone is shouting about awareness  about being cautious. I don't understand how these people end up doing such an irresponsible inhuman act. 1 patient can cause havoc ppl need to understand  this is ridiculous #KanikaKapoor #Covid19 ,Kolkata,anger
2020-03-20,Using #data from Johns Hopkins University  Reddit user Edward-EFHIII created a #heatmap that tracks the spread of #COVID19 across the world since late January. It demonstrates the speed at which the #Coronavirus outbreak is spreading throughout the world.,Kolkata,neutral
2020-03-20,What a Shame. It seems the authorities in Pakistan need brain implant because It's clear They are brainless. In Indian cities Schools already closed till 15th April and shops  malls  cinemas till 31st March. Pakistan will be wiped out by Covid19 very soon. ,Kolkata,neutral
2020-03-20,Self Conscience and self consciousness are essential to combat COVID19 ,Kolkata,surprise
2020-03-20,@TheKanikakapoor You lost all respect today  in such pandemic situation where everyone is fighting against COVID19  you have shown height of being irresponsible citizen of India and you have also costed life of millions.. God will not forgive you ...,Kolkata,anger
2020-03-20,Of course he is getting bored with #COVID19. Manchilds often do when discussing serious topic beyond their intelligence level ,Kolkata,disgust
2020-03-20,Absolutely Mr.Birat Kohli acceding to the Citizens about the Administrative Precautions Because COVID19 has entered 3rd Phase ,Kolkata,surprise
2020-03-20,Thank you Amitji for sharing an excellent informative video.. The whole world today is a big family.. .. Together we can break #CoronavirusOutbreak #coronavirus #Covid19 ,Kolkata,joy
2020-03-20,Appeal by WB Govt - Since both #COVID19 +ve got infected abroad &amp; carried the viral into Kol  the Health &amp; Family Welfare Dept  appeals to all who have returned from abroad incl UK  USA  Europe &amp; Gulf to necessarily confine themselves in home quarantine for 14 days @businessline,Kolkata,sadness
2020-03-20,Now a days e-commerce makes our life much more easier  because it saves time  we can get our goods in a short period of time  other than that it connect to businesses around the world  we can buy goods that we can't get from the local market. #thankyouecommerce #COVID19,Kolkata,joy
2020-03-20,Yess I support #JantaCurfew and give a big Salute to all the doctors and the supporting staff for their Commendable Job in the service of the Nation to combat #CoronavirusOutbreak #covid19 ,Kolkata,joy
2020-03-20,Almost ₹1000 spent for this irresponsible behaviour during these tough times of #covid19 outbreak. And then the bike driver started to explain that helmet is used by many. These things can happen and all those shit. #Shameless #Shameful #UselessService,Kolkata,anger
2020-03-20,By the time Sunday 22nd March comes for so called Janta curfew  India would be looking at 250+ positive cases of #Covid19.India should initiate partial lockdown. State and centre should give orders to ppl to stop moving around in places.Need actions more than the words @PMOIndia,Kolkata,anger
2020-03-20,Breaking: Second Corona positive case reported in Kolkata. 22 year old youth tests Covid19 positive. Had returned from UK on March 13. Have been kept in isolation #CoronavirusOutbreakindia #CoronavirusPandemic #Corona,Kolkata,neutral
2020-03-20,There is JANTA CURFEW to fight coronavirus . I support and we should all take part and keep fighting this Covid19 #janta_curfew #CoronavirusOutbreakindia,Kolkata,surprise
2020-03-20,Second #COVID19 positive case reported in West Bengal. Admitted at Beleghata ID. Infected had returned from London recently:sources. More details awaited. @businessline @shobharoy @nramki_Madras @AlfaShenoy,Kolkata,joy
2020-03-20,#CASEno2 #COVID19 #Kolkata Be safe. Stay at home . Isolate. Quarantine. Don't travel. Don't gather. Don't panic. Don't ignore advices. Visit doctors. COOPERATE .,Kolkata,joy
2020-03-20,#IndiaFightsCorona Let’s break the #COVID19 MYTHS How deadly is coronavirus ONLY 2 % MORTALITY Can an infected person recover completely OF COURSE Why can only designated labs test infected people IT IS HIGHLY INFECTIOUS Why is there panic RUMOUR MONGERING ,Kolkata,neutral
2020-03-20,To protect yourself and others from Corona Virus join “ JANATA CURFEW” on 22nd March  2020 from 7.00 AM to 9.00 PM Only awareness and its implementation can save yourself and the Nation from #COVID19 #IndiaFightsCorona #JantaCurfew,Kolkata,neutral
2020-03-20,"‘ ...a speech in the mould of John F Kennedy.. ""Ask not what your country can do for you – ask what you can do for your country”.’A very objective analysis of #PMModi’s address on #COVID19. https://www.thequint.com/voices/opinion/coronavirus-modi-janata-curfew-people-should-prepare-for-longer-periods-in-solitude #JanataCurfew #Janata_Curfew #PMForJantaCurfew @NilanjanUdwin",Kolkata,surprise
2020-03-20,It's a very important urge to the nation by our respected h'nble PM @narendramodi to do the #JantaCurfew .... I support and request all citizens of our nation to do the same on 22nd March  2020 Let's defeat the #COVID19 together...and make our country #Corona free,Kolkata,neutral
2020-03-20,#IndiaFightsCorona No idea what I am talking about. But when our laptop gets infested with Virus and there is no antivirus to clean it  we format the software and reload the fresh software. May be this idea may give some clue to scientists,Kolkata,neutral
2020-03-20,Rise over politics and follow an efficient Model.Let a successful model of the people for the people & by the people take the Driver's seat in such horrific times. #IndiaFightsCorona #CoronaStopKaroNa #CoronaVirusUpdate #ForABetterIndia #FridayThoughts @vijayanpinarayi @CMOKerala,Kolkata,anger
2020-03-20,Take the #SafeHandsChallenge I nominate @mehakapoor27 @MoHFW_INDIA @WHO @IshqFM . #IndiaFightsCorona here https://www.instagram.com/tv/B9848RYALdH/?igshid=qlw82b1r13wj,Kolkata,anger
2020-03-20,Let's behave like matured and responsible citizens...only time will tell...self quarantine... #IndiaFightsCorona #Covid19India #coronavirusindia #StayHomeStaySafe #NationFirst,Kolkata,anger
2020-03-20,Good decision #DOB Sir Wishing you #NoCoronaVirus But I must say #DushyantSingh &amp; his mother has done irresponsible thing. #DerekOBrien #SelfIsolation #COVID19 #CoronavirusOutbreakindia #IndiaFightsCorona #CoronaVirusUpdate,Kolkata,anger
2020-03-20,Sir  as per news by @Zee24Ghanta #TMC #MP @derekobrienmp has gone to #SelfIsolation #Quarantine as he sat next to #DushyantSingh Is it true Sir?? If yes  Good decision Sir Wishing you #NoCoronaVirus #DerekOBrien #IndiaFightsCorona,Kolkata,anger
2020-03-20,Corona India Helpdesk  on whatsapp https://wa.me/919013151515?text=Hi This will automatically open up MyGov Corona Helpdesk inside WhatsApp app. Prepare  Don't Panic #IndiaFightsCorona,Kolkata,anger
2020-03-20,Fighting with #covid_19 in every possible way. Even changing my look! #indiafightscorona @Kolkata https://www.instagram.com/p/B98izTaAGR7/?igshid=ny8s1ynnwhds,Kolkata,surprise
2020-03-20,N95 masks are for those treating covid -19 patients  Patients with corona virus  family members of the positive patients. Do not waste it by using unnecessarily &amp; thus creating shortage for the actually needful. Be educated enough before jumping into anything. #IndiaFightsCorona,Kolkata,disgust
2020-03-20,I support #janta_curfew &amp; U also Positively Support JANTA CURFEW. #IndiaFightsCorona @Kolkata https://www.instagram.com/p/B98fy-YJr26/?igshid=4iz87lg4daex,Kolkata,anger
2020-03-20,I support #janta_curfew &amp; U also Positively Support JANTA CURFEW. #IndiaFightsCorona ,Kolkata,surprise
2020-03-20,In the midst of #CoronaVirus out break we Indian(s) have forgotten that today is an important day. 4 convicted in #NirbhayaCase has been hanged in d morning setting an example 2 all other tat India is not going 2 stop 4m giving punishment during this emergency. #IndiaFightsCorona,Kolkata,anger
2020-03-20,Kerala Model vs Gujarat Model....choice is yours. #CoronavirusOutbreakindia #CoronaVirusUpdate #coronavirusinindia #JanataCurfew #IndiaFightsCorona,Kolkata,anger
2020-03-20,Our country is now in an emergency situation   the virus victims r now increasing in a rapid number . Be safe   wash ur hands   and try to stay in ur house . #StaySafeStayHome #IndiaFightsCorona #ChineseVirus #WorkFromHome,Kolkata,disgust
2020-03-20,Janta Baand will be a test of our maturity as a nation...is it country first or something else...@narendramodi sir  I really hope the nation doesn't disappoints us... #IndiaFightsCorona #StaySafeStayHome #NationFirst #IndiaComeTogether,Kolkata,sadness
2020-03-20,#IndiafightsCorona PM Narendra Modi Ji has requested the Nation to practice Self Isolation on Sunday March 22  2020............... IN YOUR SUPPORT PRIME MINISTER!! BHARAT MATA KI JAY!! ,Kolkata,neutral
2020-03-20,“Imagine there's no countries It isn't hard to do Nothing to kill or die for And no religion too Imagine all the people living life in peace”.... #JohnLennon #IndiaFightsCorona #Coronaindia,Kolkata,sadness
2020-03-20,#IndiaFightsCorona Let’s break the #COVID19 MYTHS How deadly is coronavirus ONLY 2 % MORTALITY Can an infected person recover completely OF COURSE Why can only designated labs test infected people IT IS HIGHLY INFECTIOUS Why is there panic RUMOUR MONGERING,Kolkata,neutral
2020-03-20,To protect yourself and others from Corona Virus join “ JANATA CURFEW” on 22nd March  2020 from 7.00 AM to 9.00 PM Only awareness and its implementation can save yourself and the Nation from #COVID19 #IndiaFightsCorona #JantaCurfew,Kolkata,neutral
2020-03-20,I pledge that I will strictly follow Janta Curfew this Sunday from 7am to 9pm so that we strengthen India’s fight against the Corona Virus. #IndiaFightsCorona ,Kolkata,neutral
2020-03-20,Home Quarantine is Difficult in India #coronavirus #Covid19India #COVID #HomeQuarantine,Pune,anger
2020-03-20,It’s a great initiative  and is the need of the hour. With all the rumours going around on social media  we need someone we can trust for the right information Thank you @WHO #Covid19India #CoronaVirusUpdate #coronavirus #covidvsworld,Pune,anger
2020-03-20,These incidents of #KanikaKapoor and the bureaucrat’s brat in West Bengal reminds us all  how privilege has been misused in our country since decades! #coronavirus #Covid19India #CoronaStopKaroNa,Pune,surprise
2020-03-20,Can’t expect much from someone who thinks she is “baby-doll sone di” @timesofindia @ndtv #coronavirus #Covid19India #KanikaKapoor #CoronaStopKaroNa,Pune,surprise
2020-03-20,Where else it will feel safe and comfortable to be during #CoronavirusPandemic #CoronaVirus #JantaCurfew than home? Finally Work From Home sanctioned! Chennai #IndiaFightsCoronavirus Thanks @Techmbs_tweet @anandmahindra,Pune,joy
2020-03-20,#CoronaVirusUpdate #punecorona 20.03.2020 Total admissions 388 Samples collected 388 Negative 351 Result awaited 28 Discharge 350 Admit but stable 38 positive 9 No of patients kept in quarantine centres 112 #Covid19India #maharashtralockdown #coronavirus @BjgmcSgh @PuneCityLife,Pune,joy
2020-03-20,#coronavirus is being globally tracked.,Pune,neutral
2020-03-20,#ChineseVirus is a synonym to #coronavirus,Pune,anger
2020-03-20,The way to contain coronavirus in India is to follow South Korean Model. Please check video - https://youtu.be/BS0qoRyapUI #COVID2019india @PMOIndia @OfficeofUT,Pune,anger
2020-03-20,If you have fever  cough & difficult breathing  call State helpline no. or Ministry of Health & Family Welfare  Govt. of Indias 24*7 control room 011-23978046 #CoronavirusOutbreakindia #coronavirus #CoronaStopKaroNa,Pune,sadness
2020-03-20,I did my bit... Distributed Soaps for maintaining self hygiene to security guards of our society. Also made them aware about personal hygiene and how they can take precautions against #CORONAvirus They r standing for all of us... #StaySafeStayHome #CoronavirusOutbreakindia,Pune,neutral
2020-03-20,While we are fighting coronavirus  I think we already have pandemics going on for quite some time. Isn't lethargy  corruption  resignation  cynicism  mediocrity all like pandemics? 1/3 #CoronavirusOutbreakindia #chaltahaivirus  #kuchnahihosaktavirus  #wearelikethisonlyvirus,Pune,anger
2020-03-20,Time to be serious  The only thing  we can do is  social distancing. #gocoronago #coronavirus #corona #socialdistancing #italy #china #spain #iran #india @Go Corona https://www.instagram.com/p/B99sPRYHAOq/?igshid=dzy6e2a1ujlk,Pune,anger
2020-03-20,Corona virus laugh?,Pune,joy
2020-03-20,No government can tolerate Pakistani P.. sitting at Shaheen Bagh for no reasons. Time has come to bundle them and put them with Corona Virus patients.,Pune,neutral
2020-03-20,Italy totally failed to fight against Corona Virus. It was too late for lock down. When they found 100 corona patients they should force for lock down for 15 days at least  But now its too late  now lock down should be above 3 months. Jai Hind. ,Pune,surprise
2020-03-20,Kids have cancelled the birthday parties....people have postponed the weddings but some stupid people can’t stop partying #KanikaKapoor #DushyantSingh #Lucknow #CoronaStopKaroNa #coronavirus,Pune,anger
2020-03-20,Why celebrations ain't stopping? Leaders should understand need of the hour. This is not the way #coronavirus Will be stopped!.. @narendramodi @PMOIndia @CMOMaharashtra,Pune,anger
2020-03-20,Is #BJP Promoting #Coronavirus ??? After @PMOIndia ‘s appeals to country to avoid gatherings bcos of #coronavirusindia. But No respect no response by MP BJP.,Pune,neutral
2020-03-20,@CMOMaharashtra if we stop construction sites then the chances of labour who will be sitting idle in their hutments will gather together for chat or drinks. It will increase the chances of sprad of #coronavirus more. But if they work onsite I think they will be safe. Think again,Pune,neutral
2020-03-20,This is huge! The Corona Virus quanrantine is turning Cyrptcurrency Markets volatile. Having 13.49% increase in 24 hours is a more than a mean increase. #BTC @BTCTN,Pune,surprise
2020-03-20,I need to knw who violated my living rights we the public are still being slaughtered like sheep  this corona virus has screwed humanity  every human has a right to know who is responsible for this and will the living human race punish the culprits.@BBCWorld #COVID2019,Pune,anger
2020-03-20,Don't believe CHINA'S News . They had hidden Corona Virus Deaths in their own Country for last 18/20 months. It started in 2018/19. The deaths numbers could be more than LAKHS. No Private Media in CHINA. Only the Govt.of CHINA News.,Pune,neutral
2020-03-20,This video which is circulating on social media  we got it via WA. Here looks like how @tech_mahindra defies govt order N argues with official. Thr may b many such cases ... Contd... FYI @anandmahindra https://youtu.be/cjp6ETA1KvQ #CoronavirusOutbreakindia #coronavirus #pune 1/2,Pune,anger
2020-03-20,With reference to the ongoing Covid-19 pandemic and as per the advisory received from the Govt to prevent spread of Novel Corona Virus  DentisTree has been closed till 31.03.2020 Pls stay safe and healthy With Regards Dr Kanupriya's DentisTree – at Pune | पुणे,Pune,neutral
2020-03-20,Beating utensils etc not for dancing. It is for applauding our medical  Nursing  Paramedics and all others who selflessly taking care of Corona virus patients endangering their own lives. We R not ignorant that other countries have done it too.,Pune,neutral
2020-03-20,#ThaaliBajao alone will not help in #coronavirus   what is needed is #honesty #discipline #selfquarantine from citizens and increased #testing #healthcare #walkthetalk #coordination #urgency from government,Pune,sadness
2020-03-20,Salute to this lady. #Coronavaccine #COVID2019 #coronavirus ,Pune,joy
2020-03-20,Lack of education and understanding the cause and repercussions is the only reason why the #CoronaVirus is spreading so rapidly in the country!!Not Understanding the point of #SocialDistancing &amp; having the carefree attitude will not help!#IndiaFightsCorona,Pune,neutral
2020-03-20,#Poll: Do you think #JantaCurfew is enough to contain the #coronavirus pandemic in India? #Sakal #SakalMedia #news #viral #CoronaStopKaroNa #QuarantineLife #JantaCurfewChallenge #Covid19India #JanataCurfewMarch22 #covidindia #CoronavirusOutbreakindia #COVID #polloftheday,Pune,anger
2020-03-20,#Poll: Do you think #JantaCurfew is enough to contain the #coronavirus pandemic in India? #Sakal #SakalTimes #news #viral #CoronaStopKaroNa #QuarantineLife #JantaCurfewChallenge #Covid19India #JanataCurfewMarch22 #covidindia #CoronavirusOutbreakindia #COVID #polloftheday,Pune,anger
2020-03-20,"This is for people whose Wedding has been delayed /postponed due to #coronavirus. ""May be the God is Giving you some more time to think &amp; Decide Again."".. #Covid19India #wedding",Pune,anger
2020-03-20,Keep up with these fines even after threat of #CoronaVirus goes #DoNotSpitOnTheRoads,Pune,neutral
2020-03-20,If we are tested with negative result for #coronavirus does it mean we cannot contract it later? If no  then any number of testing kits won't be sufficient for our population. Only precautions can help then. Can somebody explain??,Pune,neutral
2020-03-20,Video No 3 of Rastriya Swayamsevak Sangh Cadres engaged in the sanitation under the Swachhata Abhiyan to help control the spread of Coronavirus in the slum area of Gokhale Nagar Pune Maharashtra. ,Pune,neutral
2020-03-20,Wonderful initiative  as a citizen I urge to continue this post coronavirus as well and let us also support by sending defaulters details to you #AntiSpittingMovement @SwachhSmartPune @eco_mee @CPPuneCity @PuneCityPolice,Pune,neutral
2020-03-20,Go #Corona #Corona Go Sterilization done #coronavirus #Sterile_jumma #جمعتكم_معقمة @Pune  Maharashtra https://www.instagram.com/p/B99D8dNhARN/?igshid=1iud4f659lmyx,Pune,anger
2020-03-20,Video No . 2 of Rastriya Swayamsevak Sangh Cadres engaged in the sanitation under the Swachhata Abhiyan to help control the spread of Coronavirus in the slum area of Gokhale Nagar Pune. ,Pune,neutral
2020-03-20,Video No. 1 of Rastriya Swayamsevak Sangh Cadres engaged in the sanitation under Swachhata Abhiyan to help control the Coronavirus to spread in the locality. ,Pune,neutral
2020-03-20,#Bhilwara under radar of #CoronaVirus spread. Urgent attention and task force needed. @ashokgehlot51 @PMOIndia @AmitShah,Pune,neutral
2020-03-20,Shri Bhaiyaji Joshi  Sarkaryavah  Rastriya Swayamsevak Sangh has appealed to all volunteers of R. S. S. to make aware of the dangers of Coronavirus to the public in your locality and thus help the Government. ,Pune,anger
2020-03-20,The Coronavirus will explode because India is full of irresponsible idiots who ask everything from the government but do nothing in return #Covid19India #COVID shame on #KanikaKapoor clearly education is no antidote to ignorance. #corona,Pune,disgust
2020-03-20,All those who do not report the symptoms of the #Corona virus to anyone thereby increasing the risk of it spreading to all the people who come in contact with them should be severely punished. #KanikaKapoor #CoronaVirusUpdate,Pune,disgust
2020-03-20,All those who do not report the symptoms of the #Corona virus to anyone thereby increasing the risk of it spreading to all the people who come in contact with them should be severely punished. #KanikaKapoor #CoronaVirusUpdate,Pune,disgust
2020-03-20,One of those happiness day when the world is not so happy.. But hope will succeed.. #WorldHappinessDay #coronavirus,Pune,joy
2020-03-20,Corona Virus Infection Don't Panic....Be Alert Get treatment if found symptoms like Cough  Fever  Difficulties in Breathing Do this... Keep yourself and others safe #corona #maharashtra #PMC #SAGARRAJE_RAJE_BHOSALE #COP_CORPORATER_PMC_HADAPSAR,Pune,sadness
2020-03-20,For Business Continuity and WFH @airtelindia is the lifeline now. D/L U/L: 500+ Mbps @Speedtest #coronavirus #CoronaOutbreak #coronavirusindia #WFH #pune #CoronavirusOutbreakindia #bcp #BusinessContinuity #ISP @Airtel_Presence @airtelnews,Pune,anger
2020-03-20,In response to uncertainties presented by CoronaVirus evryone is tryng to be socially distant which is the need of the hour! a glimpse of our Fashion Student staying home and practising.Request students to use this time to create and ideate #corona #chasaidt #staysafe #washhands,Pune,neutral
2020-03-20,A Nice Initiative Is Taken By our Maharashtrian Government To Lock Down Whole Maharashtra Till 31st March 2020. Till Today There Are 50 Cases Of Corona virus are found in Maharashtra only #FightCOVID19 #LockDownMumbaiPune #wesupportjantacurfew #CoronaGo @OfficeofUT @narendramodi,Pune,sadness
2020-03-20,"The terror of the #CoronaVirus has spread so much that more than the VIRUS itself  its ""fear"" is killing the people If you are taking all the necessary precautions there is no need to fear. Destroy the FEAR from your mind. Before the fear destroys YOU. #CoronaStopKaroNa",Pune,fear
2020-03-20,Singer #KanikaKapoor  who returned to #India from #UK trip 10 days ago  has been tested positive for #coronavirus. http://www.esakal.com #Sakal #viral #SakalMedia #COVID #CoronaOutbreak #Corona #coronavirusindia #Covid_19 #pandemia #CoronavirusOutbreakindia @TheKanikakapoor,Pune,joy
2020-03-20,"The terror of the #CoronaVirus has spread so much that more than the VIRUS itself  its ""fear"" is killing the people. If you are taking all the necessary precautions there is no need to FEAR. जो डर गया  वह तो 'जीते-जी' ही मर गया. #CoronaVirusUpdate",Pune,fear
2020-03-20,Respected Hon. FM @nsitharaman Ji  Plz extend the deadline for filing GST  Income Tax Returns and Vivad se Vishwas Scheme. This is due to the #CoronaVirus @Infosys_GSTN @ilesh1496 @camaheshg,Pune,anger
2020-03-20,Respected Hon. FM @nsitharaman Ji  Plz extend the deadline for filing GST  Income Tax Returns and Vivad se Vishwas Scheme. This is due to the #CoronaVirus outbreak. @askGST_GoI @GST_Council @FinMinIndia @cbic_india @PMOIndia @narendramodi @IncomeTaxIndia @ianuragthakur,Pune,anger
2020-03-20,Let's fight the pandemic together. #coronavirus Let's stop #CoronavirusOutbreakIndia,Pune,anger
2020-03-20,As the restaurants and mess across Pune have shut down amidst #CoronaVirus fears  RSS and ABVP have arranged free food for anyone and everyone especially the students who are stranded. #RSS #Pune #India #CoronaVirusUpdate #CoronavirusOutbreakindia #IndiaFightsCorona,Pune,disgust
2020-03-20,Some soul talk... Since the world is struggling to fight this Corona virus pandemic we as bikers can contribute by being responsible not just for each other but the society at large. Even if you might be strong  you… https://www.instagram.com/p/B98mK1lgCF0/?igshid=j76qyzujecb0,Pune,disgust
2020-03-20,Looking forward to better days // how are you guys doing? #hoping #praying #coronavirus #socialdistancing @Pune  Maharashtra https://www.instagram.com/p/B98kFu2nvGZ/?igshid=13r80njcr9rpl,Pune,joy
2020-03-20,Careful some politician could Ctrl+C and Ctrl+V  when we should be Ctrl+CV (Coronavirus),Pune,anger
2020-03-20,@PMOIndia will you stop this nonsense @narendramodi Look what I shared: 'Ram Will Ensure no Harm Comes': Adityanath Govt Okays Mega Fair in Time of Coronavirus @MIUI|,Pune,surprise
2020-03-20,#JanataCurfewMarch22 Look what I shared: 'Ram Will Ensure no Harm Comes': Adityanath Govt Okays Mega Fair in Time of Coronavirus @MIUI| https://thewire.in/religion/uttar-pradesh-coronavirus-ram-navami Is this person elected by people?,Pune,joy
2020-03-20,Freshly graduated doctors from Assam are serving in Rural Assam for 1 year as part of coursework. In the #coronavirus situation these new doctors aren't equipped with masks &amp; protective equipment to check the patients. They need your immediate attention!,Pune,neutral
2020-03-20,@DY365 @himantabiswa @MoHFW_INDIA Freshly graduated doctors from Assam are serving in Rural Assam for 1 year as part of coursework. In the #coronavirus situation these new doctors aren't equipped with masks &amp; protective equipment to check the patients. Need immediate attention!,Pune,neutral
2020-03-20,‘Thermal scanners to be installed at airport  bus  railway stations in Pune’. #Sakal #SakalNews #viral #ViralNews #SakalTimes #news #Corona #COVID2019 #COVID #coronavirus ,Pune,neutral
2020-03-20,Lets do our due diligence  take the precautions we need to take care of ourselves and those of us around us. Right now  more than ever before  We all are more dependednt on each other  than we ever have been. Corona Virus is an enemy that is faceless  Raceless &amp; sexless. Be safe.,Pune,anger
