2020-03-14,Vehicles entering pondy are being screened at the border. @CMPuducherry at a press conference said that screening of tourists by medical teams is being carried out after the WHO declared #Corona Virus as a #pandemic.Seen here are doctors&amp;medical staff from #JIPMER #COVID19india,Pondicherry,anger
2020-03-14,Firefighting in times of #coronavirus Sent by an airline official :( #aviation,Pondicherry,neutral
2020-03-14,PM Modi bats for joint Saarc strategy to fight coronavirus  gets prompt support from neighbours https://timesofindia.indiatimes.com/india/pm-modi-bats-for-joint-saarc-strategy-to-fight-coronavirus-gets-prompt-support-from-neighbours/articleshow/74616095.cms via NaMo App,Pondicherry,neutral
2020-03-14,@CMOTamilNadu is under estimate this covid-19,Pondicherry,neutral
2020-03-14,Keep cleanliness to stay away from Diseases or VIRUS #awareness #virus #disease #cleanliness #world #corona #coronavirus @Worldwide https://www.instagram.com/p/B9uh_NKhmbb/?igshid=ve29rjp72gku,Chennai,sadness
2020-03-14,"Coronavirus offers ""a blank page for a new beginning"" says Li Edelkoort https://www.dezeen.com/2020/03/09/li-edelkoort-coronavirus-reset/ via @dezeen This is amazing she put it in the right words and oh so aptly ..",Chennai,surprise
2020-03-14,Suggested by a friend  watched Virus Malayalam movie and @BHdreamteacher is suggesting Sense8 now. I think my life during the Corona Virus pandemic will end up with movies on diseases and human values ,Chennai,surprise
2020-03-14,It is believed world will come to end with a deluge caused by a gigantic Tsunami. The indications are that a most virulent virus will spread rapidly and terminate all forms of life in the earth. The present Corona virus is only in the test stage by god.,Chennai,surprise
2020-03-14,Worried about #coronavirus ?At #UttarBhojan our customers are safe with hygienic food and ambience. Corona or not we always maintain highest standards of #hygiene to the best possible extent to provide a great dining experience for our valuable customers. Come. Indulge. Good Food,Chennai,joy
2020-03-14,#Maharashtra with 26 cases overtakes #Kerala with 22 cases as the state with Most number of #CoronaVirus cases in India..,Chennai,disgust
2020-03-14,Holy shit. Katie Porter holds the CDC Director's feet to the fire and gets him to commit to FREE TESTING for coronavirus for ALL AMERICANS. Watch every second of this. ,Chennai,anger
2020-03-14,Can someone help me locate @Vijayabaskarofl full speech on assembly about coronaVirus  ??,Chennai,joy
2020-03-14,Their latest hopes are pinned on Corona Virus ,Chennai,neutral
2020-03-14,I just realized the true strength of Globalisation. For some guy or gal to have eaten some crap meat in Wuhan  China which got the Corona Virus going  it's affecting me living in a suburb in Chennai and my business. I feel like am screwed this month.!,Chennai,sadness
2020-03-14,Screw the #coronavirus. Hugs everywhere in the ATK camp. Bathe in sanitiser boys. The real test is staying healthy. But it must feel getting back to normal life now with a trophy by your side. #ATKCFC #HeroISLFinal,Chennai,sadness
2020-03-14,I think the govt should issue a ban on all commercial ads containing the term corona virus or its equivalent!,Chennai,anger
2020-03-14,Immunity booster for current #covid2019 #coronavirus situation and forever: - eat only homemade freshly prepared food. Saatvik bhojan - strictly vegetarian diet  30% fruits  20% nuts and dry fruits - aamla  peanuts  coconut - giloy and tulasi herbs - zero processed food Contd,Chennai,fear
2020-03-14,PM Modi bats for joint Saarc strategy to fight coronavirus  gets prompt support from neighbours https://timesofindia.indiatimes.com/india/pm-modi-bats-for-joint-saarc-strategy-to-fight-coronavirus-gets-prompt-support-from-neighbours/articleshow/74616095.cms via NaMo App,Chennai,neutral
2020-03-14,Three arrested for spreading fake news on coronavirus https://www.deccanherald.com/national/south/three-arrested-for-spreading-fake-news-on-coronavirus-in-kerala-800740.html @deccanherald,Chennai,surprise
2020-03-14,Bangalore Coronavirus news: Google techie’s wife  who defied quarantine  flew to Delhi &amp; took train to reach Agra  tests positive for coronavirus | Agra News - Times of India ,Chennai,neutral
2020-03-14,"Iam so proud of my South Africa.. In any African countries ""corona virus"" can't enter due to hot humidity.",Chennai,surprise
2020-03-14,Are figures of Corona virus deaths from China reliable ? ,Chennai,sadness
2020-03-14,US declares national emergency. Donald Trump and Task Force announce new Google tool for #covid19 online to indicate symptoms to get the tests done in the nearest labs. Walmart  CVS  Walgreens and Target to provide the spaces for tests. #coronavirus #fightCoronavirus,Chennai,neutral
2020-03-14,Sharing 4P's what I think each of us should do and 1P that we should not 1. Positive- be optimistic remember this too will pass. 2. Precautions-Follow WHO 3. Partner with Govt: inform  spread official comm and cooperate 4. Play/Pick up a hobby And Don't Panic #coronavirus,Chennai,joy
2020-03-14,What the various countries are doing is acceptable. Many people say that now this corona virus has become a pandemic the spread cannot be stopped. But these measures will slow down the spread so that the country can provide medical facilities and also keep the essential,Chennai,disgust
2020-03-14,Cricket is saved from a covid-19 ,Chennai,neutral
2020-03-14,Books for people under home #quarantine #Covid_19,Chennai,anger
2020-03-14,After locking down everything  why don't we lock down all SM apps like @Twitter  @WhatsApp  @Facebook  @instagram &amp; keep in touch with people through old media. I bet not only #COVID19 but many other social viruses will get eradicated immediately. World will be back in order.,Chennai,anger
2020-03-14,Is coronavirus is a joke for u? Do u think this is just a poll game? go out there and help ppl.,Kolkata,joy
2020-03-14,Heard corona virus was a political tool of the BJP to suppress Delhi riots where her peaceful Muslim brothers died @MamataOfficial,Kolkata,neutral
2020-03-14,Failed to understand Y all media in India have need locked into Coronavirus news? There is world out side of it. ,Kolkata,anger
2020-03-14,All guys r be safe Indian govt declared 98 patients r effected of #coronavirus So everyone be alert don't be shy to ur health issues if u feel fever &amp; breathing problem then plzz contact our govt hospital don't be hide it. #sidheart #ShehnaazGiIl #SidNaazHangover it's a major,Kolkata,sadness
2020-03-14,Herd immunisation technique is a good strategy though WHO have reservations and prefer social distancing. #COVID19india #Corona #coronavirus #coronavirusindia,Kolkata,disgust
2020-03-14,What countries have been affected by the novel coronavirus known as COVID-19? How many cases are there in China? https://infographics.channelnewsasia.com/covid-19/map.html via @ChannelNewsAsia,Kolkata,neutral
2020-03-14,The total number of patients who have been cured of #coronavirus in India is now 10. Indian Government doing a great job in fighting back the disease. #coronavirusindia .,Kolkata,joy
2020-03-14,This is a real-time tracking of pathogen evolution of #NovelCoronavirus (2019-nCoV) available on :- https://nextstrain.org/ This phylogeny shows evolutionary relationships of HCoV-19 viruses from the ongoing novel #coronavirus #COVID19 #pandemic. Using data from #GSAID.,Kolkata,neutral
2020-03-14,Just finished listening to the audiobook of Which witch? for the middle grade prompt in #femmefantale This ticks of a prompt from @audiobookathon too! Listen to an audiobook under 6 hours Also joining in #kcarathon ! Spread love &amp; support  not #Coronavirus ,Kolkata,joy
2020-03-14,Click here https://docdro.id/ui2vQX1 #coronavirus #coronavirusindia #coronaalert,Kolkata,neutral
2020-03-14,Speaking about corona virus! Ok.Gao_mutra can cure you.,Kolkata,anger
2020-03-14,#WHO declares #Europe as 'epicenter' of #coronavirus #Slovakia #Denmark #Poland #Austria #Hungary #Denmark closed borders for foreigners #Italy records 250 deaths in a 24-hour period as total #COVIDー19 fatalities reach 1266 #CoronaVirusUpdates,Kolkata,sadness
2020-03-14,Your speeches are enough to fight corona virus! Our concern is also economy..besides corona virus.,Kolkata,neutral
2020-03-14,Isn't she enough to fight corona virus!,Kolkata,neutral
2020-03-14,DXB returnees are put in isolation #Emirates #coronavirusindia #Coronavirus,Kolkata,neutral
2020-03-14,Who is bearing the cost of treatment of #coronavirus ? @MoHFW_INDIA,Kolkata,anger
2020-03-14,Don't panic  don't lose your true spirits when you are in a crisis. Italians are in danger but they are enjoying it without feeling any fear about the dangerous corona virus. Watch it &amp; learn something from them how to be passionate &amp; energetic in life even when you are in crisis ,Kolkata,fear
2020-03-14,By the way  which community is affected most by corona virus ?? ,Kolkata,sadness
2020-03-14,@INOXMovies When the whole country is trying hard to prevent and take all precautionary measures to fight Coronavirus the least you guys could do is keep a hand sanitizer at your food counters  anyways your popcorn and drinks are expensive than your movie tickets – at Inox,Kolkata,neutral
2020-03-14,Hello  @WWERomanReigns ..stay safe from the Corona Virus..because you're the backbone of wwe smackdown now...I know you'll be the next universal champion #WWE..#BigDog #ROMANREINGS ,Kolkata,neutral
2020-03-14,Rs 4 lakh will be paid as ex-gratia to the family of the person who will lose their life due to #Coronavirus  including those involved in relief operations or associated in response activities.#CoronaVirusUpdate,Kolkata,sadness
2020-03-14,Have you noticed one thing? Not a single reporter has gone to interview the patients of #Coronavirus ,Kolkata,joy
2020-03-14,#Bengalgovt shuts down schools  colleges and madrasas due to #coronavirus till march 31 @MamataOfficial @AITCofficial #coronavirusindia #CoronavirusPandemic,Kolkata,anger
2020-03-14,Corona virus can be contained by social isolation. But the Nagpur virus becomes a cluster Virus by their sheer political power. And they will consume my India.,Kolkata,fear
2020-03-14,This wasn't unexpected. From Nagpur all the deadly viruses spread from India. The hate virus. Which is nothing compared to Corona virus. ,Kolkata,anger
2020-03-14,#BREAKING West Bengal Government announces closure of all educational institutions in the wake of #coronavirus outbreak from March 16 to 31. Order issued from CMO. #COVID19india #COVIDー19 @DeccanHerald https://twitter.com/Soumyareporting/status/1238747238572015617/photo/1,Kolkata,surprise
2020-03-14,"Journalist goes undercover at ""wet markets""  where the Coronavirus start... https://youtu.be/Y7nZ4mw4mXw #CoronaAlert #CoronavirusPandemic",Kolkata,neutral
2020-03-14,Coronavirus ke liye tumhara guru hai...inner awakening se rectify kar dega...if u or ur family are having any ailments like. Hypertension.. diabetes... eczema....now corona...don't go to see a doctor...and start ur inner awakening programme as suggested by this moron.,Kolkata,joy
2020-03-14,Virology experts recommend that we stop shaking hands  hugging and kissing when we greet each other  to minimise the spread of #Coronavirus #COVID19 #CoronaOutbreak,Kolkata,joy
2020-03-14,Kejri's entire family does not have birth certificate so he will land in detention center NPR even after clear explanation from the home minister of India so you people only have fake news to spread worse than corona virus,Kolkata,disgust
2020-03-14,Just like toxic journalist SIRDESAI AND RAVISH KUMAR HATERED FAMILY TALKING ABOUT Corona virus not about anti Modi goverment. ,Kolkata,disgust
2020-03-14,Virology experts recommend that we stop shaking hands  hugging and kissing when we greet each other  to minimise the spread of #Coronavirus #COVID19 #CoronaOutbreak,Kolkata,joy
2020-03-14,Coronavirus Prevention: Right way to wash hands https://timesofindia.indiatimes.com/videos/lifestyle/health-fitness/coronavirus-prevention-right-way-to-wash-hands/videoshow/74611361.cms?utm_campaign=andapp&amp;utm_medium=referral&amp;utm_source=native_share_tray Download the TOI app now:,Kolkata,disgust
2020-03-14,PM Modi bats for joint Saarc strategy to fight coronavirus  gets prompt support from neighbours https://timesofindia.indiatimes.com/india/pm-modi-bats-for-joint-saarc-strategy-to-fight-coronavirus-gets-prompt-support-from-neighbours/articleshow/74616095.cms?utm_campaign=andapp&amp;utm_medium=referral&amp;utm_source=native_share_tray Download the TOI app now: https://timesofindia.onelink.me/efRt/installtoi,Kolkata,neutral
2020-03-14,Fewer cases  but India becomes 5th country to isolate coronavirus https://timesofindia.indiatimes.com/india/fewer-cases-but-india-becomes-5th-country-to-isolate-coronavirus/articleshow/74620323.cms?utm_campaign=andapp&amp;utm_medium=referral&amp;utm_source=native_share_tray Download the TOI app now: https://timesofindia.onelink.me/efRt/installtoi,Kolkata,sadness
2020-03-14,@RSSorg cancels it's annual meeting in Bengaluru due to coronavirus fears https://twitter.com/SimontiniB/status/1238699400588709888,Kolkata,fear
2020-03-14,From cow states. With the health infrastructure if it's true. It's good. Hindustan Times: Coronavirus: India fights back  7 more patients cured of Covid-19. https://www.hindustantimes.com/india-news/7-more-patients-in-india-cured-of-covid-19/story-KdGoZb0ufeippFwgfz7N2O.html via @GoogleNews,Kolkata,joy
2020-03-14,While emphasizing about the effect of #CoronaVirus Trump exclaimed that he fully supports H.R. 6201 Families First CoronaVirus Response Act  which will be voted in the House this evening. The Bill will follow president's direction for free CoronaVirus tests &amp; paid sick leave.,Kolkata,disgust
2020-03-14,Yes govt might have been more vigilant in fighting #corona but while sharing an article which clearly specifies that how an educated individual has made a mess. You have vomited your hatred yet again. No suggestions. No appeal 2 individual. U R more dangerous then #corona virus.,Kolkata,disgust
2020-03-14,Reportedly  @RSSorg postpones it's annual meeting in Bengaluru due to coronavirus fears,Kolkata,fear
2020-03-14,#besafe from #coronavirus... Effected areas in India:- Kerala Tamilnadu Telengana Maharashtra Karnataka Uttar Pradesh Delhi Rajasthan Haryana  J&amp;K Andhra Pradeshand Ladhakh. Symptoms:-1)Running Nose 2) Cough 3)Sore throat 4)Fever(Severe cases) ,Kolkata,sadness
2020-03-14,Coronavirus: Why You Must Act Now - by Tomas Pueyo ,Kolkata,neutral
2020-03-14,I understand that we might not have taken the best in the world precautions against Coronavirus but whatever has been done has been swiftly and atleast much better than the developed countries in Europe which are caught pants down. @drharshvardhan @DrHVoffice is doing a good job,Kolkata,sadness
2020-03-14,#EiSamay#Kolkata 28 matches of I-League including derby are rescheduled due to novel Coronavirus outbreak.postponed all sporting events scheduled to be held in the West Bengal till March 30.,Kolkata,surprise
2020-03-14,Chinese President Xi Jinping thanked the Cuban government for its support in the fight against the coronavirus COVID-19 in a phone call that he held with Cuban President Miguel Díaz-Cane on the night . #CoronavirusPandemic #Cuba #China #ChinaCoronaVirus,Kolkata,surprise
2020-03-14,In any state if people suffer from Corona virus due to inadequate measures taken in advance  it’s ruling party may have a serious setback in the forthcoming election.,Kolkata,sadness
2020-03-14,Sirji  Please see that opinion of experts from recognised institutions ofhomeopathy  Aayurvedik yunaani are published for prevention of COVID-19 pandemic,Kolkata,joy
2020-03-14,UK citizens are now banned to travel US by Trump to check the spread of Covid19. Covid 19 spreads unchecked because carriers of covid 19 manifest the symptoms after 5 days of being infected. During these 5 days they infect others unknowingly. Thus Covid 19 spreads unchecked.,Kolkata,neutral
2020-03-14,What countries have been affected by the novel coronavirus known as COVID-19? How many cases are there in China? https://infographics.channelnewsasia.com/covid-19/map.html via @ChannelNewsAsia,Kolkata,neutral
2020-03-14,Why Covid-19 is so dangerous for older adults https://www.vox.com/2020/3/12/21173783/coronavirus-death-age-covid-19-elderly-seniors?utm_campaign=vox&amp;utm_content=entry&amp;utm_medium=social&amp;utm_source=twitter via @voxdotcom,Kolkata,fear
2020-03-14,Elderly people are discriminated against by the Covid 19. Covid 19 sends notices to the senior citizens of every nation   saying your services are no longer required for progress and prosperity. Better you ....... It is cruel and unkind. ,Kolkata,neutral
2020-03-14,Europe now 'epicentre' of COVID-19 pandemic: WHO https://timesofindia.indiatimes.com/world/europe/europe-now-epicentre-of-covid-19-pandemic-who/articleshow/74617458.cms?utm_campaign=andapp&amp;utm_medium=referral&amp;utm_source=native_share_tray Download the TOI app now: https://timesofindia.onelink.me/efRt/installtoi,Kolkata,sadness
2020-03-14,From cow states. With the health infrastructure if it's true. It's good. Hindustan Times: Coronavirus: India fights back  7 more patients cured of Covid-19. https://www.hindustantimes.com/india-news/7-more-patients-in-india-cured-of-covid-19/story-KdGoZb0ufeippFwgfz7N2O.html via @GoogleNews,Kolkata,joy
2020-03-14,Are Italians really singing to boost up their morale ? Or are they   specially the elderly persons singing in fear of the imminent attacks of covid 19 ? Covid 19 has been right from the start very unkind to elderly persons. ,Kolkata,fear
2020-03-14,Covid-19 a global challenge needs international initiative no time for blame game.universal bodies like UN  WHO etc are key to preventing &amp; controlling.China and Iran missed early signs be secretive and suffered Pray It is not happening in India. PM’s initiative on SAARC is good,Kolkata,neutral
2020-03-14,@AirAsiaSupport ur chatbot is pathetic I have tried several times for refund of by booking IDs JPW8QB &amp; FQY82L .Out of this JPW8QB FLIGHT is cancelled by u &amp; the other one I am trying to do Voluntary Cancellation due to covid-19 by every time it says something went wrong,Kolkata,neutral
2020-03-14,If people continue to stick to this sanitizing practice even after the whole #Covid_19 thing is managed  it will be the best.,Kolkata,anger
2020-03-14,Chinese President Xi Jinping thanked the Cuban government for its support in the fight against the coronavirus COVID-19 in a phone call that he held with Cuban President Miguel Díaz-Cane on the night . #CoronavirusPandemic #Cuba #China #ChinaCoronaVirus,Kolkata,surprise
2020-03-14,While the Indian government remains blind to the consequences faced by sanitation workers and manual scavengers and does not provide basic amenities such as masks or gloves for their protection  it becomes all the more concerning with the corona virus spreading.,Pune,anger
2020-03-14,While now  Isolated and lock down situation creates in world wide. So the country who's economy will be servived with positive sign can be the actual winner of #coronavirus. Now it's time for #India to glow as manufacturing sector hub of world.,Pune,surprise
2020-03-14,Whole world is suffering bcoz of your behavior.. many people r just dying coz of you. China should compensate & apologies to world every single day. #coronavirus #COVID19,Pune,sadness
2020-03-14,Me: wow looks like I'll really complete my masters in Journalism this year :))) Coronavirus: haha. :),Pune,joy
2020-03-14,D) All of the above #BeAware #Quiz #Contest #CoronaVirus #AGlTiles #ig #instagood @AGLTILESWORLD Join @Pia @Shahi1231 @APohnerkar @amrutadevale @shahriravi @vkdwivedi2,Pune,surprise
2020-03-14,That's generosity & kind-heartedness. Coronavirus pandemic | Jack Ma Foundation to donate 500 000 testing kits  1mn masks to the US. https://www.moneycontrol.com/news/world/coronavirus-pandemic-jack-ma-foundation-to-donate-500000-testing-kits-1mn-masks-to-the-us-5033051.html via @GoogleNews #COVIDー19 #JackMa #China #USA,Pune,sadness
2020-03-14,Coronavirus pandemic: Colleges under SPPU in Pune  Pimpri-Chinchwad to remain closed https://www.moneycontrol.com/news/trends/health-trends/coronavirus-pandemic-colleges-under-sppu-in-pune-pimpri-chinchwad-to-remain-closed-5033791.html/amp,Pune,surprise
2020-03-14,#Pune has tested 10 positive cases of #coronavirus but people out here hardly know where to go in case of noticeable symptoms. Can the Government please make list of Hospitals public please? (Other than list with 2 hosp from Maha) @CMOMaharashtra @AUThackeray @MoHFW_INDIA,Pune,sadness
2020-03-14,@rzd_official I want to cancel my train tickets. I am from India and I made payment through my bank credit card. Will the refund amount be directly sent to my credit card account? #cancellingtrip #coronavirus,Pune,disgust
2020-03-14,How can we fight Corona Virus ,Pune,anger
2020-03-14,26 and counting: #Maharashtra now has the most #coronavirus cases in Indiahttps://www.newindianexpress.com/live/2020/mar/13/coronavirus-live-updates--india-declares-covid-19-notified-disaster-as-cases-rise-to-94-2116209.html via @NewIndianXpress #CoronaVirusUpdates #COVIDー19,Pune,sadness
2020-03-14,this is unbelievable chief minister announced leave for all national company's multiplex school college's due to corona virus the IGT (PUNE )multinational company is not giving leave to the employees this is the mockery for the people's working for the company. @suniltingre,Pune,disgust
2020-03-14,Used Japanese Sakura & Hyaluronic acid mask Ultimately found out that product is made in China. Now I feel like whole Corona Virus layer is on my face... ,Pune,sadness
2020-03-14,this is unbelievable chief minister announced leave for all national company's multiplex school college's due to corona virus the IGT (PUNE )multinational company is not giving leave to the employees this is the mockery for the people's working for the company. @PMCPune.,Pune,disgust
2020-03-14,Stop Eating Meat. Corona Virus Came from Wild or Domestic Animals. One should never consume meat. God is never happy with those who kill His beings. Watch Sadhna T.V-7:30pm - Saint Rampal Ji Maharaj #COVID19india #SaturdayThoughts #GodMorningSaturday,Pune,surprise
2020-03-14,The world is talking about Corona Virus and we Yogi's are building your immunity to fight it. Bole toh Yoga se hee hoga Bhaiji. #mountmoksha #puneigers #punekars #punelifestyle #punelife #puneinstagrammers… https://www.instagram.com/p/B9t55N0log-/?igshid=f8qg0m2fx8m3,Pune,anger
2020-03-14,To handle this we should increase the testing labs immediately.Take help of army medical officials if needed.Specialy in Maharashtra #COVID19india #CoronaVirusUpdates #coronavirus #CoronaOutbreak #CoronavirusReachesDelhi #CoronaKoDhona #coronapocalypse #CoronaPolitics,Pune,neutral
2020-03-14,@drharshvardhan @narendramodi @PMOIndia @MoHFW_INDIA @OfficeofUT @AUThackeray We need to increase the testing centres for #coronavirus .Many people voluntarily wanted to get tested but currently only persons with critical symptoms are getting tested.Soon the count will increase,Pune,sadness
2020-03-14,Glad to see the Yoga class on the stage we designed at Shaniwar Wada on a Coronavirus scare day. – at Shaniwar Wada,Pune,joy
2020-03-14,My organization is giving 212.75 hours of wfh due to #coronavirus Average 22 x 9.15 hrs = 201.5 hrs They want me to work xtra from home ,Pune,sadness
2020-03-14,Coronavirus has instilled so much fear that I try to hold my cough as much as I can whenever I am in public. The suspicious look of people when you cough is dam scary ! #coronavirusindia #CoronaOutbreak #coronavirus #,Pune,fear
2020-03-14,My hands have witnessed more alcohol in the last 3 days  than my liver has.....#coronavirus #CoronaVirusUpdates,Pune,sadness
2020-03-14,Mexico is considering closing its border to stop Americans bringing coronavirus into its country as US case count passes 2 000 https://www.dailymail.co.uk/news/article-8110163/Mexico-wants-close-border-Americans-stop-spread-coronavirus.html?ito=social-twitter_dailymailus @realDonaldTrump is David Wallace here ,Pune,anger
2020-03-14, Be Aware  Stay Home and Stay Safe #corona #virus #coronavirus #india #coronavirusindia #coronavirusindiaupdates #coronanews2020 #coronavirusoutbreak #coronavírus #coronapreventiontips #fightcoronavirus #beatcorona #coronasedarona #coronaupdates #lyricsabcd,Pune,neutral
2020-03-14,As the corona virus grow alarmed level  people started buying masks and sanitizers in large quantities. Medical stores hv began to raise prices arbitrarily. The mask  priced at Rs 10  started to sell at a price of 200+.1/2 @CMOMaharashtra @narendramodi @PMOIndia,Pune,neutral
2020-03-14,.@BBCWorld @BBCNewsAsia @nytimes @washingtonpost India: 74 cases  1 death (1.35 Billion population) UK: 590 cases  10 deaths (0.066 Billion population) Calculate the ratio UK Mismanagement!! #coronaUK #CoronaVirusUpdates #CoronaAlert #coronavirus ,Pune,sadness
2020-03-14,@balajivis - big fan of your quora posts. Really appreciated your latest post about how India is doing good job in handling Coronavirus. And we should be thankful to our govts. for that. ,Pune,joy
2020-03-14,What India couldn't teach Britishers in 200 years  Coronavirus did in few weeks. #Namaste #NoHandshakes #COVIDー19 #BeSafe #coronavirus ,Pune,neutral
2020-03-14,I understand coronavirus making everyone spend more time quarantined but this is so coming out on twitter ,Pune,neutral
2020-03-14,Stay Safe! #CoronaVirusUpdates #coronavirus ,Pune,neutral
