2020-06-25,Mohammad Hafeez Landed Into Fresh Trouble With Private Covid 19 Test ,Pune,neutral
2020-06-25,Maharashtra  Delhi Among 5 States To Receive First Batch Of COVID-19 Remdesivir Drug ,Pune,anger
2020-06-25,Why covid 19 virus didn't get vanished ,Pune,disgust
2020-06-25,Jatayu Machines are Made for India and Made in India. We manufacture completely indigenous products with proprietary design. #spruceup #jatayumachines #jatayusuper #swachhbharat #swachhata #covid_19 #indiafightscorona #coronawarriors #aatmanirbharbharat,Pune,neutral
2020-06-25,Everything is in uptrend Equities/Gold/Crude and even COVID cases,Pune,anger
2020-06-25,It is highly insensitive for CM KCR to participate in tree plantation programme when he has failed in managing Covid spread in Telangana.,Pune,neutral
2020-06-25,what are the symptoms of COVID-19 ? #healthcare #quarantine #safeguard #hemoxy #maskon #mask #virus #coronavirus #COVID-19 #protection #maintaindistance #sanitizer #handwash #healthsaftey #medicine #infectiousvirus #coronavirussymptoms #socialdistance #HealthyLiving,Pune,anger
2020-06-25,Tomorrow (Friday) at 7pm  our Dir. Soumitra Pathare @netshrink joins Aparna Joshi from @iCALLhelpline for @JCBPrize’s #PassTheMic series on Instagram to discuss mental health and well-being in the context of Covid-19 and the lockdown. Hope to see you there. ,Pune,sadness
2020-06-25,So nicely written @VernekarD Life in the times of Covid by @VernekarD,Pune,neutral
2020-06-25,If you’re a journalist and want to know more about ethical reporting of suicides in #covid times  register for this workshop we @CMHLPIndia &amp; @toymango are conducting in collaboration with @SunoIndia_in. We hope to make it interactive so keep your questions and queries ready!,Pune,neutral
2020-06-25,Hexagon's News Mash-up: Special COVID-19 edition ,Pune,joy
2020-06-25,"Let's hope #Coronil proves to be a credible cure for #COVID. Will save hundreds of millions of lives. ""Coronil for treating COVID-19? Decision on Patanjali‘s coronavirus medicine soon"" ",Pune,neutral
2020-06-25,COVID has impacted businesses massively. Many of us are at a point in reviewing what it all means in the short and long run. Here is another #presentation to showcase your post-#COVID-19 #businessstrategy. - https://bit.ly/2VgvRjB #powerpoint #ppttemplate #coronavirus #pptslides,Pune,neutral
2020-06-25,As I said before  it was good that Modi di dnot budged on fiscal side  had he done that  With covid and low growth  currency would have shot to 85 and inflation would have killed us and mostly poors ,Pune,anger
2020-06-25,Sanofi and Translate Bio to jointly produce mRNA Covid-19 vaccine Read at: http://reportsgo.com/sanofi-and-translate-bio-to-jointly-produce-mrna-covid-19-vaccine  #sanofi  #translatebio  #mRNA  #covid19  #vaccine  #biotech,Pune,anger
2020-06-25,Covid - 19's cure can be found Stupidity's cure is still in search ....,Pune,neutral
2020-06-25,Lot of companies are now taking impairments  blaming the Covid 19. How should investors view these charges? In this blog  we have assessed one such case. @Multi_act @VisariyaHarshal #acquisition #capitalallocation https://multi-act.com/questionable-capital-allocation-questionable-impairment,Pune,anger
2020-06-25,Up to 2 tons of waste can be collected in a single shift with one Jatayu Super  one operator  and one driver. #spruceup #jatayumachines #jatayusuper #swachhbharat #swachhata #covid_19 #indiafightscorona #coronawarriors,Pune,joy
2020-06-25,You should keep these COVID research updates in single thread.,Pune,neutral
2020-06-25,If you want to see black demo of mgt of Covid.. please see arrangements at Jolly Grant Airport. It gives proof of how bad our management is. Very poor show. Please get it covered by sending your media team maintaining some surprise.,Pune,sadness
2020-06-25,It's been 4months since we are doing duties in covid hospital nd simultaneously trying to reach(we don't know who?) . We have put our guards down in this battle of Hike In stipend bt we'll not put our gurads down in this covid-19 battle @supriya_sule @AjitPawarSpeaks,Pune,neutral
2020-06-25,If you want to see black demo of mgt of Covid.. please see arrangements at Jolly Grant Airport. It gives proof of how bad our management is. Very poor show. Please get it covered by sending your media team maintaining some surprise.,Pune,sadness
2020-06-25,If you want to see black demo of mgt of Covid.. please see arrangements at Jolly Grant Airport. It gives proof of how bad our management is. Very poor show.,Pune,sadness
2020-06-25,Retailio launched COVID-19 insurance plan with Edelweiss Gallagher Insurance Brokers Limited Read more here: https://bit.ly/RetailioEdelweissInsurance #Retailio #godigital #insurance #safetyfirst #staysafe #stayhome #retail #retailtechnology #retailinnovation #healthcareheroes,Pune,neutral
2020-06-25,WWE's Renee Young Says She Has COVID-19: 'Wear Your Masks and Wash Your Hands' | Bleacher Report ,Pune,disgust
2020-06-25,Those staying in localities near Janwadi  Gokhalenagar and Ramoshiwadi — which were sealed by PMC just last week after 100 COVID-19 cases emerged — say people on foot and even in vehicles are circumventing the barricades ,Pune,neutral
2020-06-25,@CMOMaharashtra According to some Ayurvedic doctors Ashwagandha Shatavari Amlaki Tulsi Guduchi are all anti viral and respiratory tract medicines. So Patanjali’s Covid-19 solution should not be banned in the blanket fashion by Maharashtra Government.,Pune,fear
2020-06-25,Prominent #COVID_19_detection_kits industry players are implementing various strategies to address the ever-increasing demand for effective testing solutions from the global #healthcareindustry. Read more@https://lnkd.in/gsPcPP7 #health #healthcare #healthcaretechnology,Pune,neutral
2020-06-25,Today's Suggestion–Indian Railways should start Mobile Hospitals by using the already converted coaches for Covid-19. These coaches can be converted into day care mobile hospitals which should have Labs  Pharmacy &amp; OTs for minor surgeries &amp; short-stay beds.@narendramodi @PMOIndia,Pune,sadness
2020-06-25,#GlobalNitrobenzeneMarket by Applications – Global Industry Analysis  Growth  Share  Size  Trends  and Forecast 2020 – 2026 | @BASF @CovestroUS @ChemoursCompany This is a latest report  covering the current COVID-19 impact on the market. ,Pune,neutral
2020-06-25,Action against #PatanjaliAyurved if they try to advertise their ‘anti corona’ drug in Maharashtra  warns @AnilDeshmukhNCP https://www.facebook.com/121682049227171/posts/314568186605222/?d=n #coronavirus #COVID #coronilTablet #Coronil #Ayurveda #PatanjaliProducts #BabaRamdev #PuneDaily,Pune,neutral
2020-06-25,PDx Models : Pre-Clinical Drug Development and Cancer Research to Dominate The Industry | COVID-19 Impact Analysis - The Writs #patientderived #xenograft #cancer #biotechnology Read more:,Pune,neutral
2020-06-25,"Instagram launched ""IG Guides""  a way to let content creators focus on written content than just images and videos. It is only up for few content creators who are revolving around covid. What do you think about this content creation add on? #Instagram #contentcreators",Pune,neutral
2020-06-25,Our deepest gratitude to our Distinguished Guests & Esteemed Speakers for their participation in India's Admission Hunt 2020 Webinar Session on Careers in Management Post COVID-19 Pandemic #IAH2020 #IndiaAdmissionHunt2020 #ASMAwebinar #InnoServWebinar,Pune,anger
2020-06-25,Restaurateur ends life after lockdown triggers depression  cops search for kin ,Pune,anger
2020-06-25,Mission Lockdown 1.0 onwards - Governments caught with their pants down “Once Again” all over again,Pune,sadness
2020-06-25,After 3months #Lockdown back to work.... Going to #Bhopal.....,Pune,neutral
2020-06-25,Due to this lockdown my sleeping schedule has changed a lot ,Pune,sadness
2020-06-25,@TimesNow @EconomicTimes @isro @dhaval241086 Dhaval Bhai talented Surat young girl.. This was achieved in lockdown. @sanghaviharsh @MySuratMySMC @rakeshvt @VikkeeBardolia @VishnuDhanuka @gulati_prachi @TajinderBagga,Pune,disgust
2020-06-25,Lockdown is the not ultimate solutions for covid19. More testing will reduce threat. When we will done more test we can break the chain like European countries done.,Pune,surprise
2020-06-25,Sach me nahi to lockdown me kya hota #meme,Pune,anger
2020-06-25,I seek refund for 3 of my tickets booked during lockdown for a date during lock down. 1. Have emailed several times to e-commerce nd contactus @airindian  the only reply is you can reschedule every time I email. 2. Tried connecting over phone daily since last 2 months  customer,Pune,neutral
2020-06-25,Want spas to open too. Why are you guys so scared of totally opening lockdown? I mean people die everyday. I may die now  who knows!! Look  we don't care who has what motive behind this lockdown; I say lockdown and restrictions are unnecessary. Covid is no big deal!!,Pune,fear
2020-06-25,"I hope you will get some time during Lockdown to read about Vinayak ""Through books &amp; not from Prince Baba's"" then pass a judgement on Savarkar",Pune,sadness
2020-06-25,Going into a lockdown will not be easy  we need to understand the economy also... Lakhs of people are getting unemployed daily  another lockdown will ensure the daily wage workers are starved to death because of no food. Follow social distancing  Wear masks  regular hand wash,Pune,neutral
2020-06-25,Team for the blockbuster match after lockdown #MCICHE #dream11,Pune,neutral
2020-06-25,But Mam how will we function if goes by no. as Mumbai Pune  Thane  Abad Major revenue generating cities goes under lockdown. No. of cases going up untill the herd immunity doesnt develop. Countries which are most affected by Corona are reopen now.,Pune,neutral
2020-06-25,First win post the lockdown for The Arsenal. Let's hope we can build on this momentum. COYG!,Pune,joy
2020-06-25,Lockdown effect.. https://www.instagram.com/p/CB3oSWdDN56dminFR-ZykdW-KephaapaHrZbc00/?igshid=liqesent88is,Pune,sadness
2020-06-25,Lockdown is not answer Mam. We have to understand that lockdown creates more panic and resulting more deaths in future than COVID. Economy has to start. WHO warns of 1.5Cr people can die due to hunger. India has highest recovery rate and lowest mortality Rate. We have to move on.,Pune,neutral
2020-06-25,Idk man! Lockdown sucks!,Pune,anger
2020-06-25,May be you missed what Delhi's ministers said on lockdown and who advocated special arrangements to boost economy.,Pune,sadness
2020-06-25,Actor dev gill arranges buses to send migrant workers home https://timesofindia.indiatimes.com/videos/entertainment/hindi/actor-dev-gill-arranges-buses-to-send-migrant-workers-from-maharashtra-home/videoshow/76568027.cms #MigrantWorkers #lockdown #COVID19 #COVID19India #devgill #Tollywood #Kollywood #SonuSood #sonusoodtherealhero #CoronaUpdates,Pune,sadness
2020-06-25,Lockdown ke Side-Effects!!! ,Pune,sadness
2020-06-25,@CMOMaharashtra has released guidelines for #salons #BarberShops #beautyparlours which will re-open from June 28 #Coronavirus #lockdown #Pune,Pune,neutral
2020-06-25,@ActorMadhavan sir a fan of yours from Tatanagar do you ever miss jamshedpur or plan to visit here after lockdown ends  hope you see this,Pune,sadness
2020-06-25,Will there be another lockdown?,Pune,neutral
2020-06-25,Do learn Marathi  perfect usage of lockdown...,Pune,joy
2020-06-25,@PMCPune 1n. At Palladium Grand society  Dhanori  since lockdown  there are around 10-12 stray dogs that are wandering in society and attacking residents ferociously even in daylight  in last 2 months they have attacked at 20 ppl badly  they have even bit one small kid in March. ,Pune,sadness
2020-06-25,I beleive we need a nationwide lockdown again  full fledged for 2 weeks.. timed strategic lockdown will break the chain. But saying 'no more lockdown' when it really needs is being adamant. #COVID19India #Lockdown6 @PMOIndia @drharshvardhan,Pune,disgust
2020-06-25,How do we blame the government.. Day 1 of lockdown please see the PM's message  he did say its a long battle  let's save as many as possible.. Does need to be supported by the people,Pune,neutral
2020-06-25,lockdown let us down ? or we let lockdown down ? ,Pune,neutral
2020-06-25,Heard a news from TV railways for common people aren't gonna start running till 12th August means lockdown will continue till August at least ,Pune,surprise
2020-06-25,Next lockdown in the making?,Pune,joy
2020-06-25, What Happened to you brother in this Lockdown ,Pune,sadness
2020-06-25,Me trying to relieve from tension during lockdown because of my NEET examinations coming near and HRD Ministry has not yet announced anything about NEET &amp; JEE. My situation is like this: #NEET2020 #NEET #JEEMains,Pune,neutral
2020-06-25,Me trying to relieve from tension during lockdown because of my NEET examinations coming near and HRD Ministry has not yet announced anything about NEET &amp; JEE. My situation is like this: ,Pune,neutral
2020-06-25,*#SheNeedsPad* I hope you guys are doing well and not getting bored in this lockdown . After many days •MANAV has come up with an amazing idea of making paper bags• These bags made will be sold outside with the help… https://www.instagram.com/p/CB3Upg1D3hb/ via https://tweet.photo,Pune,joy
2020-06-25,Yes there are multiple cases of suicides reported in last one week in #Pune but it's not right to connect them all with #Lockdown since the number of suicides reported last year in same months were almost same. Many of these suicide victims had their personal issues.,Pune,sadness
2020-06-25,Lockdown once again India need relockdown at Corona hotspot @narendramodi @PMOIndia @Dev_Fadnavis @OfficeofUT,Pune,anger
2020-06-25,All proposals might seem weird during lockdown. But this one just had to go wrong by all means. https://youtu.be/_4MsChBNQOQ @YouTubeIndia @YouTube @ytcreators #shortstory #SUNNYSIDEUP,Pune,disgust
2020-06-25,Thankyou @milaapdotorg for collaborating with @CEIempowers to help our vulnerable Tribals survive who are terribly affected by Coronavirus lockdown and Nisarga Cyclone. CEI with its #CEIResiliencySolutions empowring our Tribals for their holistic development #CEIReliefInitiative,Pune,fear
2020-06-25,Waiting for lockdown to get over like ,Pune,anger
2020-06-25,Already we are out of beds  it's time to lockdown. @PMOIndia @AmitShah You guys concentrate on your politics rather than the Corona Spread. Centre is taking no action since a month. Centre will blame states later.,Pune,sadness
2020-06-25,And you are planning to open Salons...State needs another lockdown.,Pune,neutral
2020-06-25,Need another 2 weeks strict lockdown to contain the spread  otherwise the day isn't far when we will have 10k cases per day. @OfficeofUT @AUThackeray @CMOMaharashtra,Pune,joy
2020-06-25,And you are planning to open Salons...State needs another lockdown.,Pune,neutral
2020-06-25,@seniority_IN hi  you delivered a defective product during days of lockdown. Now when it's time to take it back you are not responding. It's been more than 2 weeks since you committed to pick up the product. Customer experience seems to have gone for a toss !! Disappointed.,Pune,neutral
2020-06-25,@mahavitaran @CMDMSEDCL @SDodamarg @CMOMaharashtra Sir Rs. 4000 bill for current month. We have paid bill regularly in 3 months of lockdown. Do not know how this happened. Please take corrective action as soon as possible. #mahavitaran #Mahadiscom,Pune,sadness
2020-06-25,Dear @CastingChhabra Dil Bechara should also get theatrical release when the lockdown lifts.. let his movie not fadeaway like Drive did. #DilBechara #justiceforSushantforum #CBIEnquiryForSushantSinghRajput #cbiforshushant,Pune,neutral
2020-06-25,Tomorrow (Friday) at 7pm  our Dir. Soumitra Pathare @netshrink joins Aparna Joshi from @iCALLhelpline for @JCBPrize’s #PassTheMic series on Instagram to discuss mental health and well-being in the context of Covid-19 and the lockdown. Hope to see you there. ,Pune,sadness
2020-06-25,We want #dilbechara to release on big screen after this lockdown. Our star needs a standing ovation  Fans will make it a blockbuster. We can see Fear on the Face of Nepotism #RIPSushantSinghRajput #DilBecharaOnBigScreen #MukeshChhabra #KanganaRanaut #SanjanaSanghi,Pune,neutral
2020-06-25,Another go live on @NetSuite during this lockdown just shows if the technology is right its business as usual ! @NetSuiteEMEA,Pune,anger
2020-06-25, . I don't even care if my hair exist or not. At least in this lockdown,Pune,disgust
2020-06-25,Lol.. I'll gladly give it for free to Abhi. For sure have gained some weight during lockdown..smh ,Pune,joy
2020-06-25,Ok once your done with all this politics. Will you shift your attention to the real problem of covid19 spreading like fire in the country n impose something. When there where less than 1000 cases you declared lockdown n now more than4.5 lac cases and we are being casual abt it ,Pune,neutral
2020-06-25,It is because of your irresponsibility I agree to you that there was setback due to lockdown and current situation  if you had minimum commitment to customers then you should have sent a communication indicating delay in processing the order. 2/3 #Irresponsables #fraud,Pune,sadness
2020-06-25,Le me 1st day of lockdown,Pune,neutral
2020-06-25,Automation  localization  enhanced digitalization in sales and revival of Make in India to be the key enablers in the post lockdown phase: NRI Consulting Report https://buff.ly/3cWdxmt #Automation #digitalization #sales,Pune,sadness
2020-06-25,@NitinRaut_INC @CMOMaharashtra 2 points we would like to hilight here.1. Nightmare power outage every Thursday 6 hrs 2. Extraordinary bill calculations after lockdown Expecting positive response from authorities Cc @WagholiHSA @MSEDCL @cbawankule in ur term had good experience,Pune,neutral
2020-06-25,Kudos for Indian government for the firm action of cancellation of trade orders with China. Let's not forget the heat of Lockdown because of #ChineseVirusInIndia and also the #Gulwan attack. Hence as a Indian citizens  #bycottchineseproducts is must.,Pune,neutral
2020-06-25,Lockdown ke pehle kya ho raha tha??? . Lockdown me protests sirf BJP ko allowed hai ,Pune,neutral
2020-06-25,@PuneCityPolice is investigating the #suicide case #lockdown #Pune #coronavirus,Pune,sadness
2020-06-25,Please do something for this online digital learning. We don't want to this at any cost. This is a big scam in lockdown situation.,Pune,joy
2020-06-25,RT kavitaaap: AamAadmiParty Nagpur has filled a complaint againstNagpur Mayor Sandip Joshi for violating d govt. guidelines during d lockdown. AAPdemands strict action against him as he has not only violated d lockdown orders but by arranging a gatheri… ,Pune,anger
2020-06-25,E-Commerce in the grocery delivery segment  has been the big winner because of the lockdown. ,Pune,disgust
2020-06-25,@shakunbatra Just re-watched Kapoor and Sons. Remembered what an anti-climactic movie it was. Another boring day in the lockdown.,Pune,joy
2020-06-25,Today came in Pune after 3month of lockdown    still network issue is unresolved getting poor network even 2G is not working. Very disappointed . Its been 5 month now fake speed. Patience are over now    good bye Airtel moving to another service provider.,Pune,sadness
2020-06-25, Brace yourselves for the next segment of Artistine as Actress and Performer Ms. Manasi Naik gives her two cents on surviving the lockdown and indulging in art. Coming out tomorrow @6PM. Stay tuned! ,Pune,neutral
2020-06-25,@saurabhraajjain I'm watching Mahabharata on starplus since lockdown You are doing Krishna brilliantly and amazingly I'm in 12th standard Please reply me sir It will make my whole Year ,Pune,sadness
2020-06-25,#Salons #gyms to re-open in #Maharashtra #Coronavirus #lockdown ,Pune,neutral
2020-06-25,Reduction in salary and employee productivity were the top concerns of employees in the lockdown period. Saving the commute time to work was the best aspect and inability to meet people was the worst as people worked from home. ,Pune,neutral
2020-06-25,The Country Is Reopening. I’m Still on Lockdown ,Pune,neutral
2020-06-25,What is the growth rate of the global sexual wellness market during lockdown? Sample Copy: https://bit.ly/2Z6Gu9H #Sexual #wellness is a state of physical  mental  &amp; social well-being in relation to sexuality. @ChurchDwightMex @TheOriginalDoc #lockdown #SexToys #MaleCondoms,Pune,disgust
2020-06-25,@CMDMSEDCL @MSEDCL @MSEDCL_GKUC @MSEDCL_PZ Hello All   i have concern about the electricity bill issue me for this month of 11410 which is at very higher note. I hv paid all my previous bills on time PFb screenshot. I understand that for lockdown period no meterreading. ,Pune,neutral
2020-06-25,Need Lockdown again,Pune,neutral
2020-06-25,When someone asks aur kaise chal raha hai in lockdown Le me: #QuarantineDiaries,Pune,neutral
2020-06-25,#Lockdown_Offer...!!! #Lockdown_Offer...!!! Basic High BP Profile For Everyone. Vitamin D3 And B12 Check Your Blood pressure Today Or Stay Healthy And Stay http://microanalysis.in #Lockdown #corona #covid19 #bloodpressure #health #diabetes #hypertension #highbloodpressure,Pune,neutral
2020-06-25,@SnehalPradhan Maam I'm your big fan...The way you play and tell us tips is the best.. I learnt so many new things from you in the lockdown I also live in Pune . Thank you for all the tips,Pune,joy
2020-06-25,Why should you never use a blunt pencil? Because it’s pointless! One of the many many PJs our teenager keeps telling us. Deva  when is this lockdown going to get over? #lifeofababyadult #ihatePJs,Pune,anger
2020-06-25,Railways has produced around two lakh Personal Protective Equipment  PPE gowns and over 7 lakh masks during the lockdown period Railways has designated 50 Railway Hospitals as COVID Dedicated Hospitals &amp; #COVID Dedicated Health Centers #IndianRailways | #IndiaFightsCorona,Pune,disgust
2020-06-25,Our new blog post shares insights from #metering data on the #electricity consumption of a sample of households during the #COVID-19 lockdown. http://bit.ly/eMARC-COVID19 #energy #consumption,Pune,neutral
2020-06-25,Thanks @myntra @MyntraSupport for understanding my problem and going out of the way to help me to my unique problem that happened due to lockdown. Much appreciated.,Pune,sadness
2020-06-25,Should this last movie of Sushant Singh Rajput be released on OTT platforms or in theatres after lockdown....? #SushantSinghRajput @Bollyhungama @instantbolly @KanganaTeam,Pune,neutral
2020-06-25,#NewNormal #Reduce #Reuse #Recycle Waste management mantras learnt during the Corona lockdown to keep us all safe. Wear masks at all times. Gloves at work. Greet with folded hands. Safe distance. Let's keep each other &amp; our loved ones safe. Take care. stay safe. #CoronaWarriors,Pune,joy
2020-06-25,@PuneCityPolice At lockdown situation some delhi based personal doing fraud work in name of job consultancy.and demanding Rupees 1200 to 5000.I am attaching screenshots and mobile number. Please look in and save poor people from cheating forward to delhi police for prompt actio ,Pune,sadness
2020-06-25,Sudden Weight Loss Complications https://healthcarentsickcare.com/sudden-weight-loss-complications Speak or WhatsApp +919766060629 healthcare nt sickcare Our Restricted Lab Timing During Lockdown Monday to Saturday 9am -1pm #suddenweightloss #unintentionalweightloss #pune #pimprichinchwad https://twitter.com/messages/compose?recipient_id=1034408454318899201,Pune,sadness
2020-06-25,The items in your order will be delivered in the next 24-48 hours. We deeply apologize for the delay on our end. The lockdown has impacted all businesses and we as well as our farmer partners are hit too. Kindly bear with us,Pune,joy
2020-06-25,This lockdown have been harsh on our kids. It’s difficult for them not to play outdoor  no friends   no siblings . For a single child it becomes more difficult. The screen time increases   throws tantrums  feels… https://www.instagram.com/p/CB2v5lPpMh2/?igshid=1bjgwonxps1xj,Pune,sadness
2020-06-25,they are indian farmers they protest because indian and Bhutan both seal their border and that's why they cant go on Bhutan side due to lockdown,Pune,anger
2020-06-25,Mountaineering after lock down. #Adventureactivity #lockdown #COVID19India #trekking #mountaineering #webinar #IndianMountaineeringFoundation #sports,Pune,anger
2020-06-25,why are u telling lies . every years assam farmers go their and change stream but in this years due to lockdown they not go to change the stream,Pune,neutral
2020-06-25,A story of swollen feet: India's migrant workers and the physical toll of walking home during the lockdown - Prism - http://DAWN.COM,Pune,sadness
2020-06-25,Cyber attacks in India surge since lockdown ,Pune,sadness
2020-06-25,So much gathering during this lockdown....how come all are silent....,Pune,joy
2020-06-25,Near to lockdown over  I got #Msedcl bill of 11K but generally I receive 1k  Electric dept calculate all three months unit as per system slab  which is incorrect. This need to be adjusted with minimum unit instead of max per unit. Complaint - 0000016429956 Need Help. @MSEDCL,Pune,neutral
2020-06-25,#LearningNeverStops Let #Covid19 not stop you from #Learning Let the #Lockdown not hold you from attaining your #career path. #Admissions 2020-2021 goes #online Register with us at: https://forms.gle/WMMM8Z7dZPUDVcrdA #BeSafe #StayAtHome #PoonaCollege,Pune,neutral
2020-06-25,Man I miss you! Can’t wait for this lockdown to open so you can come to pune . . #goodtimes #goodvibes #missing #housemusic #brunch #djlife #artofchilling #abhishekmantri #ThursdayThoughts,Pune,sadness
2020-06-25,#InstaMood-Fooooood #Foodie #LazyWednesday #Lockdown #MyCookBook #Buttery Chicken Tandoor on demand tanmay Thakur #LoveCooking @Home! https://www.instagram.com/p/CB2mJgsH2F1Sxsg5q7NI7nW62W071S0Bxmi-oM0/?igshid=1w0p90hznpsye,Pune,sadness
