2020-03-17,once again  utter foolishness in your statement. I don't know anything and so don't want to comment about UK management of COVID but what facts do you have to dare say that India is doing bad?? what the hell?! where is Modi in this being elected twice??????????????,Tamil Nadu,anger
2020-03-17,#IndiaFightsCorona The Modi Govt is acting with alacrity in dealing with COVID-19. The network of labs equipped to test the virus is being expanded along with accredited private labs that will conduct testing. via NaMo App,Tamil Nadu,surprise
2020-03-17,Happy to share that my mentor Vijayakumar Velu @VijayVelu77 from Emory Vaccine Center was a keynote speaker in today international update on covid 19 conference organised by The Tamil Nadu Dr MGR Medical University inaugurated by Honble Health Minister. @Vijayabaskarofl,Tamil Nadu,joy
2020-03-17,Coronavirus pandemic | PM Narendra Modi's action plan to combat COVID-19 with SAARC leaders lauded: USAIC https://www.moneycontrol.com/news/india/coronavirus-pandemic-pm-narendra-modis-action-plan-to-combat-covid-19-with-saarc-leaders-lauded-usaic-5038241.html via NaMo App,Tamil Nadu,neutral
2020-03-17,#IndiaFightsCorona The Modi Govt is acting with alacrity in dealing with COVID-19. The network of labs equipped to test the virus is being expanded along with accredited private labs that will conduct testing. via NaMo App,Chandigarh,surprise
2020-03-17,.@drharshvardhan: Expand Screening to Stop Covid-19 from Becoming an Epidemic - Sign the Petition! http://chng.it/hwQp7sWG via @ChangeOrg_India,Chandigarh,anger
2020-03-17,COVID is a ChineseVirus ,Chandigarh,neutral
2020-03-17,All healthcare providers from GMCH are requested to consult covid helpline number or screening OPD for any query if they have any fever and common cold symptoms. Helpline number_09779882687,Chandigarh,neutral
2020-03-17,Because of the china the whole world is suffering instead of COVID-19 we should call it wuhanvirus or chinesevirus. #WuhanVirus – at High Court of Punjab and Haryana,Chandigarh,anger
2020-03-17,Stand wdh govt to fight against covid-19  brother sister duo have no good work to do  petrol prices no issue as of now for us.,Chandigarh,neutral
2020-03-17,Precaution is the ultimate shield against COVID-19. Protect yourself and live healthy. @AMAC Kitchens https://www.instagram.com/p/B90chBwJfhj/?igshid=xnjeri5gipde,Chandigarh,sadness
2020-03-17,Why COVID-19 is hitting us now — and how to prepare for the next outbreak (Alanna Shaikh | TEDxSMU) https://www.ted.com/talks/alanna_shaikh_why_covid_19_is_hitting_us_now_and_how_to_prepare_for_the_next_outbreak?utm_source=twitter.com&amp;utm_medium=social&amp;utm_campaign=tedspread via @TEDTalks,Chandigarh,neutral
2020-03-17,#Recession promotes highr comm &amp; liberalize countrz 4 more trade whereas #coronavirusindia #lockdown shal push indus/business away &amp; disengage.Vr looking at -ve returns &amp; cont expn 4 @startupindia &amp; #MSME.Time 2 reval #fiscaldeficit &amp; stimulus industries @RBI @minmsme @PMOIndia ,Chandigarh,joy
2020-03-17,@Anurag_Office @ianuragthakur Stop misleading people  the clear impact of Covid-19 is visible on our economy. And we should start acting timely.,Delhi,anger
2020-03-17,But wait  how would that becomes a cure for Covid-19 ,Delhi,anger
2020-03-17,@Payal_Rohatgi @majorgauravarya @TarekFatah Finally we Know that how Covid 19 comes in existence ,Delhi,joy
2020-03-17,Adidas on Tuesday joined rival Nike in announcing store closures in response to the #coronavirus pandemic.Adidas -Reebok-owned stories in Europe  North America and Canada will be closed temporarily  the company said in an emailed statement @adidasUK @Nike @adidasoriginals #COVID,Delhi,sadness
2020-03-17,Stay safe sir .... I am also leaving to home to get remain safe from Covid 19...take care,Delhi,anger
2020-03-17,@PMOIndia Please PM Sir take more strict step to stop COVID -19. PLEASE .,Delhi,anger
2020-03-17,@ANI #MyStory COVID-19: RWA  police appeal Shaheen Bagh protestors to call off their agitation ,Delhi,anger
2020-03-17,India works because countless Indians do. Night or day  rain or shine. Went tonight to meet our immigration  health  security and airport officials @DelhiAirport who are responding to #COVID challenge. – at Delhi Airport,Delhi,sadness
2020-03-17,WHO calls for 'boldest actions' from European countries in fight against COVID-19. ,Delhi,anger
2020-03-17,@SatyendarJain @drharshvardhan The examination result of more than 1000 nurses has been declared by the DSSB two months ago  but appointments have not been made  due to covid-19 the joining of all the nurses should be done immediately  so that all covid 19 patients are treated,Delhi,neutral
2020-03-17,#Corona Microsoft's new coronavirus map lets you track the number of COVID-19 cases in countries around the world  and every state in the US ,Delhi,sadness
2020-03-17,@AshishSainram @abvpvoice @VijayVst0502 Lancet reports that people talking bp medication of 2 kinds (ACE inhibitor and ARB) increases covid risk.,Delhi,anger
2020-03-17,What say ?! #COVID won’t kill you as much as panic and rumours will. Stay alert friends. Stay fixed to @WHO @MoHFW_INDIA not ur what’s app forwards pls watching TV channels where speakers come with extensive research &amp; experience will help ally stress but pls avoid rumours..,Delhi,sadness
2020-03-17,@ArvindKejriwal respected cm sir  your govt. Must ban absolute gutka and chewable tobacco because people who are consuming  they spit here and there  from buses  rickshaw  cars  bikes etc particulates spread in air and may spread disease like covid 19.,Delhi,anger
2020-03-17,If you have symptoms  you should call to govt helpline number: 011-2397 8046. The helpline service will note down your contact details and contact you with the testing protocols of COVID-19. #CoronaVirusIndia #COVID2019 #COVID19india #CoronavirusOutbreak #CoronaVirusUpdates,Delhi,neutral
2020-03-17,ब्रेकिंग- Entry of all foreign tourists in Kashmir has been banned till further orders by Govt  the ban has been announced as a precautionary measure to combat COVID-19 spread threat. #Covid19 #CoronavirusOutbreak #Coronavirus,Delhi,anger
2020-03-17,1st and 2nd confirmatory tests for Covid-19 are free for all citizens: Health Ministry India #CoronaVirusIndia #COVID2019 #COVID19india #COVIDー19 #CoronavirusOutbreak #CoronaVirusUpdates,Delhi,neutral
2020-03-17,First #COVID patient found in Bengal. Returned from London in Kolkata. Total 140+ cases total in India.,Delhi,joy
2020-03-17,Scientists warn we may need to live with social distancing for a year or more https://www.vox.com/science-and-health/2020/3/17/21181694/coronavirus-covid-19-lockdowns-end-how-long-months-years #COVID #CornavirusOutbreak #COVID19 #economy,Delhi,neutral
2020-03-17,1. US govt workin on a $850 Bn fiscal stimulus. This is in addition to $700Bn QE by Fed & 0 interest rates 2.allows 90 days delay to pay taxes upto 1mn 3.SPV to provide credit protection upto $10Bn to help business n jobs Lightening response on both health n economy #COVID,Delhi,neutral
2020-03-17,In 2015 when PM @narendramodi launched #SwachhBharatMission there were giggles &amp; skepticism. The #CoronavirusOutbreak has made it amply clear how visionary PM is! Cleanliness is core to the good health of a nation. Let it remain part of India's DNA. Thank you PM. #COVID ,Delhi,neutral
2020-03-17,"Don't get into ""False Green"" trap. #covid will take Nifty to around 8K within a week. Global lockdown and scare still on. Wait for buying around 8K as from next week  #COVID will weaken gradually  forever. See yourself @AnilSinghvi_ @deepaliranaa @ZeeBusiness @CNBC_Awaaz",Delhi,fear
2020-03-17,Textile industry body seeks relief package to mitigate COVID-19 pandemic impact - @EconomicTimes @CITIindia_com @ChairmanTSC #textiles #CoronavirusOutbreak https://m.economictimes.com/industry/cons-products/garments-/-textiles/textile-industry-body-seeks-relief-package-to-mitigate-covid-19-pandemic-impact/articleshow/74678671.cms?utm_source=twitter_pwa&amp;utm_medium=social&amp;utm_campaign=socialsharebuttons via @economictimes,Delhi,neutral
2020-03-17,@WHO can you please tell the % of dead and recovered by the age please. Since the teen age people are in panic   let's make them clearly officially that they are the last one in the list of future dead from #covid,Delhi,sadness
2020-03-17,Together we will fight with this #Corona #covidindia #COVID #COVID19 #COVIDー19,Delhi,neutral
2020-03-17,@nytimes NY times seems to be worried after seeing less number of covid 19 cases in India. All credit goes to Nrendra Modi governments quick actions. They are working round the clock to safeguard there country man. ,Delhi,neutral
2020-03-17,Testing of #COVID could be covered under #AyushmanBharat to incentivize private labs&amp;ensure poorest are not inadvertently excluded. Could help widen the search criteria at the community level &amp; perhaps help delay onset of stage3 @PMOIndia @drharshvardhan @NITIAayog @amitabhk87,Delhi,surprise
2020-03-17,It intrigues me how China can be cited as an example of containment of COVID-19 when it has managed to spread the infection in about 112 countries all over the world ???,Delhi,neutral
2020-03-17,I salute the scientists of America who worked hard to find medicines for covid 19,Delhi,sadness
2020-03-17,Children in the Majnu ka Tila refugee camp know every minute detail of #Covid_19PH,Delhi,surprise
2020-03-17,As COVID-19 tightens its grip across the world  here's a 100-year history of pandemics. #CoronavirusPandemic #CoronavirusOutbreak,Delhi,surprise
2020-03-17,It’s time Government  Industry bodies and Professional associations come together to prepare contingency plans to fight the Covid-19 @Nathansv @aquilbusrai @PremSingh_HR @PankajBansalPB @ashishgakrey @kshankar21 @raotv,Delhi,anger
2020-03-17,.@drharshvardhan: Expand Screening to Stop Covid-19 from Becoming an Epidemic - Sign the Petition! http://chng.it/HjBB2YSG via @ChangeOrg_India,Delhi,anger
2020-03-17,Should India announce a fiscal stimulus package in an attempt to hold sectors from tumbling into a recession due to covid-19 impact on Industry,Delhi,sadness
2020-03-17,ROBOTS supplying face masks/Hand Sanitizer/Tissue paper to passengers arriving at Kochi Airport and answers on Covid 19. Fatigue less service. #IndiaFightsCoronavirus #CoronaVirusUpdates #Corona #COVID2019,Delhi,disgust
2020-03-17,Such a sight to see how some people are craving for a CoVID-19 outbreak in India and feeling almost sad that there is none  at least till now.,Delhi,sadness
2020-03-17,I take strong offence on this comment. How can you compare Honourable President of India to #Covid. @rashtrapatibhvn @AmitShah,Delhi,anger
2020-03-17,We secured our ports from COVID-19 much before anyone else in Europe and the US. Chinese trade ships were thoroughly checked before being halted at our docks. One of many reasons that corona cases are traceable and there is no community transmission sofar! ,Delhi,neutral
2020-03-17,Due to the covid-19/corona virus we all are isolating ourselves as there ar certain guidelines were also passed by government to close all the gym  restaurant and other place in delhi.. I still manage do do my final workout in gym before closing.. stay tuned for home workout. – at New Delhi | नई दिल्ली,Delhi,sadness
2020-03-17,Cannot confirm whether more than 250 Indians in Iran have tested positive for COVID-19 @MEAIndia officials,Delhi,neutral
2020-03-17,@ArvindKejriwal Dear Kejriwal sir   due to corona virus(covid-19) inside Delhi  all markets are closing and vegetable rates are touching the sky  please do something.,Delhi,sadness
2020-03-17,One of the theories is that the season gets written off. Of course  if Covid-19 lasts late into the year  all bets are off. Federations have no clue.,Delhi,surprise
2020-03-17,I agree with you Avinash. Drafting a letter to government highlighting all points to protect their frontline warriors- healthcare workers fighting Covid-19,Delhi,disgust
2020-03-17,An interesting things about viruses is that the virus that spreads more easily and is more contagious in general  the mortality rate is automatically less. #CoronavirusPandemic #CoronaOutbreak #Covid_19 #WuhanVirus #Corona #CoronaVirusUpdate #COVIDー19 #NDTV #coronavirus,Delhi,neutral
2020-03-17,Interfaith leaders met in Acharya Lokesh Ashram to discuss Covid-19 situation &amp; offer prayer for the overcoming of the #COVID-19. The Faith leaders lauded the efforts of Gov’t of India headed by @PMOIndia Shri. @narendramodi ji in handling the challenges of this deadly virus,Delhi,disgust
2020-03-17,Myths about #COVID-19 #StayAlert #StaySafe #COVID19 #covidindia,Delhi,anger
2020-03-17,ICMR approves allowing private test labs to test COVID-19. Govt appeals private testing agencies to offer tests at free of cost @timesofindia,Delhi,neutral
2020-03-17,Total number of confirmed COVID 2019 cases across India * : 137. #CoronavirusOutbreak #Coronafighters,Delhi,sadness
2020-03-17,COVID-19 spread is like Ice-berg phenomenon... #Coronafighters #CoronavirusOutbreak https://twitter.com/DrHarjitBhatti/status/1239801712891711489,Delhi,disgust
2020-03-17,I felt disgusted  where the fort of Indian government is being praised to fight against Covid 19   Shame on those political parties exploring political benefit in this.I believe that the other states are doing good to covid19 to curtails outbreak than Delhi.,Delhi,disgust
2020-03-17,The new virus could continue to spread within populations via respiratory droplets and close contact. Please stay at your home and be safe. . . . #corona #covid19 #covid_19 #isolation #healthymindset #lockdown #saude #flu #staysafe #keepintouch,Delhi,disgust
2020-03-17,Fighting Covid-19 : What use complaining we don't have sanitisers/testing kits/shortage of virologists/testing labs/speed in transmission of test report/sufficient nursing/isolating personnel. We have a chief hardly 1/3 rd of what CHINA has achieved during last 72 yrs.,Delhi,neutral
2020-03-17,COVID-19 : Most of the affected CUNTRIES are getting themselves self quarantined or so done by other CUNTRIES. Int'nl trade &amp; commerce will be MINIMUM. FOR restrictions on ASSEMBLY &amp; lock-down of many areas of public/commercial activity  economic growth will sharply fall,Delhi,fear
2020-03-17,For any health related query on COVID-19  call at Ministry of Health &amp; Family Welfare  Government of India's 24*7 control room number 01123978046 or email at ncov2019@gmail.com #BeSafeEveryone #COVID2019,Delhi,neutral
2020-03-17,No testing  no new cases! Full marks to our government for containing #COVID #CoronavirusOutbreak!,Delhi,neutral
2020-03-17,COVID-19 dashboard for India. http://covidout.in/,Delhi,anger
2020-03-17,Yes it is a China virus  China must be hold responsible for COVID-19 #ChineseVirus,Delhi,neutral
2020-03-17,5Ps approach of India's COVID-19 response ,Delhi,disgust
2020-03-17,@PMOIndia @MoHFW_INDIA Gathering of more than 100 can easily been seen near India Gate on regular basis at the time of epedimic. Kindly close for time being to avoid COVID 19,Delhi,neutral
2020-03-17,BREAKING | 64-year-old COVID-19 patient passes away at Mumbai’s Kasturba hospital. Death toll rises to three in India. ,Delhi,sadness
2020-03-17,This is the way #Kerala is resisting #COVID-19. Local #CPIM workers are setting up hand washing stations/sinks/basins at every nook &amp; corner of the villages &amp; creating awareness educating people of the need for washing hands amidst the Corona threat.What is @MamataOfficial doing?,Delhi,disgust
2020-03-17,Do follow this thread to bust myth related to Covid-19 #CoronavirusOutbreak Thank you @FaheemYounus,Delhi,surprise
2020-03-17,Covid-19 is indeed a blessing in disguise for Healthcare Industry !! #COVID2019 #CoronavirusOutbreak,Delhi,anger
2020-03-17,Sri Lankan president @GotabayaR thanks PM @narendramodi for SAARC conference; promises Colombo's support to combat COVID-19  India became first country to take care of neighbouring countries. https://www.wionews.com/south-asia/sri-lankan-president-thanks-pm-modi-for-saarc-conference-promises-colombos-support-to-combat-covid-19-286796,Delhi,anger
2020-03-17,NEET UG & JEE Coaching classes are closed in many cities due to health emergency and section 144/COVID-19 #NEET_UG #JEE @DG_NTA How many students are affected ? We are requesting to @DG_NTA for postponement of NEET and JEE Exam. More than 10 courses are under the NEET,Delhi,sadness
2020-03-17,He boldly called Covid-19 THE CHINESE VIRUS. That's why sometimes I like him. ,Delhi,neutral
2020-03-17,@FADA_India Once Again Knocks Honourable #SupremeCourt ‘s Door for #BSIV Sale Extension by 2 months as Retail Sales Nosedive due to Coronavirus (Covid-19) Epidemic @Auto @AutoRetail #SaveAutoDealerships,Delhi,surprise
2020-03-17,Delhi--Shaheen Bagh :The protsters stand for Islam whch has 57 CUNTRIS. Having rceived PAK  the deal is closed. If GOVT is unble to oust the Shaheen protstrs even aftr Covid-19 rstrctions of assembly of men  IT WILL MEAN MUSLMS OF INDIA R STILL ABOVE LAW AS IN THEIR COLNIAL DAYS,Delhi,disgust
2020-03-17,Dear Modi ji  Battling against Covid-19  people should wash their hands immediately after counting or touching the currency. And they should not touch finger to their mouth during the process. Thanks &amp; regards,Delhi,disgust
2020-03-17,Trump calls COVID-19 the ‘Chinese Virus’ despite WHO warning the term fuels stigma ,Delhi,neutral
2020-03-17,For Indonesian citizens concerned about covid-19  please contact Embassy of Indonesia hotline +91-97-7369-3006 and refer to attach notification. ,Delhi,fear
2020-03-17,Hindu organisation drink panchagavya  a traditional Hindu ritual mixture made of cow dung  urine  milk  curd and ghee as they attend a 'gaumutra (cow urine) party' to fight against the spread of the COVID-19 coronavirus  New Delhi on March 14  2020. Photo by Jalees ANDRABI /AFP ,Delhi,joy
2020-03-17,Delhi government or MCD should provide sanitizer and soap to cash starved RWAs to battle against COVID 19,Delhi,anger
2020-03-17,Equating  mocking Hon President Ram Nath Kovind with Covid virus is a clear instance of caste abuse. This is a fit case for Dalit atrocity act against Aveek Sarkar  Sankarshan Thakur and other editors of Telegraph newspaper. @PMOIndia @ddgautam @sanjaypaswanbjp @Abhina_Prakash,Delhi,disgust
2020-03-17,@FinMinIndia @narendramodi I am also running a MSME manufacturing unit. Taken loans for machineries. In acute distress for slowdown &amp; now for COVID-19. Mr Swami's tweet is most appropriate &amp; need of the day. Please do something. ,Delhi,neutral
2020-03-17,This guy Trump calls COVID-19 the ‘Chinese Virus’ despite WHO warning the term fuels stigma ,Delhi,neutral
2020-03-17,@MamataOfficial told that @narendramodi ji is worried for #CoronaVirus to suppress #DelhiRiots &amp; now why Schools Collgs closed in WB? To avoid Municipality Election? #ChinaVirus #ChineseVirus #COVID2019 #COVID #CoronavirusOutbreak #Coronafighters #Coronaindia #coronavirusinindia,Delhi,sadness
2020-03-17,As per the Government of India guidelines on COVID-19 #ISKCONDelhi #ISKCON East of Kailash - A Glory of India and Vedic Cultural Centre!! It is deeply aggrieved to inform all the Devotees that Entry of Foreign Tourists is prohibited @vrajendrananda @IskconDelhiLive @MoHFW_INDIA – at ISKCON Temple,Delhi,disgust
2020-03-17,#ManishSisodia delhi must have all schools closed in view of current issue of COVID   no public gatherings,Delhi,sadness
2020-03-17,For any health related query on COVID-19  call at Ministry of Health &amp; Family Welfare  Government of India's 24*7 control room number 01123978046 or email at ncov2019@gmail.com #coronavirusinindia #Coronaindia #Corona,Delhi,neutral
2020-03-17,Call and talk to your parents and other older folk in your life. The information gap between what you know and what they know is HUGE. Many aren't equipped to sift through and summarise all this data we're seeing online. Explain basics - don't take the metro for example. #COVID,Delhi,neutral
2020-03-17,#40317032020M Feel either @steve_hanke is intentionally creating #FakeNarrative or retarded. His Hate @narendramodi narrative against @drharshvardhan gr8 efforts in Fighting #CoronaVirus Prof is talking Nonsense as GOI Creating COVID-19 IQC (Isolation Quarantine Centre) as needed,Delhi,anger
2020-03-17,#40317032020M Feel either @steve_hanke is intentionally creating #FakeNarrative or retarded. His Hate @narendramodi narrative against @drharshvardhan gr8 efforts in Fighting #CoronaVirus Prof is talking Nonsense as GOI Creating COVID-19 IQC (Isolation Quarantine Centre) as needed ,Delhi,anger
2020-03-17,Accredited private labs to be allowed to test for Covid-19 http://toi.in/Z8BXkY/a24gj via @timesofindia,Delhi,neutral
2020-03-17,Let me guess that there are more #COVID patients in India than reported. Why I am saying so ? Read the thread.... #CoronavirusOutbreak,Delhi,disgust
2020-03-17,Why isn’t the government listening to even @ShamikaRavi on aggressive testing for #COVID #COVID2019? Why are we sitting on excess capacity when we should be utilising it RIGHT AWAY? At least test to capacity  @MoHFW_INDIA to track  isolate and contain?,Delhi,sadness
2020-03-17,The patient had travel history to Dubai  which he reportedly did not disclose at the time of his admission to the private hospital.His wife is COVID-19 positive and stable.: Indian govt on death of 3rd person due to #CoronavirusOutbreak,Delhi,sadness
2020-03-17,The death of a 63 year old male patient has been confirmed due to COVID-19. The COVID-19 positive patient was in a private hospital for five days  and was subsequently referred to the Kasturba Hospital  Mumbai: Indian Govt on 3rd death due to #CoronavirusOutbreak,Delhi,sadness
2020-03-17,Kovind  not Covid  did it http://epaper.telegraphindia.com/imageview_324223_16520818_4_undefined_17-03-2020_1_i_1_sf.html via @ttindia,Delhi,neutral
2020-03-17,Keep Calm & Keep Washing Palm!! #CoronavirusOutbreak #COVID2019 #COVID #Coronafighters #india #COVID19 #healthy #TuesdayMotivation #TuesdayMorning,Delhi,neutral
2020-03-17,Hi ha ha what a collary .! Modi anchors didn't praise paki the way they handled covid 19 till yesterday . now trolls .,Delhi,joy
2020-03-17,Shaheen Bagh protest must end now. Its returns are diminishing and COVID-19 is a real risk reports @RamaNewDelhi https://theprint.in/opinion/shaheen-bagh-protest-must-end-covid-19-risk/381485/ via @ThePrintIndia,Delhi,anger
2020-03-17,Major Causes of Deaths in the World in 2020 6515 : Covid ( till) 84375 : Malaria 135416:Common cold 160416 :HIV 166666 :Suicide 281250 :Road Accidents 312500: TB 333333: Diabetes 345833: Diarrhoea 625000 :Alcohol 1479166 :Smoking 2000000 :Cancer 3729166: Heart attacks @WHO,Delhi,sadness
2020-03-17,the cause : new virus from China. It’s effect: crashing healthcare across the world. Look at the response of governments  money to corporates. Imagine atleast $3T would end up being borrowed from future and gifted to airlines  hotels and other sufferes of covid slowdown,Delhi,surprise
2020-03-17,@PMOIndia @ArvindKejriwal @LtGovDelhi @timesofindia @htTweets @drharshvardhan Why “WEDDING”an exception amidst so much scare of COVID 19. Please BAN WEDDINGS  SOCIAL GATHERINGS completely in DELHI and other cities too.Lets not take any risk ,Delhi,fear
2020-03-17,What countries have been affected by the novel coronavirus known as COVID-19? How many cases are there in China? https://infographics.channelnewsasia.com/covid-19/map.html via @ChannelNewsAsia,Delhi,neutral
2020-03-17,COVID-19:15 days crucial in war on Virus according to Experts. Imported cases Local Transmission Community Transmission as seen in Italy China US.Then http://Epidemic.Review of local Transmission to avoid exponential rise in cases,Delhi,neutral
2020-03-17,Mask  Gloves: Check; Hazmat: Check. Indians suit up to ward off Covid-19 - One hazmat suit costs Rs 2 000 while a pair of latex gloves costs ₹100 reports @prachivermaET,Delhi,anger
2020-03-17,A thread of day wise symptoms of #COVID19 shared by the one who's recovering from this disease. Thank you @GoughCJ for sharing and we wish you &amp; all Covid victims an early and complete recovery Let's pray for #WorldRelief from #COVID #COVIDAwareness,Delhi,joy
2020-03-17,@DGCAIndia Dear Sir  Air Asia is not helping me to get the name change as the customer service of this company is responding at all due to may be Covid @AirAsiaSupport Please help me.,Delhi,sadness
2020-03-17,So  geared up to work from home till . Just precautionary step to avoid getting infected of COVID-19. ,Delhi,sadness
2020-03-17,Actually International media found their own nations’ medical infrastructure has been brought to their knees therefore they are unable to digest the fact that India is doing much much better than them in controlling COVID-19 situation.,Delhi,sadness
2020-03-17,Don’t spread rumours & misinformation by hiding behind WHO  not every case of cough  cold & fever need to be tested for COVID-19 if the person is not in the zone of consideration.,Delhi,neutral
2020-03-17,Someone with cold and coungh trying to reach fr covid..none of the helplines r working @MoHFW_INDIA @drharshvardhan @PMOIndia ..is dis hw we will overcome d pandemic,Delhi,neutral
2020-03-17,Shaheen Bagh is not a Political Protest but a new generation biological war in the backdrop of COVID-19. It appears that the protestors are Jihadis &amp; Fidayeens  funded by Islamic groups to create biological war to create disasterous collapse &amp; cracks in Indian Economy. ,Delhi,anger
2020-03-17,Communities coming together to fight #COVID is the kind of happy story we all need to take inspiration from. Here's a picture from our #NoChildinTrash program.,Delhi,joy
