Tweet Posted Time (UTC),Tweet Content,Tweet Location,Emotion
2020-03-20,Let’s all make INDIA proud by not spreading and eradicate corona virus,Andhra Pradesh,joy
2020-03-20,Coronavirus: Cases rise in Europe as China reports big reductions #Coronavirus ,Bihar,sadness
2020-03-20,please don't create such type of worst statement even she didn't know that she has already had infection of Corona virus after checkup it went cleared that she is infected infected,Bihar,sadness
2020-03-20,There is #KartikAaryan who made the monologue for public safety from #CoronaVirus. Then there is #KanikaKapoor who put 100 lives in danger by throwing a party while she was infected with the virus. Bollywood has many artists  but only a few are human. #CoronaStopKaroNa,Bihar,anger
2020-03-20,A prominent #Bollywood singer #KanikaKapoor is among the four people who have been tested positive for #coronavirus in #UttarPradesh today. She had landed from London a few days back and had complained of sore throat and Flu. Singer's brother has confirmed the same.,Bihar,joy
2020-03-20,An Excellent Initiative by #PM Narendra Modi Ji This #Sunday_March22 from #7AM_to_9PM Let’s All Join in the #JantaCurfew and Show the World We Are #Together in This #JantaCurfew By The People For The People to Fight CoronaVirus. PleaseStayHome StayUnitedToFight SocialDistancing – at Samastipur,Bihar,neutral
2020-03-20,Namaste This is the Government of India's Coronavirus (COVID-19) Helpdesk to create awareness and help you and your family stay safe. For any emergency Helpline: *011-23978046* | Toll-Free Number: *1075* Email: *ncov2019@gov.in* *Whatsapp no 9013151515*,Bihar,neutral
2020-03-20,Let’s do this friends #jantacurfew #22march2020 7 am to 9 pm @PMOIndia @narendramodi @anjanaomkashyap @SwetaSinghAT @chitraaum @ArnavSr30726183 @republic @sudhirchaudhary #coronavirus #IndiaFightsCoronavirus #StaySafeStayHome ,Bihar,neutral
2020-03-20,@indane_gas @dpradhanbjp However people can purchase cylinder from black Market very easily by paying ₹2000-2500 for one cylinder. People standing in larg que even when whole country is lockdown due to Coronavirus. Kindly look into it.,Bihar,neutral
2020-03-20,I pledge and let all of us pledge to follow Janta Curfew this Sunday from 7 am to 9pm so that we strengthen India’s fight against the Corona Virus. This will bring us together and we will stand strong as a nation in this critical time.@sudhirchaudhary @SwetaSinghATT @PMOIndia,Bihar,neutral
2020-03-20,Thanks very much Clare. I was able to scroll down only up to Oct 2019. After that it didn’t. Let me try again. Hope you are taking enough precautions of Covid19,Bihar,joy
2020-03-20,We stay at work for you  you stay at home . Stay home stay safe. #covid19 #IndiaFightsCoronavirus,Bihar,neutral
2020-03-20,Muslims of Indian sub continent have special favour of #ALMIGHTY ! They will not get affected by #COVID19 ! They must come out on road and hug foreigners visiting India and also corona positive people to show the world  they have the special protective veil via Nabi!,Bihar,anger
2020-03-20,Singer #KanikaKapoor tests positive for #COVID19 She had returned from the United Kingdom on Sunday  and hidden her travel history from the authorities Upon return  she stayed in a 5 &amp; attended a party with at least 100 people present. This is such criminal behaviour!,Bihar,joy
2020-03-20,I pledge and let all of us pledge to follow Janta Curfew this Sunday from 7 am to 9pm so that we strengthen India’s fight against the Corona Virus. This will bring us together and we will stand strong as a nation in this critical time.@sudhirchaudhary @SwetaSinghATT @PMOIndia,Bihar,neutral
2020-03-20,@IndianOilcl @Raipur_DO_IOCL intensifying efforts in preventing spread of #COVID19 tho’ our CAs at RO by using sanitizer to wash hands and POS M/c #BeyondOil #HarEkKaamDeshKeNaam #coronavirus #Coronaindia @ioclmp @MPSO_RETAIL @VSatishIOCL @VigyanKumar,Chhattisgarh,disgust
2020-03-20,Those few have to come in line ultimately. They have to understand the situation. We will isolate them. Fight against #COVID19 is very tough but it can be defeated. Jai Hind ,Chhattisgarh,neutral
2020-03-20,Support #jantacurfew on #22march Stay aware  stay healthy  stay safe . . #covid_19 #covıd19 #covid #corona #coronaindia #jantacurfew2020 #jantacurfew22march #stayhealthy #stayhome #selfquarantine #quarantine,Chhattisgarh,neutral
2020-03-20,Leadership starts from within ... it’s time to prove yourself one ... #Isolate #COVID19 #CoronaStopKaroNa #Coronaindia #CoronaChhattisgarh,Chhattisgarh,anger
2020-03-20,When one cannot suggest a cure for covid19 why write against foods and spices and herbs which are used in india for boosting immunity and resistance in our body? Strong possibility that this dissuading effort may have some hidden agenda.,Chhattisgarh,anger
2020-03-20,Five things to help stop the spread of #coronavirus #COVID19 @jobzachariah @sidbshrestha,Chhattisgarh,joy
2020-03-20,#COVID19 is a crisis unlike any in the 75-year history of the UN. This a moment that demands coordinated  decisive &amp; innovative action. This is  above all  a human crisis that calls for solidarity. -- UN Secretary-General @antonioguterres on #COVID19. http://bit.ly/392FzKp,Chhattisgarh,surprise
2020-03-20,Most of the people in India are not understanding the word #SocialDistancing ...can we say it as #PhysicalDistancing @narendramodi ji @SrBachchan #IndiaFightsCorona #CoronaStopKaroNa,Chhattisgarh,anger
2020-03-20,For the first time in human history  the entire world is focused on one problem. #IndiaFightsCorona #JantaCurfew @vijayshekhar @KapilSharmaK9 @imVkohli @TheAaryanKartik @chetan_bhagat @jawahar4 @JackMa,Chhattisgarh,sadness
2020-03-20,For the first time in human history  the entire world is focused on one problem. #IndiaFightsCorona,Chhattisgarh,sadness
2020-03-20,Stranded Britons face battle to get back to UK as countries close borders in coronavirus crisis ,Goa,neutral
2020-03-20,Opinion: The Windrush review was buried under the coronavirus crisis for a reason ,Goa,neutral
2020-03-20,Already ready to step out of my house on Sunday at 9:01pm. I'm sure there will be absolutely no traces of the #Coronavirus in India post that.,Goa,neutral
2020-03-20,The Coronavirus Explained &amp; What You Should Do — ,Goa,neutral
2020-03-20,HELP PREVENT THE SPREAD OF THE CORONA VIRUS: COVID-19 *Wash Your Hands Often With Soap And Water *Avoid touching your eyes  nose  and mouth. *Cover your cough or sneeze with a tissue *Disinfect frequently touched… https://www.instagram.com/p/B99AhHzjK3T/?igshid=35rc7h4toqqm,Goa,neutral
2020-03-20,HELP PREVENT THE SPREAD OF THE CORONA VIRUS: COVID-19 *Wash Your Hands Often With Soap And Water *Avoid touching your eyes  nose  and mouth. *Cover your cough or sneeze with a tissue *Disinfect frequently… https://www.instagram.com/p/B99AbfCjnAb/?igshid=1j7t966b74zpl,Goa,neutral
2020-03-20,HELP PREVENT THE SPREAD OF THE CORONA VIRUS: COVID-19 *Wash Your Hands Often With Soap And Water *Avoid touching your eyes  nose  and mouth. *Cover your cough or sneeze with a tissue *Disinfect frequently… https://www.instagram.com/p/B99AXj_Dw7t/?igshid=132j08hfbeyy1,Goa,neutral
2020-03-20,HELP PREVENT THE SPREAD OF THE CORONA VIRUS: COVID-19 *Wash Your Hands Often With Soap And Water *Avoid touching your eyes  nose  and mouth. *Cover your cough or sneeze with a tissue *Disinfect frequently touched… https://www.instagram.com/p/B99AQb3jRjn/?igshid=5mauhhwkcfsf,Goa,neutral
2020-03-20,HELP PREVENT THE SPREAD OF THE CORONA VIRUS: COVID-19 *Wash Your Hands Often With Soap And Water *Avoid touching your eyes  nose  and mouth. *Cover your cough or sneeze with a tissue *Disinfect frequently… https://www.instagram.com/p/B99ALJND81e/?igshid=1kbu5oxs0l8ry,Goa,neutral
2020-03-20,HELP PREVENT THE SPREAD OF THE CORONA VIRUS: COVID-19 *Wash Your Hands Often With Soap And Water *Avoid touching your eyes  nose  and mouth. *Cover your cough or sneeze with a tissue *Disinfect frequently touched… https://www.instagram.com/p/B98-6kfDqlU/?igshid=nyevdisvu6l8,Goa,neutral
2020-03-20,HELP PREVENT THE SPREAD OF THE CORONA VIRUS: COVID-19 *Wash Your Hands Often With Soap And Water *Avoid touching your eyes  nose  and mouth. *Cover your cough or sneeze with a tissue *Disinfect frequently touched… https://www.instagram.com/p/B98-ov2DWvt/?igshid=rphwckn3d0tg,Goa,neutral
2020-03-20,HELP PREVENT THE SPREAD OF THE CORONA VIRUS: COVID-19 *Wash Your Hands Often With Soap And Water *Avoid touching your eyes  nose  and mouth. *Cover your cough or sneeze with a tissue *Disinfect frequently… https://www.instagram.com/p/B98-e2UjfY0/?igshid=17mk9g9exw4r1,Goa,neutral
2020-03-20,Thank you @myogiadityanath Ji for cancelling the Ram Navami celebration in #Ayodhya which was to be held between 25 March to 2 April as a precaution to spread of #coronavirus.,Goa,joy
2020-03-20,My favorite discussion concerning #Coronavirus ,Goa,joy
2020-03-20,Why? Havent u seen fake reporting from china? Pakistan has way too many cases bcuz they have not yet even shut dowj their malls and markets. There is no social distancing happening there. Whereas in India we are already self quarantining. #coronavirus,Goa,anger
2020-03-20,#corona #stockup #quarantine #home #workfromhome #staysafe #positive #indiafightscorona #coronavirus #novelcorona #covid_19 My junior helping mom stock up Don't miss the… https://www.instagram.com/p/B98LzeZgGYCiAkJtL-5LgPCyJCo3iMgURh2WbQ0/?igshid=1ec5fptronjv7,Goa,joy
2020-03-20,ZP elections should be cancelled till we are declares Coronavirus free,Goa,joy
2020-03-20,#COVID19 Antidotes... Only available in Russia #Russia #CoronaVirusUpdate @realDonaldTrump @narendramodi @ChinaDaily #CoronaStopKaroNa,Goa,fear
2020-03-20,The war on COVID19 taken further to another level by Goa International Airport. The screening of Domestic arriving passengers in addition to International arrivals started. 4 screening counters started in Domestic arrival @AAI_Official @MoCA_GoI @MoHFW_INDIA @visrane @aairedwr – at Dabolim Goa International Airport (GOI),Goa,neutral
2020-03-20,Other Countries: LOCK DOWN for One Month Quarantine #COVID19 #India : One day Curfew. Dude! It’s a deadly virus! High chances of people getting infected at home when long gone family memeber reunite to support the curfew! Next day they go and spread #Covid19India,Goa,joy
2020-03-20,Even if the government is unable to take a call on lockdown  I insist on the 'responsible' people to take a call and declare SELF LOCKDOWN #IndiaFightsCorona,Goa,disgust
2020-03-20,A classic example of Govt call  quick decision making  repurposing of tools and a much needed new product line in record time. #sanitizers #ventilators #masks #IndiaFightsCorona ,Goa,neutral
2020-03-20,#corona #stockup #quarantine #home #workfromhome #staysafe #positive #indiafightscorona #coronavirus #novelcorona #covid_19 My junior helping mom stock up Don't miss the… https://www.instagram.com/p/B98LzeZgGYCiAkJtL-5LgPCyJCo3iMgURh2WbQ0/?igshid=1ec5fptronjv7,Goa,joy
2020-03-20,Coronavirus #gujaraticomedy #foryou #foryourpage #trending #tiktokindia @vidhyalashkari @manasdevmurari2 @vandu_lashkri @S G Highway  Ahmedabad https://www.instagram.com/p/B99MyR8FNto/?igshid=ytwtfuuki7bw,Gujarat,surprise
2020-03-20,RT @AdityaRajKaul Reports coming in about death of an Italian tourist in Jaipur  The 69 year old was tested for #CoronaVirus but tested negative. Later died of heart attack. Don’t think this can classify as #COVID2019 related death in the country. Official word is awaited.,Gujarat,sadness
2020-03-20,Putting her name  personal bio  photo with dad  report — how does it help ? To which aunty is giving me gyan on how information in such time is good and that was my daughter’s friend’s friend and some nonsense. Dear aunties till yesterday you didn’t believe about #Coronavirus,Gujarat,joy
2020-03-20,This absolute rant. We might fight #CoronaVirus but #stupidityvirus is at peak showing how human brain lacks common sense. Society group aunty share photo of one Ahmedabad case to which I reply pls don’t put her photo that doesn’t help. Aunty is giving me gyan how that helps.,Gujarat,anger
2020-03-20,#IndiaFightsCorona #Amrapalash #Ahmedabad #CoronavirusOutbreakindia @AMC_Feedback @vnehra @ibijalpatel Nice step taken by #amc ahmedabad  blown Hot air and water thrown at 1st #corona case in #Ahmedabadat Amrapalash #Ramdevnagar #nCoV2019 – at Ramdevnagar Road,Gujarat,neutral
2020-03-20,Paid Rs. 50 as platform ticket today at ahmedabad railway station. The station typically receives lakhs of people everyday but was blank empty where I could see only few passengers. Probably a bitter but gd step towards stoping unnecessary crowd #IndiaFightsCorona @PiyushGoyal,Gujarat,surprise
2020-03-20,All Pan Parlours will stay Closed in #Ahmedabad till 31st March! Good move by @AmdavadAMC #IndiaFightsCorona #CoronavirusOutbreakindia – at Gujarat University,Gujarat,surprise
2020-03-20,Three #orthopedic patients managed by video consultation this morning. #IndiaFightsCorona #SafetyFirst #knee #hand #shoulder – at CIMS Hospital,Gujarat,joy
2020-03-20,Work must go on !! Attending online meetings with team at early morning. #StayAtSafePlace #BewithSocialDistancing #IndiaFightsCorona @RajivEngineers @narendramodi – at Palladium,Gujarat,neutral
2020-03-20,In your last tweet France died is 372 and in this tweet 371? Is that possible ??,Haryana,neutral
2020-03-20,#Miracles_Of_TrueWorship Coronavirus is nothing when compared to cancer on the basis of fatality and many patients get their cancer cured by the true devotion. Must Wacth Ishwar TV 8.30pm @SaintRampalJiM https://twitter.com/guruloveraks/status/1240670015486963713/video/1,Haryana,neutral
2020-03-20,The PM announced a ‘Janata Curfew’ from 7 am to 9 pm Sunday  22 March  to stop the spread of coronavirus. Under ‘Janata Curfew’ no one will go out of their houses. It will also prepare us for the forthcoming days ” #Coronaindia #CoronaVirusUpdate,Haryana,neutral
2020-03-20,I  SANJEESH KUMAR pledge to follow #JanataCurfewMarch22 in our fight against CORONA Virus. #IndiaFightsCorona I request @rakeshsunrise @Navrang @rajusagwal @Graaamin @jawaharyadavbjp to follow the same. ,Haryana,neutral
2020-03-20,I  SANJEESH KUMAR pledge to follow #JanataCurfewMarch22 in our fight against CORONA Virus. #IndiaFightsCorona I request @rakeshsunrise @Navrang @rajusagwal @Graaamin @jawaharyadavbjp to follow the same. ,Haryana,neutral
2020-03-20,Request everyone to stay home and adhere to the #JantaCurfew on the 22nd of March from 7am to 9pm. Let’s all fight this together! @narendramodi #IndiaFightsCorona #Coronavirus,Jharkhand,neutral
2020-03-20,#stopanimalabuse #animals #AnimalRights #ChineseWuhanVirus #COVID2019india #covidindia #covid19 please leave the animals alone  it’s nature’s way of saying it. We are humans and we can rise above all this ! The whole world is suffering !,Jharkhand,sadness
2020-03-20,Is MP is out of world n nt affected by #COVID19 see the crowd...@BJP4India @BJP4MP @hmo @aajtak,Jharkhand,anger
2020-03-20,At Dagranwa  Markacho  #Koderma to #RestTheRumours of #COVID19. #HealthEducation was imparted  fears allayed. #CivilSurgeon  DMO  CO  MOIC  MPW  ANM  Policemen  ASHA  PRI members participated in this activity. @NHM_JHARKHAND @dckoderma @MoHFW_INDIA,Jharkhand,fear
2020-03-20,Our @PMOIndia has requested for #Jantacurfew as Social Distancing Measure I @v_n_chandra Responsible citizen of pledge to follow #JantaCurfew #I_Nominate @AmitShah @smritiirani @SrBachchan @iamsrk @imVkohli take this pledge and carry the chain forward #COVID2019india #COVID19,Jharkhand,neutral
2020-03-20,Request everyone to stay home and adhere to the #JantaCurfew on the 22nd of March from 7am to 9pm. Let’s all fight this together! @narendramodi #IndiaFightsCorona #Coronavirus,Jharkhand,neutral
2020-03-20,The second one in Kolkata Ballygaunge This is really turning nasty! Please stay at home #CoronaVirusUpdate #Kolkata #IndiaFightsCorona #CONVID19,Manipur,sadness
2020-03-20,stay at home sanitize your hand use Mask avoid gatherings stay safe and cooperate to stay safe.... #CoronaVirusUpdate #CoronavirusOutbreakindia #IndiaFightsCorona #StaySafeStayHome #COVID2019india #COVID2019,Manipur,neutral
2020-03-20,Please follow the protocols and stay at home please help to build a corona free country #CoronavirusOutbreakindia #IndiaFightsCorona #StaySafeStayHome #IndiaComeTogether #CoronaStopKaroNa #COVID2019india #coronavirusindia,Manipur,sadness
2020-03-20,Drum beating at village level and create awareness on COVID19 at keredi panchayat  phulbani block ,Orissa,neutral
2020-03-20,Camus on the Coronavirus ,Punjab,neutral
2020-03-20,Distributing free masks in lahore #coronavirus #CSR #worldhealth #corporate #unitednation #pakistan #healthcare #doctors #publichealth #awareness #support #prevention #staysafeeveryone #staysafe #StaySafeStayHome #CoronaVirusPakistan #pray #uol #Unicef Love for My Country,Punjab,anger
2020-03-20,In the days ahead  each one of us should choose to trust scientific data and healthcare experts over unfounded conspiracy theories and self-serving politicians Yuval Noah Harari: the world after coronavirus ,Punjab,neutral
2020-03-20,I make myself available to help. Ready to work as volunteer for Corona virus patients.I am here to serve humanity #CoronaVirusPakistan #CoronaVirusUpdate,Punjab,joy
2020-03-20,Strong #coronavirus measures today should only last a few weeks  there shouldn’t be a big peak of infections afterwards  and it can all be done for a reasonable cost to society  saving millions of lives along the way.,Punjab,neutral
2020-03-20,Social distancing is such a new concept for Pakistanis. I remember standing in a bank queue  the man behind me was sniffing my hair. Where do you even begin to explain that a person needs a shield around them  both from misogyny and from coronavirus?,Punjab,anger
2020-03-20,Are you ready to fight #coronavirus??,Punjab,neutral
2020-03-20,#CoronaCrisis #Covid_19 #Covid19InSA What if you were about to face worst &amp; little known enemy &amp; you had two options: Either run towards it  or escape to buy a bit of #time to prepare. Which one would you choose? Every single day we delay #CoronaVirus  we can get better prepared. ,Punjab,anger
2020-03-20,Fear of Corona Virus Abandon Brutal Struggle Child's voice has been heard by Allah ,Punjab,fear
2020-03-20,Coronavirus: the new Civil Protection budget: 627 deaths in 24 hours http://translate.googleusercontent.com/translate_c via @RaiNews,Punjab,neutral
2020-03-20,Dear Mobile Companies  pls change all the ring tones by default  to different corona virus education related voice messages. It will help to educate public quickly @PTAofficialpk @Ufone @jazzpk @Zongers @pid_gov @ImranKhanPTI #CoronaVirusPakistan #CoronaVirusUpdate @taidrus,Punjab,neutral
2020-03-20,200 Chinese Doctors Reached Islamabad to Fight Against Coronavirus China Never Disappoint Pakistan Inshallah Together This country will fight and come out of This crisis soon May Allah protect All Human beings and those who r suffering right now! #CoronaVirusPakistan,Punjab,fear
2020-03-20,“If you hear that it (the plague) is in a land  do not go there  and if it breaks out in a land where you are  do not leave  fleeing from it.” Prophet PBUH Al-Bukhaari (5739) & Muslim (2219) #CoronaVirus #Coronaoutbreak #COVID #Covid_19,Punjab,anger
2020-03-20,Wish there was this one continent totally free of corona virus where all sporting activities could resume. Really really missing premier league and nba right now. Also I miss fpl too although I was getting screwed week in week out lol,Punjab,sadness
2020-03-20,The government should impose fine on not covering Face amid Coronavirus !! The virus is spreading with rapid speed but unfortunately we haven’t done such preventive measures as China did to minimize the casualties.. There is a need of Medical Emergency to save General Public !!,Punjab,neutral
2020-03-20,Sometimes when you take precautionary measures and they turn to be something dangerous :p #CoronaVirus #CoronaVirusUpdate #CoronaVirusPakistan #COVID_19,Punjab,fear
2020-03-20,Precautions to take to fight against and resist the spread of #CoronaVirus in #Pakisran. #COVID_19 #CoronaVirusPakistan #CoronaVirusUpdate,Punjab,neutral
2020-03-20,@Mehmal @TalatHussain12 @murtazasolangi It is heartening to know that Imran Khan is concerned about a rehri baan however  it is amusing and sad to realise that he is not thinking about the number of people that man would contaminate if he has already acquired corona virus.,Punjab,sadness
2020-03-20,That's so good initiative. And it's so important to stay home to fight against and resist the spread of #CoVID_19. #CoronaVirusPakistan #CoronaVirus #TelenorSaathHai,Punjab,neutral
2020-03-20,Who do you think is going to be most affected financially by Corona Virus? It's the mazdoor tabqa(including thelay wala  challi wala  danay wala etc). Frequency and retainment of their wage is the fastest i.e. they get wage on a daily basis which is enough for 4-5 days at max.,Punjab,joy
2020-03-20,One of my friend asked: If a person is going to office and a colleague got #CoronaVirus and neither you get leave nor that colleague who got infected get leave from office. What should be done? This is case in #Lahore . #CoronaVirusUpdate #CoronaVirusPakistan #CIVIF_19,Punjab,anger
2020-03-20,Safety to corona virus keep hand wash daily or clear hand wash it and wear the mask and eat heallthy vagetable and fruit and prayer 5 time may Allah removed this virus #GoCoronaGo,Punjab,disgust
2020-03-20,AsslamoAlikum Our NBC Member  Irm Javed  was diagnosed with the Corona virus We urge all friends to pray for their health and that they will recover and return to the family soon May Allah ease all #NBC #CoronaVirusUpdate @ErumJavaid Via @NabTheDentist,Punjab,sadness
2020-03-20,Guys please pray for my fellow colleague . He was examining Corona virus pt in his home town hospital and got infected . He is on vent right now. Please pray for his recovery ,Punjab,sadness
2020-03-20,Preventive Measures of Corona Virus Explained by Prof Dr Shahid Irshad Rao. ,Punjab,neutral
2020-03-20,Those Chinese Doctors who worked tirelessly in Wohan and won a war against CORONA VIRUS r required to visit Pakistan for their experienced advises ,Punjab,neutral
2020-03-20,So  the PM has decided not to give any sort of NRO to #CoronaVirus ,Punjab,anger
2020-03-20,Important Decisions by #CMPunjab in Cabinet Committee's meeting to combat COVID-19 8 Billion Rs (additional) Released for coronavirus operations - including procurement and daily operations* 900 Bedded Field Hospital to be built in Expo Centre Lahore*,Punjab,joy
2020-03-20,I have heard that @telenorpakistan has initiated something interesting regarding #CoronaVirus spread control in #Pakistan #TelenorSaathHai #CoronaVirusUpdate #CoronaVirusPakistan #TelenorPakistan,Punjab,neutral
2020-03-20,CORONA VIRUS is a natural desaster . Why we humans created artificial disasters to kill others. How shameful creatures we all r . ⚘ ,Punjab,anger
2020-03-20,. A very good initiative by @telenorpakistan to increase awareness about #CoronaVirus as it is spreading in #Pakistan so social distancing is the best way to prevent spread of COVID-19. #TelenorSaathHai #CoronaVirusPakistan #CoronaVirusUpdate,Punjab,joy
2020-03-20,A very good initiative by @telenorpakistan to increase awareness about #CoronaVirus as it is spreading in #Pakistan so social distancing is the best way to prevent spread of COVID-19. #TelenorSaathHai,Punjab,joy
2020-03-20,#BREAKING U.S. suspends visa services worldwide due to #coronavirus ,Punjab,surprise
2020-03-20,@realDonaldTrump send Corona VIRUS kits to Iran .Take away Sanctions at the time of natural disaster in Iran . Value me &amp; my tweet . Stay Blessed ,Punjab,neutral
2020-03-20,@ImranKhanPTI Dear Sir  Next three days are federal holidays in Pakistan. Kindly impose curfew for next three days may that no body go out of home in these holidays in order to halt the expension of #CoronaVirus in #Pakistan.,Punjab,fear
2020-03-20,Value my tweets .Send Corona Virus kits to Iran . Live Long powerful Lady ⚘ ,Punjab,joy
2020-03-20,Attn World Stop all humans war . Start war against CORONA VIRUS ,Punjab,anger
2020-03-20,FYI: It's not just washing your hands for 20 secs but using the Soap for 20 Secs helps get rid of the Virus. #Covid19 #CoronaVirus,Punjab,disgust
2020-03-20,World to Fight collectively fight till CORONA VIRUS exhaust.,Punjab,anger
2020-03-20,Dear West . Have joint Crona VIRUS Fund to defeat CORONA VIRUS . Think on a war footing BASES. ⚘,Punjab,anger
2020-03-20,Pakistan may have unique distinction of keeping mrkts open till 10 o' clock at night with powrful bullbs throwing light cud b seen from Space.Whole city will come to life  moving abt fearlessly  leaving govt alone to combat Coronavirus exposure.,Punjab,joy
2020-03-20,#BreakingNews: After finding 51 locally transmitted cases of #Coronavirus in #Karachi  CM #Sindh @MuradAliShahPPP imposes 3 days self isolation in the province. #CoronaVirusUpdate,Punjab,sadness
2020-03-20,World wide Fund sud b established to fight against CORONA VIRUS. FOOD FOR THOUGHT,Punjab,anger
2020-03-20,Dear world ⚘Let me fight against CORONA VIRUS while sitting in Room. No body knows who I am . So pls avoid comments which hurts me . Though u all hate me   I know . But I love all of you Why I hate all of you bcus of your ignorance ilove u all ,Punjab,sadness
2020-03-20,Trump has no qualms about calling coronavirus the ‘Chinese Virus.’ That’s a dangerous attitude  experts say. https://www.washingtonpost.com/nation/2020/03/20/coronavirus-trump-chinese-virus/  Pity the president ( Trump)of a nation most committed for Human Rights indulging in coining racial bias in a poor effort to mitigate its failures,Punjab,sadness
