2020-06-21,Yes it's Glanmaek pharma products approved by India DCGI  for covid 19 treatment.,Ahmedabad,neutral
2020-06-21,During #COVID__19 outbreak in #china this cunning country hide the death'of millions proof millions of mobile contacts were missing. Now you one among #hypocritelobby @ShashiTharoor belives this faketards. Are you Indian?,Ahmedabad,neutral
2020-06-21,International Yoga Day #medical#covid #medicine#doctor #hospital#nurse #healthylifestyle#wellness ,Ahmedabad,joy
2020-06-21,Happy Father's Day! #revenuecyclemanagement #rcm #medicalbilling #medicalcoding #doctors #COVID-19 #leomorgan #revesolv #business,Ahmedabad,joy
2020-06-21,"Due to COVID-19  celebrate this ""International Day of Yoga"" at HOME. Let's balance our senses  body  soul  and mind to live healthily and live in peace. #yoga #yogaday #yogainspiration #yogaeverywhere #health #meditation #yogaaasan #InternationalYogaDay",Ahmedabad,sadness
2020-06-21,Unlesss and Untill they don’t see the ground reality will not make sense. @AmdavadAMC @AMC_Complaints Request your to instruct Pvt hospitals to accept cashless instead of mandatory cash payment for COVID treatment.@Nitinbhai_Patel @CMOGuj @MoHFW_INDIA @AmitChavdaINC #9427958594,Ahmedabad,sadness
2020-06-21,@adv_chandnishah Can you raise up the issue that Pvt hospitals aretaking forcefully cash instead of cashlesss for COVID treatment. This will save cash flow and needy will get good http://treatment.It’s milibhahat ofPvtHospital and Insurance company. @HDFCERGOHealth#9427958594,Ahmedabad,neutral
2020-06-21,Yoga is the journey of the self  through the self  to the self. Yoga at Home  Yoga with family. #भारत नें दुनियां को #योग दिया है  #चाइना नें दुनियां को #रोग दिया है। #china #india #corona #coronavirus #covid ,Ahmedabad,surprise
2020-06-21,No Kanwar Yatra This Year Due To COVID-19 Threat  Says UP ,Ahmedabad,sadness
2020-06-21,“Slow The Testing Down”: Trump’s Controversial Advice To COVID Responders ,Ahmedabad,sadness
2020-06-21,Citing Covid concerns  HC stays Rath Yatra in Ahmedabad (via: https://indianexpress.com/article/cities/ahmedabad/citing-covid-concerns-hc-stays-rath-yatra-in-ahmedabad/) High court stays Rath Yatra processions across state (via: https://timesofindia.indiatimes.com/city/ahmedabad/high-court-stays-rath-yatra-processions-across-state/articleshow/76488373.cms),Ahmedabad,anger
2020-06-21,@shailajateacher @CMOKerala @ANI @asianetnewstv @TOIIndiaNews @TimesNow @IndiaToday why this hue&amp;cry about mullapplly statement Poor guy actually want praise but if he does that his party will throw him out so he gave this -ve touch. NIPPA &amp; covid mngmnt  madam u are real queen,Ahmedabad,sadness
2020-06-21,A week back  the cases in that housing society peaked at at total of 12-13. Since then  except two  all have been discharged  ungergone home quarantine and majority are now covid-19 free. There has been no new case in the housing society in the past week. Vendetta?,Ahmedabad,sadness
2020-06-21,Mall during Malls after lockdown VS lockdown ,Ahmedabad,neutral
2020-06-21,aap Sonchiriya dekh le  zee5 par hai. Will be better to see Sushant's and others great acting then this outrage. Abhi lockdown nahi hota to sab apne kaam par aur ye drama khatam. If theres smthin fishy  police will find out. No point speculating and targeting individuals,Ahmedabad,surprise
2020-06-21,EPFO records 133 000 new enrolments in April amid Covid-19 lockdown http://dlvr.it/RZ4dkF http://bit.ly/amdgst,Ahmedabad,surprise
2020-06-21,Mizoram Extends Total Lockdown Till June 30 ,Ahmedabad,joy
2020-06-21,Lockdown pate etle party ,Ahmedabad,joy
2020-06-21,#learning of #lockdown #ekshloki #Ramayan recited by #Krishav #Rambhakt ⁦@DrKumarVishwas⁩,Ahmedabad,anger
2020-06-21,I faced same issue today with @VijaySales . They said due to lockdown their Mumbai head office server has issue and I cannot redeem my voucher #Ahmedabad . I don’t understand how servers are affected due to lockdown. #apnuamdavad,Ahmedabad,sadness
2020-06-21,Kindly go through this if you or anyone preparing for #GPSC #CBSE exams. This also clarifies status of #schoolsreopening after #lockdown. ,Ahmedabad,anger
2020-06-21,The Sahnis in Lockdown: A Short Story - NOOR ANAND CHAWLA - https://go.shr.lc/3ecTjph via @nooranand,Ahmedabad,neutral
2020-06-21,How the Lockdown helped Families Adapt &amp; Evolve? http://growingwithnemit.com/lockdown-helped-families-adapt-evolve/?unapproved=38707&amp;moderation-hash=7d98deb3d0e99252a8173fcee23beade via @growingwitnemit,Ahmedabad,joy
2020-06-21,India can take up any challenge and we have proved this during lockdown down period due to Covid 19 pandemic. We can and we will do it @Ahmedabad  India https://www.instagram.com/p/CBs0yJ1lYlU/?igshid=1uihco783yxik,Ahmedabad,anger
2020-06-21,Namaste. I'm Prahlad Bhati  a native of Daulatgarh village  Rajasthan. I've been working @iitgn's mess for the last 3 years. During the lockdown period  IITGN provided us rooms to stay inside the campus to avoid the risk of daily travelling. Read more at https://bit.ly/2NgWu3p,Ahmedabad,neutral
2020-06-21,Lockdown karo na stop public sans lena,Ahmedabad,anger
2020-06-21,Lockdown recovery,Ahmedabad,neutral
2020-06-21,How Yoga Grew to become the Most Generally Practiced Train in Coronavirus Lockdown ,Ahmedabad,joy
2020-06-21,KAHA TAK STUDY KIYA. I KNOW LOCKDOWN CHAL RAHA HAI BUT CLASS ONLINE HO RAHE HAI TO PLEASE FEES BHARKR THODA ENGLISH MAIN SUDHAR KR LO. POLITICS SE THODA AAGE NIKLO... #GADDARRAHULGANDHI,Ahmedabad,neutral
2020-06-21,93-Year-Old Woman Reunites With Family After 40 Years Amid Lockdown ,Ahmedabad,sadness
2020-06-21,@ScottMorrisonMP @KaushaliyaMP This thoughts apply for Good- make plan for return income tax deductions during lockdown/ restrictions period to all jobs employees of pvt or govt.,Ahmedabad,neutral
2020-06-21,Navgujarat Samay News Fatafat on 21st June 2020 (Afternoon Update) Follow our updates on #NavgujaratSamay #navgujaratsamayofficial #gujarati #ahmedabad #rajkot #surat #Vadodara #coronavirus #gujarat #lockdown #NewsFatafat,Ahmedabad,surprise
2020-06-21,Till now you have read stories of people walking to their homes thousands of kilometres from metro cities in lockdown. Read this to know what happens next when they reach home. A beautiful piece on the city based alongside Ganges  Bhagalpur  my hometown by @dipankarghose31,Ahmedabad,joy
2020-06-21,It is not a negative narrative Blunders are too many to have patience Demonetization GST Economy Lockdown Migrant workers China these r just few China Nepal Pakistan Maldives Lanka Bangladesh bordering nations r against us WHY soldiers martyrdom being used for votes??? SHAMEFUL,Ahmedabad,neutral
2020-06-21,Just like moon in Solar Eclipse  lockdown has come in between your marketing and target audience. So lockdown shadow is there on your target audience. Read how to overcome https://www.facebook.com/CrowdMultiplier/posts/3035041616533719 #KiritJAsani #CrowdMultiplier #socialmediastrategy #SMM,Ahmedabad,disgust
2020-06-21,@vijayrupanibjp  @amdavadamc  @mukeshias PIL 77/2020 challenge 2 lockdown constitutionality  people house arrest  heard Friday by Guj HC. Saturday  petitioner @bvishwas hsg soc is micro containment zone. Cases: 12. 10 recovered  discharged. 7 days  no new case. Govt. vendetta?,Ahmedabad,joy
2020-06-21,Make an INQUIRY that THOSE all FARMARS who installed SOLAR PLANT at their FARM for running their TUBEWELL get BILL approximately more then Rs.1 lakh in PETLAD  http://ANAND.No subsidy NO purchase of Electricity no relief of lockdown? Why? SOLVE it . ,Ahmedabad,neutral
2020-06-21,Hi. Unable to contact your Cargo officials inspite of continues attempt on phone and email. Unable to go to airport due to lockdown here in Chennai. Just tell me if pet are allowed in Chennai Ahd fly wich has a layover of 2 hrs in Delhi. If no we wait for direct flights.,Ahmedabad,neutral
2020-06-21,And partial lockdown too  cause due to eclipse many family in lockdown till 3 PM,Ahmedabad,sadness
2020-06-21,Announce Solar Eclipse for next 2 months instead of lockdown  it will keep more people inside. #SolarEclipse2020 #ChennaiLockDown,Ahmedabad,disgust
2020-06-21,दोनों की Same mentality है  Tests कम करो  ताकि #Corona डर जाय... No wonders  both countries have more #Corona case... FOOLS. #India WAS 3RD LARGEST ECONOMY...now 5TH. NOW DON'T COMPARE WITH BRAZIL... PLEASE. Jab lockdown ka Samay aaya Tab logo ko ghumne bhej rahe hai. ,Ahmedabad,sadness
2020-06-21,How many times does market run on logic? Since the day we announced lockdown  markets kept moving higher  while we felt economic impact would be huge. So I keep reasoning out of price. Otherwise every stock is highly overvalued,Ahmedabad,neutral
2020-06-21,Due to unplanned lockdown  visually disabled are facing physical and psychological problems ,Ahmedabad,sadness
2020-06-21,Just like Congress did during this lockdown. ,Ahmedabad,neutral
2020-06-21,Second wave of Corona in 81 countries including US  Israel  WHO said – Increased risk due to ending lockdown ,Ahmedabad,anger
2020-06-21,@jigisha_BJP rekhaben mali.She worked very hard even in the lockdown &amp; under the threat of corona. Altho police warn her she collected all the cheques from our society &amp; other society. Evenafter 75 days cheques are not being issued is a big question mark.,Ahmedabad,anger
2020-06-21,The hearing of the PIL challenging the constitutionality of the lockdown  which put people under house arrest  was heard on Friday. On Saturday  the housing society where the petitioner stays was declared a micro containment zone. ...1/2,Ahmedabad,anger
2020-06-21,More than 43.93 lakh people have recovered from COVID-19 globally; active count at 39.84 lakh ,Ahmedabad,neutral
2020-06-21,90% Of COVID-19 Cases Are Foreign Returnees  Mostly From India: Nepal ,Ahmedabad,disgust
2020-06-21,China's acetone prices reached a historic high this week  tripling from April  following a government decision to extend anti-dumping duties on imports and robust demand for disinfectants amid the Covid-19 pandemic..!! #Acetone,Ahmedabad,neutral
2020-06-21,Telangana Ministers Hit Back at Nadda Over Low Covid-19 Test Remarks  Allege Centre Diverted Kits Read More: https://livetechhub.com/telangana-ministers-hit-back-at-nadda-over-low-covid-19-test-remarks-allege-centre-diverted-kits/?feed_id=2578&amp;_uni...,Ahmedabad,neutral
2020-06-21,What's your favorite #new word related to #COVID19 (or #SARSCoV2) that got added to your #vocabulary in the last 100+days? Feel free to comment and add options.,Ahmedabad,joy
2020-06-21,0 to 1 Lakh in 110 days 1 Lakh to 2 Lakh in 15 days 2 Lakh to 3 Lakh in 11 days 3 Lakh to 4 Lakh in 9 days BJP Govt has failed at all levels to control #Covid19 growth rate in India. If this rate continues  we will touch 5 lakh cases by June end &amp; 1 million by end of July !,Ahmedabad,neutral
2020-06-21,To remind you the real source of the COVID19. #ChinaLiedAndPeopleDied,Ahmedabad,neutral
2020-06-21,Must watch#samdish#schoopwhoop unscripted#outside hospital covid19#Delhi#stay home#stay safe ,Ahmedabad,sadness
2020-06-21,57 Girls At Government-Run Home In UP’s Kanpur Test Positive For COVID-19 ,Ahmedabad,sadness
2020-06-21,@DrRPNishank sir why are you not understanding our problems.This area where i am stay in also quarantine. We don't follow timetable because situation of covid19. I think you you understand @DG_NTA #neet2020postpone,Ahmedabad,neutral
2020-06-21,EPFO records 133 000 new enrolments in April amid Covid-19 lockdown http://dlvr.it/RZ4dkF http://bit.ly/amdgst,Ahmedabad,surprise
2020-06-21,Railway Girls are ‘Steering’ Mumbai Trains for Important Workers amid Covid-19 ,Ahmedabad,neutral
2020-06-21,Irrespective to testing  pregnant lady will deliver a baby at the right time. Same way if 70% of us suffer from Covid  then something wrong should happened earlier  Why it is not happened  so either covid 19 is not a critical ill or Gov is correct.,Ahmedabad,sadness
2020-06-21,After Ladakh problem the it seems #covid-19 news are side tracked.,Ahmedabad,sadness
2020-06-21,This is comes for covid19 patient now restricted use ,Ahmedabad,joy
2020-06-21,#GujaratCoronaUpdate #COVID19 Dashboard: 580 New cases 655 Discharged 25 Deaths reported Total 324874 Tests carried out so far 6296 Active Cases  59 on ventilator @PMOIndia @MoHFW_INDIA @mygovindia @PIB_India @CMOGuj @vijayrupanibjp @Nitinbhai_Patel @pkumarias @JpShivahare,Ahmedabad,sadness
2020-06-21,Nowdays  journalists are also not interested to cover Covid19,Ahmedabad,neutral
2020-06-21,Glenmark was the first company in India to receive the drug regulator's approval to conduct phase-3 clinical trial of Favipiravir antiviral tablets for Covid-19 patients ,Ahmedabad,neutral
2020-06-21,Agree @SoravJain. #DigitalMarketing playing an important role to spread the awareness and making users more responsible. #Covid19,Ahmedabad,neutral
2020-06-21,Bangladesh resumes international flights after 3 months of COVID-19 halt ,Ahmedabad,surprise
2020-06-21,Very interesting news Glenmark has received approval to manufacture and marketing #favipiravir in india for mild to moderate #covid-19 This drugs coronavirus 103 rupees per tablet,Ahmedabad,surprise
2020-06-21,Cipla gets regulator's nod to make generic verison of Gilead's COVID-19 drug remdesivir. BIG RELIEF !! #Remdesivir #CoronaVirusUpdates #Covid_19,Ahmedabad,neutral
2020-06-21,Hetero Labs gets DCGI nod to make Gilead's COVID-19 drug #CoronaVirusUpdates #COVID #CoronaUpdates #India,Ahmedabad,anger
2020-06-21,A man referred by a government hospital to Covid-19 special hospital on May 30 was found lying dead in the general mortuary  20 days later  on June 19 ,Ahmedabad,disgust
2020-06-21,COVID-19 recovery rate improves to 54.13% https://www.thestatesman.com/india/covid-19-recovery-rate-improves-54-13-1502901973.html via NaMo App,Ahmedabad,neutral
2020-06-21,COVID-19 recovery rate improves to 54.13% https://www.thestatesman.com/india/covid-19-recovery-rate-improves-54-13-1502901973.html via NaMo App,Ahmedabad,neutral
2020-06-21,COVID-19 recovery rate improves to 54.13% https://www.thestatesman.com/india/covid-19-recovery-rate-improves-54-13-1502901973.html via NaMo App,Ahmedabad,neutral
2020-06-21,COVID-19 recovery rate improves to 54.13% via @NamoApp,Ahmedabad,neutral
2020-06-21,COVID-19 recovery rate improves to 54.13% via @NamoApp https://www.thestatesman.com/india/covid-19-recovery-rate-improves-54-13-1502901973.html,Ahmedabad,neutral
2020-06-21,India can take up any challenge and we have proved this during lockdown down period due to Covid 19 pandemic. We can and we will do it @Ahmedabad  India https://www.instagram.com/p/CBs0yJ1lYlU/?igshid=1uihco783yxik,Ahmedabad,anger
2020-06-21,#BreakingNews #Gujarat records its highest #Covid_19 single-day tally with 580 cases and 25 deaths  bringing its numbers to 27 317 cases and 1 664 deaths. With 655 patients discharged  the total number of recoveries have touched 19 357. #Ahmedabad #Surat #Vadodara #COVID19India,Ahmedabad,sadness
2020-06-21,This cartoon artist deserves to be congratulated. corona is wishing happy fathers day to its dad.@XiJingpingReal @PDChina @realDonaldTrump @ScottMorrisonMP @BorisJohnson @AskAnshul @KapilMishra_IND @TajinderBagga #fatherday2020 #COVID19 ,Ahmedabad,joy
2020-06-21,#COVID19 : A total of 2.23 lakh persons are under #quarantine in #Gujarat out of which 2.19 lakh are under #homequarantine #GujaratCoronaUpdate,Ahmedabad,surprise
2020-06-21,#COVID19 : Out of 27 317 total Covid-19 positive patients in #Gujarat  6296 (23%) are active  19 357 (70.9%) are discharged and 1664 (6.1%) are dead #GujaratCoronaUpdate,Ahmedabad,joy
2020-06-21,#COVID19 : #Gujarat carried out 5460 tests in 24 hours  taking the total to 3.24 lakh #CovidTesting #GujaratCoronaUpdate,Ahmedabad,sadness
2020-06-21,#COVID19 : A total of 655 patients got discharged in #Gujarat in 24 hours  taking the total to 19 357. The discharges included 427 from #Ahmedabad  131 from #Surat  40 from #Vadodara and 15 from #Gandhinagar #GujaratCoronaUpdate,Ahmedabad,joy
2020-06-21,#COVID19 : #Gujarat recorded deaths of 25 Covid-19 positive patients  taking the toll to 1664. The deaths included 20 from #Ahmedabad  three from #Surat and one each from #Aravalli and #ChhotaUdepur #GujaratCoronaUpdate,Ahmedabad,surprise
2020-06-21,#COVID19 : #Gujarat hits a new high as 580 Covid-19 positive patients recorded in 24 hours ending 5 pm on Sunday. The state tally is now 27 317. #Surat recorded its highest daily case at 176 as #Ahmedabad recorded 276  which is the lowest in 23 days #GujaratCoronaUpdate,Ahmedabad,neutral
2020-06-21,Megastar aur s.k what a joke . This is greatest joke of the year in 2020. This joke is also remembered along with covid 19 .Megastar is only 1 amitabh bacchan sir.,Ahmedabad,joy
2020-06-21,Nita Ambani Named Amongst ‘Prime Philanthropists of 2020’ by US Journal for COVID-19 Efforts ,Ahmedabad,surprise
2020-06-21,Just In: Gujarat sees steepest rise in COVID-19 infection with 580 new cases and 25 deaths  bringing its numbers to 27317 cases and 1664 deaths. With 655 discharges  total patients discharged so far are 19357 @the_hindu @vrsrini,Ahmedabad,sadness
2020-06-21,Hyderabad-Based Hetero Gets Regulatory Nod To Make Gilead’s COVID-19 Drug ,Ahmedabad,anger
2020-06-21,It's high time we all come together and raise our voice to fight against #covidstigma Watch @ArvindVegda addressing this alarmingly issue of stigma attached with #COVID19 and join #VoicesAgainstCovidStigma @ElixirIndiaOrg @UNICEFIndia @CCCRPDPU @USAIDAsia,Ahmedabad,joy
2020-06-21,#Ahmedabad among cities warned by @IndianCERT MaliciousActors claiming to have 2 mn individual/citizen emailIDs - planning to send an email subline: free Covid-19 testing for all resi in #Delhi #Mumbai #Hyderabad #Chennai #Amdavad in a bid to coax users to disclose PersonalInfo,Ahmedabad,neutral
2020-06-21,After Gujarat High Court Stays Rathyatra concerning spread of #COVID19  devotees on Sunday are chanting slogan outside Jaggannath Mandir in #Ahmedabad. Devotees are chanting 'Let we be at homes but Rathyatra be carried out'. Let our Lord travel the City on Asadhi Bij #Corona,Ahmedabad,neutral
2020-06-21,COVID-19 Crisis: Rs 65 454-Crore Assistance Given To Over 42 Crore People Under Garib Kalyan Package ,Ahmedabad,anger
2020-06-21,Florida’s Covid-19 surge reveals the state’s reopening plan will not be working ,Ahmedabad,neutral
2020-06-21,SC Issues Notice To RBI & Centre In Plea Seeking Relief Measures For Real Estate Sector Amid Covid-19 Pandemic Situation ,Ahmedabad,neutral
2020-06-21,Is febiflu from glenmark pharmaceutical effective on covid-19? Why there is no official announcement from the government? Is Medicine under clinical trail of phase 3? Looking forward for true answer. @narendramodi @PIBFactCheck @ANI @airnewsalerts @ABPNews @News18Guj @TOIWorld,Ahmedabad,sadness
2020-06-21,Enough of Covid 19...temples are given permission to open.. Do temples beat stress &amp; discouragement. Gyms help to stay in shape &amp; keeps disappointment away. Is Government sleeping.,Ahmedabad,sadness
2020-06-21,MP BJP MLA  His Wife Tests Covid-19 Positive Hours after RS Polls Voting Read More: https://livetechhub.com/mp-bjp-mla-his-wife-tests-covid-19-positive-hours-after-rs-polls-voting/?feed_id=2565&amp;_unique_id=5eef3ad3b62e1 #coronavirus #covid-19 #madh...,Ahmedabad,neutral
2020-06-21,Inspiring words said by @ArvindVegda Watch him sharing his opinions on COVID-19 recovered patients. Lets pledge to join #VoicesAgainstCovidStigma. @ElixirIndiaOrg @CCCRPDPU @USAIDAsia @UNICEFIndia,Ahmedabad,joy
2020-06-21,1 More COVID-19 Related Death In CISF; 18th Among Paramilitary Forces ,Ahmedabad,neutral
2020-06-21,Facing Health Issues Due to 'Torture' by Congress: Pragya Thakur Read More: https://livetechhub.com/facing-health-issues-due-to-torture-by-congress-pragya-thakur/?feed_id=2563&amp;_unique_id=5eef33ca2d0a9 #bjp #congress #coronavirus #covid-19 #interna...,Ahmedabad,sadness
2020-06-21,𝗛𝗔𝗣𝗣𝗬 𝗙𝗔𝗧𝗛𝗘𝗥’𝗦 𝗗𝗔𝗬 #HappyFathersDay #Sanitize #Dispenser #SanitisationCabinate #Currency #AatmaNirbharBharat #VocalForLocal #IndiaFightsCorona #StaySafe #SocialDistancing #CoronaVirus #Covid19 #Corona #Trufrost #Butler https://nandequipment.com/,Ahmedabad,neutral
2020-06-21,How Humanity Unleashed a Flood of New Diseases https://www.nytimes.com/2020/06/17/magazine/animal-disease-covid.html?smid=tw-share read it to understand the origin of human diseases from wildlife - wake up call to change or be changed @IndSciCOVID #covid19 @CSIR_IND @BIRAC_2012,Ahmedabad,disgust
2020-06-21,With the highest single- day increase of 15 413 #COVID19 cases reported in the last 24 hours  India's coronavirus count stood at 4 10 461 on Sunday ,Ahmedabad,joy
2020-06-21,Saath is working on identifying and and connecting with those who have been heavily affected by this sudden economic crisis due to Covid-19. In these trying times we request you to come forward &amp; contribute in building their businesses Again. To Donate: https://www.ketto.org/fundraiser/reboot-livelihood-of-nano-micro-entrepreneur,Ahmedabad,anger
2020-06-21,Airbus Extends Furloughs For 5 300 Employees To Tackle COVID-19 Fallout ,Ahmedabad,neutral
2020-06-21,Recovery rate of coronavirus COVID-19 cases in India climbs to 55.49%  says Centre https://www.newhub2012.com/recovery-rate-of-coronavirus-covid-19-cases-in-india-climbs-to-55-49-says-centre/,Ahmedabad,neutral
2020-06-21,India reports highest single-day spike with 15 413 new COVID-19 cases; total tally crosses 4 lakh https://www.newhub2012.com/india-reports-highest-single-day-spike-with-15413-new-covid-19-cases-total-tally-crosses-4-lakh/,Ahmedabad,joy
2020-06-21,ONGC looking at optimising capex after COVID-19 impacts project execution https://www.newhub2012.com/ongc-looking-at-optimising-capex-after-covid-19-impacts-project-execution/,Ahmedabad,surprise
2020-06-21,ICYMI: 'COVID-19 exposure notifications / logging' now on your Android &amp; Apple Phones - Settings. Looks exactly like what 'Aarogya Setu App' is trying - except the fact that Google &amp; Apple is not forcing it upon us. https://forbes.com/sites/daveywinder/2020/06/20/have-apple-and-google-suddenly-uploaded-a-covid-19-tracking-app-to-your-phone-android-iphone-exposure-notification-contact-tracing/ via @forbes,Ahmedabad,neutral
2020-06-21,@DrSJaishankar I am Indian Citizen currently in India . I was Studying In Canada and I came to India on March 18 in my break. I was not able to go back due to COVID 19. I want to go back to Canada as my Study Permit is expiring in August so I need to reach there to file extension,Ahmedabad,neutral
2020-06-21,Why did @sambitswaraj get #COVID__19 was he been always busy licking the spit instead of sparing few mint for #yoga,Ahmedabad,anger
2020-06-21,Let us breathe in a bright future. International Yoga Day Wishes #YogaForAll #Internationalyogaday2020 #greentechresidency #amenities #propertyinvestment #dholeraplots #SustainableDevelopment #Gujarat #DMICDC #DSIR #DMIC #worldclass #infrastructure at #Dholera #COVID19 ,Ahmedabad,disgust
2020-06-21,#IndiaFightsCorona India is putting up a spirited fight against COVID-19 . Read more on https://bit.ly/2MVzG95 via NaMo App,Ahmedabad,neutral
2020-06-21,#IndiaFightsCorona Find out more on how India under PM Modi’s leadership has tackled COVID-19 https://bit.ly/2MVzG95 via NaMo App,Ahmedabad,neutral
2020-06-21,Happy Father's day ... Best thing I seen today #Corona #Covid19 ,Ahmedabad,joy
2020-06-21,US President Donald Trump urges slowdown in COVID-19 testing  calling it a ‘double-edged sword’ ,Ahmedabad,neutral
2020-06-21,#Yoga is not just about exercise  it is a way to discover the sense of oneness with yourself  the world and nature. During the current situation of #COVID19  yoga is one of the good ways to boost one’s immunity and #stayhealthy. #YogaDay #Internationalyogaday2020 #YogaDay2020,Ahmedabad,sadness
2020-06-21,My problem not solved  because your staff not working because of COVID-19 Please give alternative solution,Ahmedabad,sadness
2020-06-21,Covid-19 Situation a Blessing in Disguise  Says Union Minister Nitin Gadkari Read More: https://livetechhub.com/covid-19-situation-a-blessing-in-disguise-says-union-minister-nitin-gadkari/?feed_id=2551&amp;_unique_id=5eef0c5260f5b #bjp #coronavirus #c...,Ahmedabad,neutral
2020-06-21,Covid19 wishing his father... ,Ahmedabad,sadness
2020-06-21,#UpcomingWebinarsMiceIdeas 1. Meeting the unmet need in CLL during Covid-19 era (The triumph of Ibrutinib) Tuesday 23rd June 2020 Time: 6 - 8 pm 2. Optimal treatment strategies in the management of CLL Saturday  27th June 2020 Ti…https://lnkd.in/eRSaaEX https://lnkd.in/eEBbW4m,Ahmedabad,neutral
2020-06-21,Microsoft Teams Sees Significant Usage Growth in India During Covid-19 Crisis Read More: https://livetechhub.com/microsoft-teams-sees-significant-usage-growth-in-india-during-covid-19-crisis/?feed_id=2548&amp;_unique_id=5eef048516d6f #coronavirus #cor...,Ahmedabad,anger
2020-06-21,Appointed by your covid-19 worker in the district hospital  how many days to extend those working people..??@HFWOdisha,Ahmedabad,sadness
2020-06-21,@DHFWKA @DIPR_COVID19 Hello  today is my last day of home quarantine. I called 14410 to report it. They asked my health etc and with everything normal they have told me I can resume normal life from tomorrow. Thanks for help so far and take care.,Ahmedabad,sadness
2020-06-21,Protect yourself from disease and worry. Yoga is the gateway to the energy hidden within. On International Yoga Day  Let's celebrate Health and Wellness in the comfort of our homes. #InternationalYogaDay2020 #yogaday #21june #InternationalYogaDay #stayhome #staysafe #covid19 ,Ahmedabad,sadness
