2020-03-14,@IndiaToday can a person get reinfected after getting cured from COVID 19 or immunity develops?,Delhi,neutral
2020-03-14,@dmgbnagar @CeoNoida @noida_authority we appreciate all the efforts taken to fight against COVID-19. Please ban public spitting in #Noida to avoid spreading through droplet infection.,Delhi,sadness
2020-03-14,This Daily Nation news article brings to our notice some drugs and therapies that have been recommended for COVID-19 treatment of the new coronavirus  and stem cell therapies comprise a major part of the regime. #coronavirusoutbreak #coronavirusindia,Delhi,sadness
2020-03-14,Then we should give order to AR-Making companies for COVID-19 test kit.,Delhi,joy
2020-03-14,Very Funny. #CoronaVirusUpdates #COVID #CoronaOutbreak #COVIDー19,Delhi,joy
2020-03-14,#coronavirus #covid19 Straight from #WHO Director General Dr Tedros Adhanom Ghebreyesus @DrTedros The #SafeHands challenge to protect ourselves from #Covid Share tour #HandWashingVideo,Delhi,surprise
2020-03-14,WHO declaration of COVID-19 as pandemic came too late ! Had it been declared pandemic earlier the world would have been free of the disease at least one month earlier &amp; billion of dollars of economic loss could have been avoided !!,Delhi,surprise
2020-03-14,Protect yourself & Protect others !! COVID-19 will go away !!,Delhi,anger
2020-03-14,Coming together for common good! 15 March  1700 IST PM @narendramodi will lead India at the video conference of all SAARC member countries  to chalk out a strong common strategy to fight COVID-19 in the region. ,Delhi,neutral
2020-03-14,Court Holiday's due to COVID-19 #CoronaVirusUpdates #Corona #CoronavirusOutbreak #coronavirus #coronaUK #CoronavirusReachesDelhi #coronavirusindia,Delhi,sadness
2020-03-14,The people who on a drop of the hat abuse Prime Minister Narendra Modi must show some spine to stand & put their hands together for the tremendous  excellent  highly efficient & effective proactive & treatment efforts of the Shri Modi in tackling COVID-19 situation.,Delhi,disgust
2020-03-14,Uttarakhand Govt ordered the closure of all colleges in the state till March 31 as a precautionary measure to prevent the spread of coronavirus disease (Covid-19). Also Govt declares Coronavirus as epidemic in the state. @suparna_r,Delhi,surprise
2020-03-14, Coronavirus(COVID -19) Coronavirus disease (COVID-19) is an infectious disease caused by a new virus that had not been previously identified in humans. Guidelines for 14 Day Home Quarantine ,Delhi,sadness
2020-03-14,Thanks to this covid  am getting to read so many opinions from so many intelligent people from so many diverse backgrounds and contexts  all thinking about the same problem at the same time.,Delhi,anger
2020-03-14,Original fear for @BCCI because thay said no crowd allowed due to #coronavirusindia Now what they will do. #COVID ,Delhi,anger
2020-03-14,Please don't give us excuses as I do understand the COVID 19 circumstances  but not replying for a customer query or grievances for 24 hours is not a justification.,Delhi,anger
2020-03-14,India in last 2 months lanched more than 5 evacuation missions to China  Japan  Iran & due to evacuate Indian Citizens from Italy. It evacauted 7 Maldives citizens in 2nd mission to China  while in 3rd mission it evacauted many Bangladeshis. Word from one Quarantine camp. #COVID ,Delhi,neutral
2020-03-14,Be safe! Follow the 7 simple basic precautions! #CoronaVirusUpdates #CoronaOutbreak #CoronavirusPandemic #COVID19india #coronavirusindia #COVID2019 #Corona #Coronaindia #COVID #healthcare #HealthForAll #health #handwashing @MoHFW_INDIA @WHO #Goa,Delhi,neutral
2020-03-14,They are generating a new virus #COVID-20,Delhi,surprise
2020-03-14,They forget that they are crossing their limits. With the world actually coming at a stop thanks to the COVID 19  companies are facing the heat. Salaries are not credited and top of it a stupid female customer care executive starts sermon on saving.,Delhi,anger
2020-03-14,Hating COVID-19 on a personal level now. #coronavirusindia #COVID #notthevacationiwant #pandemic,Delhi,anger
2020-03-14,@cbseindia29 @HRDMinistry Please postpone cbse answer sheet checking rather than making teachers them prone to get infected or spread infection in light of COVID 19.,Delhi,anger
2020-03-14,#COVID19 Helpline numbers #cronavirus #CoronaOutbreak #Corona #COVID #CoronavirusPandemic @UNESCO @WHO @mygovindia @MoHFW_INDIA,Delhi,neutral
2020-03-14,"Privacy& STATE:Had privacy rights bn of supra-STATE nature  STATE WD NEVR B BORN & intrnet companis--Face Book/Twitter/Google wd not b called to delete socially harmful postngs. Curent pndemic COVID-19 has rlevnce for PRIVACY. many ""contactees"" undr obsrvation rfuse to b qstioned",Delhi,anger
2020-03-14,#Rains  heavy hail storm in Delhi not a good sign for wheat crops  economy or even containing spread of Covid-19 #pandemic,Delhi,joy
2020-03-14,Unpredictable weather #ClimateChange #ClimateEmergency #Rain_Drops #rainyday #GodMorningSaturday #SaturdayMotivation #WorkFromHome #COVID ,Delhi,sadness
2020-03-14,#Delhisnowfall #CoronaVirusUpdates #COVID #LaalSinghChaddha #Wuhan #KashmirIsPakistan #CoronaOutbreak #coronavirus #coronavirus #sanjaymanjrekar Delhi people playing with the snow,Delhi,neutral
2020-03-14,#CoronaVirusUpdates #COVID #LaalSinghChaddha #Wuhan #KashmirIsPakistan #CoronaOutbreak #GodMorningSaturday #CoronaOutbreak #sanjaymanjrekar #AamirKhan #Petrol #Diesel #delhisnowfall Delhi streets covered with ice,Delhi,neutral
2020-03-14,We did some climate street arts at Delhi University. Strikers joined despite the #Covid_19 panics #FridaysForFuture #ClimateAction @FFFIndia @Fridays4future @parents4future @Youth4ClimateIn @GretaThunberg,Delhi,fear
2020-03-14,Cartoon made by my niece on #COVID #COVIDー19 #COVID2019 Sheer #brilliance @AdvancedMaushi @Ra_Bies @GabbbarSingh @HaramiParindey @BhayanakPuppy,Delhi,sadness
2020-03-14,india and transfer of covid can be stopped .Need to work towards safety of.our people,Delhi,anger
2020-03-14,Actually Spanish flu was spread through SOLIDER movement during ww1 and coronavirus is spreading through normal masses... Spanish flu was outbreak at farmhouse of USA and Covid-19(coronavirus) china ...something is strategic sir ,Delhi,neutral
2020-03-14,Italians are in lockdown  but their spirits (and music) is soaring to reach our hearts all over the world https://www.facebook.com/746947198/posts/10157816782722199/?app=fbl #Covid_19 #Italy #music #Solidarity #spirit #Unity #SocialDistancingNow #StaySafe,Delhi,neutral
2020-03-14,I appeal to all national & international travellers to not dodge screening & truthfully declare their travel history & stay in their own country for a month at least this way you will not only protect yourself but also fellow humans all over the world from COVID-19.,Delhi,sadness
2020-03-14,Appreciable step in #CoronavirusPandemic for prevention of #COVID. Operators of public transport vehicles can follow it &amp; can disinfect their vehicles needfully. Preventive measures are better to stop spread of #COVID. via @HittsVora @Olacabs @Uber @MeruCabs @kgahlot @GHS @WHO – at AIIMS,Delhi,anger
2020-03-14,COVID19 MYTH BUSTERS - Public Awareness Initiative by 𝒁𝒊𝒃𝒂𝑪𝒖𝒃𝒆 𝑻𝒆𝒄𝒉𝒏𝒐𝒍𝒐𝒈𝒊𝒆𝒔 . . . . #COVID19 #CoronaVirus #WHO #CoronaAlert #CoronaPrevention #COVID_19 #2019nCOV #HelpUsToHelpYou #QuarantineAndChill #MythBusters #Myth #Fact #ZibaCubeInitiative #PublicAwareness,Delhi,anger
2020-03-14,Jo weekend hectic (guests arriving at home) and tension (due to increasing numbers of covid-19 cases   being a hospital staff) wo aapke @mohituraina likes ne bahut light aur Khushnuma bana diya have a happy and safe weekend ,Delhi,joy
2020-03-14,Everyone please stay safe and follow the proper guidelines if you're having #cough  headache or respiratory problems #COVID2019 #COVID #CoronaOutbreak #CoronaVirusUpdates #coronavirusindia #CoronavirusPandemic,Delhi,sadness
2020-03-14,@EaseMyTrip Need to reschedule my domestic flights due to COVID - 19 but your Customer Care numbers are unavailable. How do we go about with this?,Delhi,joy
2020-03-14,Dr Semmelweis theory of“Hand Washing”was not accepted in 1846 by then scientific community which was proven true once Germ Theory was given by Pasteur & lister Today hand washing is key to stop disease transmission #Covid-19 #Tribute #FlattenTheCurve,Delhi,disgust
2020-03-14,Really surprised that at the ENT section of Sir Ganaga Ram Hospital  there is no sanitizer for public usage. Considering the importance this department has because of Covid-19  this should he mandatory. #sgrhindia #COVID19india #Manishsisodia #ArvindKejriwal #republictv – at Sir Gangaram Hospital | सर गंगाराम अस्पताल,Delhi,surprise
2020-03-14,"she travelled by air  there is a high chance that passengers sitting near her in two rows back  front and side  might also be infected with Covid-19.” https://m.timesofindia.com/city/agra/covid-19-techies-wife-who-defied-quarantine-flew-to-delhi-took-train-to-reach-agra-tests-positive/articleshow/74618637.cms #COVID19india,Delhi,joy
2020-03-14,Please keep these #ICMR approved hospital names handy for Covid-19 tests! #Coronavirus #StaySafeIndia #IndianCouncilOfMedicalResearch #HelpIndiaStopCorona,Delhi,joy
2020-03-14,LIC - Lost in #CoronaOutbreak - Lost in #CoronaOutbreak - Lost in #COVID - Lost in #coronapocalypse #BanEVM,Delhi,sadness
2020-03-14,You can break the chain of infection! #COVID. This is how maintaining social distancing can protect you &amp; others from getting infection. Maintain at least 1-metre (3-feet) distance between yourself &amp; anyone who is symptomatic. @WHO @DrTedros @WHOSEARO @MoHFW_INDIA @ItalyinIndia – at AIIMS,Delhi,surprise
2020-03-14,. #COVID @who @BBCWorld @CNN @times. Best &amp; most effective #Quarantine in d world by @Jacinda PM of @newzealand. 100% populations for 2 weeks. But it’s possible only in a small country with less population.,Delhi,joy
2020-03-14,Can anything be done by #AAP? @ArvindKejriwal @msisodia Can #DelhiGovt supply masks on nominal rate for everyone? #CoronaOutbreak #CoronaVirusUpdates #coronavirusinindia #coronavirusindelhi #COVID19india #Covid_19 #Covid_19DDelhi,Delhi,neutral
2020-03-14,Fear is the Greatest Illusion. Take precautions to fight Covid-19 without fear till proper medicine explored. Lead healthy life with proper precautions ,Delhi,joy
2020-03-14,COVID-19 forcing people to stay home. Imagining what happened in #Kashmir. BTW  we can still tweet about it.,Delhi,neutral
2020-03-14,A community celebration in the midst of #SocialDistancing #COVID #indomitablespirit,Delhi,neutral
2020-03-14,. #COVID @BBCWorld @CNN @times @WHO @FitnessMagazine Thirld world countries r better prepared to deal with #CoronavirusPandemic as they r always dealing with some or the other infective epidemics all d time.,Delhi,joy
2020-03-14,. #Covid_19 @bbc @cnni @china has sent medical advisers  help  &amp; medicine to @Italy as they hv become experts in dealing with this menace. Pl help Iran &amp; Spain also. #CoronaVirusitaly,Delhi,joy
2020-03-14,#Italy get hits worst by #CoronaOutbreak 250 deaths by #corona #Covid_19 #CoronaVirusUpdates #CoronavirusPandemic #coronavirusinindia #coronapocalypse #CoronaVirusUpdate,Delhi,surprise
2020-03-14,@narendramodi @AmitShah @Singh26Urmila @Payal_Rohatgi @HittsVora @swati_gs @dharmicverangna @nagma_morarji God has unique ways.NaMo has not touched Shaheen Bagh. But Covid will not spare. Now besides Biryani  Allah delivered COVID also. Why not go to Pakistan IK is more competent,Delhi,sadness
2020-03-14,@narendramodi @PMOIndia @WHO @drharshvardhan @msisodia @ArvindKejriwal @Google @Accenture @sundarpichai @aajtak @ZeeNews @ABPNews Google says : one COVID-19 suspect in the building and you can get approval for work from home."" LOL @sundarpichai get approval and die...",Delhi,sadness
2020-03-14,SAARC nation's needs proactive measures to control covid-19 pendamic . Else it's going to be worst ever in the history of humanity. ,Delhi,anger
2020-03-14,During Corona (DC) As Foolish we Indians are.. Running away  when we should be isolated . N organising #GauMutra Party #CoronaOutbreak #CoronaVirusUpdates #coronavirusinindia #COVID19india #Covid_19,Delhi,joy
2020-03-14,Dear Sir @ipsnaithani @dm_ghaziabad as WHO has declared COVID-19 as a pandemic   we request you to order for shut down of cinema halls   colleges and schools till 31st march in ghaziabad for precaution @Gen_VKSingh @AtulGargBJP @ajitpaltyagi01 @sunilsharma_bjp @nkgurjar4bjp,Delhi,anger
2020-03-14,While the rest of the world & their gurdwaras encouraging #SocialDistancingNow our local gurdwaras continue gatherings; request @DSGMCofficial @mssirsa to give an advisory in view of #PublicHealth; Let #gurdwaras lead this decision for other religious shrines...!!! #Covid_19,Delhi,anger
2020-03-14,A very educational infosheet from ICMR on COVID-19. At this time India’s positivity rate is 1.2% but can be higher once community testing begins. @MoHFW_INDIA @ICMRDELHI @ProfBhargava @GHS @BMGFIndia @trevormundel @ChrisJElias @anayyar1 @AnantBhan @neerajPATH @DBTIndia @WHOSEARO,Delhi,neutral
2020-03-14,@AmericanExpress &amp; all #MNC’s in #India please allow all your employees to work from home till next 60 days so that they &amp; their colleagues can stay safe from spreading of #CoronaVirus #Covid_19,Delhi,neutral
2020-03-14,This the time when government needs to take every step very carefully to limit the spread of #Covid-19  under the scientific guidance of researchers and epidemiologists #FlattenTheCurve @MoHFW_INDIA @narendramodi @PMOIndia @drharshvardhan @DrHVoffice @NCDCgov @Director_NCDC @WHO,Delhi,neutral
2020-03-14,@borzoucan Can you plz share the deaths due to Covid 19 in Britain. ,Delhi,sadness
2020-03-14,Do's and Dont's can help in #Covid_19 #CoronaOutbreak – at Delhi Gurgaon Border MG Road,Delhi,anger
2020-03-14,There is no announcement from WHO regarding any appreciation to Pakistan for the COVID you are spreading a false and hypothetical image with us which has no identification kindly dont do such type of suspicious activity to encourage Pakistan. #shame #COVID2019 #CoronaAlert,Delhi,anger
2020-03-14,I proud our doctor's and I hope they are found the solution of covid-19,Delhi,joy
2020-03-14,No I'm not friendly as like you ,Delhi,joy
2020-03-14,.@BeCureFit amidst the current state of affairs (COVID-19 outbreak) and when most of the states are shutting down gyms  request you to take strict actions too and pause in centre membership for the time being and only stick to home workouts. #coronavirusindia #COVID19india,Delhi,anger
2020-03-14,Lord Krishna should save a Pope  Rome and Itali from Covid-19 disasters. @republic,Delhi,neutral
2020-03-14,@AamAadmiParty @ArvindKejriwal Sir  school and colleges are closed. What about people going to Noida and Gurgram for jobs.( First few cases of COVID were found in Noida and Gurugram only). I want to ask the logic behind closing school and colleges but not offices.,Delhi,anger
2020-03-14,India is in stage 2 of 4 stages of #Covid-19 pandemic. Quarantine  contact tracing  cancelling mass gathering  awareness and preparedness are key for containment of virus @CDCgov @CDCGlobal @DrNancyM_CDC @MoHFW_INDIA @WHO @DrTedros @icmr_nie @DrTomFrieden @LovingVaccines,Delhi,anger
2020-03-14,Total number of confirmed #COVID cases across India : 83 ,Delhi,sadness
2020-03-14,This is a very bad move   global oil prices are rock bottom  govt should transfer benefit   already businesses are hit by Covid . This is very wrong timing to hike ,Delhi,neutral
2020-03-14,Our nation is under siege by Covid-19. This isn’t time for narratives that divide Public and Private healthcare. Words must be used to weave them both together into a united front that keeps the nation safe.@Indianmarketeer @RemaNagarajan,Delhi,neutral
2020-03-14,‘Intentional murder’: Careless COVID-19 spreaders in Italy could face homicide charges ,Delhi,disgust
2020-03-14,Will Covid-19 lead to no attacks on women??!!! Wear a mask and keep praying hands away....,Delhi,sadness
2020-03-14,Trust me there shall be no scarcity of this kind of #Masks in #India n in #world to takle #CoronaOutbreak . Don't push panic button. Pl. We are safe....... #GoodMorning #COVID2019 #HeartbreakWeather #Italy #COVID #NationalEmergency #CricketNation,Delhi,anger
2020-03-14,Our planet is battling COVID-19 Novel Coronavirus. At various levels  governments and people are trying their best to combat it. South Asia  which is home to a significant number of the global population should leave no stone unturned to ensure our people are healthy. ,Delhi,neutral
2020-03-14,I strongly urge the Administration to immediately initiate steps to STOP all coaching centers Small or Big   or private tution in small groups across Delhi NCR   to stop COVID-19 among our youths.,Delhi,neutral
2020-03-14,#COVID in #india is showing pattern of propagated #outbreak where peaks in the #graphics will be spaced incubation period apart..#patients will emerge more if the #incubation #period is ending this #week. #publichealth measures have to scaled up now,Delhi,neutral
2020-03-14,Almost all companies  school  univ  IIT's are shut down due to precautionary measures for COVID-19  still this company is open  we all feel unsafe  is money is everything for this company???,Delhi,anger
2020-03-14,Covid-19 : It's first stoppage westward was Iran ;2nd stpage Italy ; 3rd Spain ; 4rh USA. A smaller brigade of the virus INVADED Korean pnsula/Japanŕ/P'pines/Malaysia/S'pore. India got it from wstrn brigade of the virus. But we lack the lock-down resistant organisation like China,Delhi,neutral
2020-03-14,The power of life: Wuhan residents find grass growing out of their cars after almost two months in lockdown due to #CoronavirusOutbreak Chinese official media @CGTNOfficial reports,Delhi,anger
2020-03-14,Need to stop scheduling tweets sir. The first two countries are in a health crisis and under lockdown as on date.,Delhi,anger
2020-03-14,Coronavirus: Spain expected to announce lockdown #Coronavirus https://twitter.com/i/events/1219057585707315201 #spain #CoronaOutbreak #covid19 @coronaviruscare @corona #coronaVirus,Delhi,disgust
2020-03-14,Hello #World! How's the Josh? We're floating in uncertainty with restrictions lockdown &amp; a falling eco  amidst #COVID19 fear. #Kashmir was under a complete comms blackout for 7 months &amp; has been occupied more than 7 decades. Can we now feel their plight &amp; demand a #FreeKashmir?,Delhi,fear
2020-03-14,JUST IN: Spanish government will put the country under lockdown - local media,Delhi,neutral
2020-03-14,So much news buzzing since the #CoronaOutbreak  but while at it make sure you go out  see the open skies  buzzing food stalls  and breathe. Once lockdown happens  we’re all stranded on this app,Delhi,neutral
2020-03-14,India should proactively learn from China. China was able to contain the virus only by making huge sacrifices. Hubei province was under complete lockdown: no public gathering  trains/metros  airports  shopping malls all deserted  factories  buisnesses shut  banned entry/exit...,Delhi,anger
2020-03-14,Exactly  by lock down we will kill our economy  libbies will find something else...!!!,Delhi,surprise
2020-03-14,Entire world on lockdown. Someone might want to start collecting data on sale of contraceptives. Also  I have a hunch that we might see a spike in child births in about 9-10 months from now. Perhaps maternity hospitals should start prepping up.,Delhi,sadness
2020-03-14,Italians are in lockdown  but their spirits (and music) is soaring to reach our hearts all over the world https://www.facebook.com/746947198/posts/10157816782722199/?app=fbl #Covid_19 #Italy #music #Solidarity #spirit #Unity #SocialDistancingNow #StaySafe,Delhi,neutral
2020-03-14,@CMOTamilNadu is under estimate this covid-19,Pondicherry,neutral
2020-03-14,HerolsLFinal#vaathiraid#covid-19#HinduEconomicRights#masterThirdsingle#islfinal#ATKCFC#KHKTAnEmotion ,Jaipur,neutral
2020-03-14,Holiday in schools of Rajasthan also because of Covid-19,Jaipur,sadness
2020-03-14,#corona भगाओ दवाई! take one #dose and you will never get affect with #corona @HinduSabha #COVID #pandemia #coronavirus,Jaipur,anger
2020-03-14,Government declares holiday for school but law and order situation in house deteriorate very badly. #CoronaVirusUpdate #TheGreatBJPLoot #DelhiRains #coronaUK #coronavirus #CoronaAlert #CoronavirusPandemic #COVIDー19 #COVID2019uk #COVID #covid19kenya,Jaipur,sadness
2020-03-14,Closure of schools  colleges  gym  movie halls till March 30 is an astringent & firm move by #Rajasthan Govt to prevent the spread of #Covid_19. We all need to take precautions for the prevention  including regular hand washing &amp; self-isolating in case of any symptoms.,Jaipur,fear
2020-03-14,@ashokgehlot51 My college Jaipur National University  JAIPUR is operational today even after the notice. We as students are really scared of the COVID-19 attending classes. College management says there won't be any precautionary leaves for us even further. @INCIndia @BJP4India,Jaipur,fear
2020-03-14,Cricket is saved from a covid-19 ,Chennai,neutral
2020-03-14,Books for people under home #quarantine #Covid_19,Chennai,anger
2020-03-14,After locking down everything  why don't we lock down all SM apps like @Twitter  @WhatsApp  @Facebook  @instagram &amp; keep in touch with people through old media. I bet not only #COVID19 but many other social viruses will get eradicated immediately. World will be back in order.,Chennai,anger
2020-03-14,Sirji  Please see that opinion of experts from recognised institutions ofhomeopathy  Aayurvedik yunaani are published for prevention of COVID-19 pandemic,Kolkata,joy
2020-03-14,UK citizens are now banned to travel US by Trump to check the spread of Covid19. Covid 19 spreads unchecked because carriers of covid 19 manifest the symptoms after 5 days of being infected. During these 5 days they infect others unknowingly. Thus Covid 19 spreads unchecked.,Kolkata,neutral
2020-03-14,What countries have been affected by the novel coronavirus known as COVID-19? How many cases are there in China? https://infographics.channelnewsasia.com/covid-19/map.html via @ChannelNewsAsia,Kolkata,neutral
2020-03-14,Why Covid-19 is so dangerous for older adults https://www.vox.com/2020/3/12/21173783/coronavirus-death-age-covid-19-elderly-seniors?utm_campaign=vox&amp;utm_content=entry&amp;utm_medium=social&amp;utm_source=twitter via @voxdotcom,Kolkata,fear
2020-03-14,Elderly people are discriminated against by the Covid 19. Covid 19 sends notices to the senior citizens of every nation   saying your services are no longer required for progress and prosperity. Better you ....... It is cruel and unkind. ,Kolkata,neutral
2020-03-14,Europe now 'epicentre' of COVID-19 pandemic: WHO https://timesofindia.indiatimes.com/world/europe/europe-now-epicentre-of-covid-19-pandemic-who/articleshow/74617458.cms?utm_campaign=andapp&amp;utm_medium=referral&amp;utm_source=native_share_tray Download the TOI app now: https://timesofindia.onelink.me/efRt/installtoi,Kolkata,sadness
2020-03-14,From cow states. With the health infrastructure if it's true. It's good. Hindustan Times: Coronavirus: India fights back  7 more patients cured of Covid-19. https://www.hindustantimes.com/india-news/7-more-patients-in-india-cured-of-covid-19/story-KdGoZb0ufeippFwgfz7N2O.html via @GoogleNews,Kolkata,joy
2020-03-14,Are Italians really singing to boost up their morale ? Or are they   specially the elderly persons singing in fear of the imminent attacks of covid 19 ? Covid 19 has been right from the start very unkind to elderly persons. ,Kolkata,fear
2020-03-14,Covid-19 a global challenge needs international initiative no time for blame game.universal bodies like UN  WHO etc are key to preventing &amp; controlling.China and Iran missed early signs be secretive and suffered Pray It is not happening in India. PM’s initiative on SAARC is good,Kolkata,neutral
2020-03-14,@AirAsiaSupport ur chatbot is pathetic I have tried several times for refund of by booking IDs JPW8QB &amp; FQY82L .Out of this JPW8QB FLIGHT is cancelled by u &amp; the other one I am trying to do Voluntary Cancellation due to covid-19 by every time it says something went wrong,Kolkata,neutral
2020-03-14,If people continue to stick to this sanitizing practice even after the whole #Covid_19 thing is managed  it will be the best.,Kolkata,anger
2020-03-14,Chinese President Xi Jinping thanked the Cuban government for its support in the fight against the coronavirus COVID-19 in a phone call that he held with Cuban President Miguel Díaz-Cane on the night . #CoronavirusPandemic #Cuba #China #ChinaCoronaVirus,Kolkata,surprise
2020-03-14,Indian authorities tackling this pandemic menace should take note. Few who've tested positive and not cooperating should be dealt with sternly. #COVID19india --- ‘Intentional murder’: Careless COVID-19 spreaders in Italy could face homicide charges ,Pune,disgust
2020-03-14,@HardeepSPuri Sir please issue notice to all airlines to refund the full ticket amounts to the passengers who want to cancel their upcoming flight journeys considering COVID outbreak ! @MoCA_GoI @ushapadhee1996 @airindiain @IndiGo6E @flyspicejet @airvistara @FlyTruJet @,Pune,joy
2020-03-14, WHO declared COVID-19 as pandemic. Scary  right? Here are a few ways to keep us safe. • Wash your hands frequently. Regularly and thoroughly clean your hands with an alcohol-based hand rub or wash them with… https://www.instagram.com/p/B9ttzVQAgcE/?igshid=1oaz4die4b3yd,Pune,fear
2020-03-14,Ya  its so surprising that no one blames China for infecting the world with COVID-19! Had it been India  whole Christian World would be baying for Hindu blood.,Pune,anger
2020-03-14,covid-19 is more Marxist than any of y’all,Pune,neutral
